id,text,anger,disgust,fear,joy,sadness,surprise
amh_train_track_a_01653,"The sincerity that is reflected in the return is a special diligence; the ability to coordinate is very surprising! You collaborated with him, collected funds and supported Macedonia.",0,0,0,1,0,1
amh_train_track_a_01654,"Let's try to love America today, but let's not set foot in our homeland of Russia!",0,0,0,0,0,0
amh_train_track_a_01655,"Amara Dejen is not a fan of the Ethiopian people, but of the Amara special force, which the Ethiopian people fought with. Why are you not happy?",1,0,0,0,0,0
amh_train_track_a_01656,"There's a strange panic in that neighborhood, except for these mothers who know what they're doing.",0,0,0,0,0,0
amh_train_track_a_01657,Who would have thought that the refugee cabinet that came out of Amara and the refugee and the opposition party Abn Amara would fight and fight and suffer so much to be bound and forced to do so?! Come on!,1,1,0,0,1,0
amh_train_track_a_01658,"Heroes, we thank you especially for your wealth.",0,0,0,1,0,0
amh_train_track_a_01659,What's the point of letting go if he doesn't get tired?,0,0,0,0,0,0
amh_train_track_a_01660,Thousands of South American migrants head to the U.S. border,0,0,0,0,0,0
amh_train_track_a_01661,"Aslamuleykum Warahmatullah Wabarkatuh Umar General Finishing Work Group Join us and take what you want as you sit down below. We take what you want in a safe and quality way in all of Ethiopia. Quartz work, color work, chalk work, frame work, and other things that you don't want to be thrown away.",0,0,0,0,0,0
amh_train_track_a_01662,"She says that she looks like a woman with a lot of beauty, but your mother didn't print it, she didn't finish it, it's embarrassing, I'm a banchi, I'm a dirt, I'm a faceless person, I'm a dirty person, I'm a dirty person, I'm a dirty person, I'm a dirty person, I'm a dirty person.",1,1,0,0,0,0
amh_train_track_a_01663,"It hurts so much, but everyone gets an answer in time. The Holy Synod knows what they are doing. They don't play 4K so easily. This game is better known to the fathers than to us.",0,0,0,0,1,0
amh_train_track_a_01664,"Now, there is a lot or a little of Juwar's contribution to the crisis that we have reached in Al-Nabut, but the Juwar of Tlanet today has either the place where they stood yesterday or the future that we see today.",1,0,0,0,0,0
amh_train_track_a_01665,"honor, thanks and favor to the one whose life is irreplaceable, to the one who gave his life as a guarantee for our survival, to the hero led by our grandfather, to our army, whether it is death, to the anti-Ethiopian and anti-Ethiopianist and the oppressors",0,1,0,1,0,0
amh_train_track_a_01666,The Creator blessed you with the privilege of raising a good son,0,0,0,1,0,0
amh_train_track_a_01667,"Temesgeh Amlake, the Egyptian flag, the sculptures of the Egyptians who say they believe in the hatred of the Oromo, Egypt is closer to you than the Oromo, aren't the threads you tie around your neck made of these colors? Isn't Egypt like the Pope? Are you going to worship the sculptures? Are you the Holy Spirit? Are the Egyptians not the Ethiopian Orthodox until recently?",1,1,0,0,0,0
amh_train_track_a_01668,"It's a very sad story, and it helps you to end the creator.",0,0,0,0,1,0
amh_train_track_a_01669,"It's a pity because it's a natural disaster, what kind of people are you, you're so close, you're helping the mother and the child like a chicken, don't try to be caring for the human race.",1,0,0,0,1,0
amh_train_track_a_01670,"Don't forget to post it on your office, it will come to you one day when it suddenly disappears.",0,0,0,0,0,0
amh_train_track_a_01671,Don't give up hope when you're tested by the many trials you've faced.,0,0,0,1,0,0
amh_train_track_a_01672,Abiy is emotional? 1) Appointment of Khejla Mardasan as Minister of Culture 2) Appointment of Takhlen as Mayor in violation of the AA Charter and not as a member of the House 3) Appointment of Amhara Region in June 2019,0,0,0,0,0,0
amh_train_track_a_01673,"okay, what can i do for you father, you are really a very amazing person, ethiopia will thank you, my father blessed me, really no one understood it, but you are improving the development of ethiopia, may ethiopia prosper and prosper, amen",0,0,0,1,0,0
amh_train_track_a_01674,"Saudi border guards kill hundreds of Ethiopians, report suggests",0,0,0,0,0,0
amh_train_track_a_01675,"It's sad to see so much in childhood, but I don't think she's healthy, it's just hard to describe, the creator hides us like this.",0,0,0,0,1,0
amh_train_track_a_01676,you are a thief and a robber.,1,1,0,0,0,0
amh_train_track_a_01677,"I told you that you are an Ethiopian student who wrote in a system, and the other one who brought the evidence, because of two reasons: 1 Eritrea did not write in a system, 2 the name of the president of the province was not mentioned, and I know that your age is a blessing.",1,1,0,0,0,0
amh_train_track_a_01678,"In the past, the Gurage community did not forget to submit the constitutional request to self-government, and now it seems that it has been dented due to corruption, and now it is suffering a lot of injustice due to its integrity and patience.",1,0,0,0,0,0
amh_train_track_a_01679,"But the government, instead of waiting for this to start, is protecting and separating the different things so that they can be legal.",0,0,0,1,0,0
amh_train_track_a_01680,"Mana, you're so old, this man would have been arrested if he was in America, even if he was beaten like this, even if he was tortured like this, even if he was tortured like this, even if he was tortured like this, even if he was tortured like this, even if he was tortured like this, even if he was tortured like this, even if he was tortured like this, even if he was tortured like this, even if he was tortured like this.",1,1,0,0,0,0
amh_train_track_a_01681,"Aimas, give your work to Hamas, the terrorist Hamas is responsible for this, it's good to know your capabilities, it's great talent, it's very sad, they finished the people, may the God of Israel bring us peace.",0,1,0,0,1,0
amh_train_track_a_01682,we went to them but they didn't come to us but my sister is an ashbari medicine,0,0,0,1,0,0
amh_train_track_a_01683,"The question of the importance of the country, the suffering of society and the value of its roads has been asked for centuries and has not been answered.",0,0,0,0,1,0
amh_train_track_a_01684,Israel is an invader and a child killer: Victory to the Palestinians!!!,1,1,0,0,0,0
amh_train_track_a_01685,Have you become a song for me in your work as a businessman? You are the joy of my heart.,0,0,0,1,0,0
amh_train_track_a_01686,Now what destroyed the war man said the suffering of the innocent and whatever it is wait you Muslims what you want is a religious war yes you want it is your duty you and your kind of Muslims must write what you want yes if you are not comfortable go with the Arabs who are being chased you will get what you want he is telling the world media the kind of live news you are a Jew what is the Muslim,1,0,0,0,0,0
amh_train_track_a_01687,I am surprised to see Ethiopians who are suffering. There is no such thing as supporting the wind with religion. Use your endemic traits here. Don't look away. We are at war with the oppressive system.,1,1,0,0,0,1
amh_train_track_a_01688,"The throat and the throat that make me jealous, the laughter that makes me laugh, the laughter that makes me laugh, the laughter that makes me laugh.",0,0,0,1,0,0
amh_train_track_a_01689,"Father, may Allah protect you, because you believe that quality of life is deserved by all Ethiopians, it cannot be a coincidence that a personality like Mr. Jonas, by coordinating honest Ethiopians, has such a meaningful and positive impact on the lives of citizens, has fulfilled my hope for my country.",0,0,0,1,0,0
amh_train_track_a_01690,"Jawar is very salty in his thoughts, your thoughts are strong, my strength is a calm journalist, but there is nothing that makes a person suffer like suffering.",0,0,0,1,0,0
amh_train_track_a_01691,Awashim Bank is also organized by Allah because he is the one who chooses the color of clothing for the employees he hires. It is good if you do not exceed your limits.,1,0,0,0,0,0
amh_train_track_a_01692,"I would love to say that everything would be in line, but I don't think they would, because it's enough to look at the statements made by the government communications and the special task force.",0,0,0,0,0,0
amh_train_track_a_01693,The Indians won $1.2 million in the lottery that the cleaners jointly bought.,0,0,0,0,0,0
amh_train_track_a_01694,"There are our own experts in all foreign countries, because the Ethiopian has done a lot of things without respecting ours, but the money is better if we sell the shares to the people as the dam, we have our own professionals, there is a lot of shale and shale to extract the gas reserves, there is a conspiracy to make the petroleum experts in each country come and work for a small salary.",1,0,0,0,0,0
amh_train_track_a_01695,"It's nothing but a rebellion against the hatred of the rulers, and we'll pay them the price for their patience.",1,1,0,0,0,0
amh_train_track_a_01696,"Addis Ababa is not a dirty mouth like you, it is the city of love of all Ethiopians.",1,1,0,0,0,0
amh_train_track_a_01697,you must first be peaceful otherwise ethiopia will never prosper,1,0,0,0,0,0
amh_train_track_a_01698,"It's not necessary for a young journalist to be so overwhelmed by something that seems like a miracle, but it's a different kind of power than reporting what a journalist has seen and heard.",1,0,0,0,0,0
amh_train_track_a_01699,Bec has a course in the eyes of the world and not a course in the law things happen like me today I would like everything to be decided fathers keep this faith for us with prayer and wisdom,0,0,0,0,0,0
amh_train_track_a_01700,OLP grew up in hatred of Amhara before the revolution,0,1,0,0,0,0
amh_train_track_a_01701,"And if you suddenly get up from where you are today tomorrow, you may be thinking of becoming the leader of one of our mosques in our respected religion.",0,1,0,0,0,0
amh_train_track_a_01702,A racist is a racist who calls for racism,0,1,0,0,0,0
amh_train_track_a_01703,"Sodo is a document that is timely, even though it is a debt to the vain dream of becoming a center.",1,0,0,0,0,0
amh_train_track_a_01704,"According to this information, the villages of Chomo, Mender 13, M14 in the district of Dale Sedi, where their families are now living, are slightly at risk during the day.",0,0,1,0,0,0
amh_train_track_a_01705,"victory and exaltation to the mighty nation of israel, to the wise minded jonah, to the one who always looks up, to the one who longs for disgrace and death,",1,0,0,0,0,0
amh_train_track_a_01706,"If it is not a conspiracy of this evil one, as it was for the sudden, the work of the unseen? Suddenly, the darkness has overtaken them, and the father of the fathers has overtaken their spirit.",0,1,0,0,0,0
amh_train_track_a_01707,"The woman's shadow is wonderful, we expect a great result.",0,0,0,1,0,0
amh_train_track_a_01708,"It doesn't shock you that you came to our country yesterday and are living in envy, does it?",1,1,0,0,0,0
amh_train_track_a_01709,Why do we do things that we don't have? Why do you use such things as breaking her heart? Why do you use such things as breaking her heart? Why do you use such things as breaking her heart? Why do you use such things as breaking her heart?,0,0,0,0,1,0
amh_train_track_a_01710,"It's a pity that the cadres are like that, it's better to die than to live, it's more expensive to die.",1,0,0,0,1,0
amh_train_track_a_01711,"Rema, who was controversial in Ethiopia, became the talk of the music event in London",0,0,0,0,0,0
amh_train_track_a_01712,"When I became a war for Tigray, when I became a negotiator for Amhara, my kingdom",1,1,0,0,0,0
amh_train_track_a_01713,"They are not afraid of death, they are sheikhs.",1,1,0,0,0,0
amh_train_track_a_01714,what did you do what did you do for ethiopia wash your socks wash your socks leave the other one,1,1,0,0,0,0
amh_train_track_a_01715,Hamas itself is buried in a hidden pit with its slaves. It's sad that the house of Hanyam has collapsed because of the exile. Hezbollah is being beaten. Iran is being beaten with fear.,0,0,0,0,1,0
amh_train_track_a_01716,"If you look at these beasts, they're buying bullets from outside the desert, they're buying bullets from outside the desert, they're not blocking people from each other, they're blocking people from each other.",1,1,0,0,0,0
amh_train_track_a_01717,"When the leader of the disgraceful is arrested and gives a statement, it is understandable to see for yourself how much disgrace the country has caused.",0,1,0,0,1,1
amh_train_track_a_01718,"I don't need to be ordered to approach you, but you've been approaching me for 150 years, so I let you. I'm sorry, you can't dance on my head.",1,0,0,0,0,0
amh_train_track_a_01719,"Lord Jesus, have mercy on you, this is the end of racism, this is why we say racism is a sin, this is why you took your end to the path of sin, you robbed me, I will not inherit the kingdom of God, I have read the whole of Galatians, you cannot submit to the masters, you have to choose between light and darkness, may God have mercy on you.",0,0,0,0,1,0
amh_train_track_a_01720,Is this my fear?,0,0,1,0,0,0
amh_train_track_a_01721,victory for great israel death for hamas and applause dogs only know victory for absit israel,0,1,0,0,0,0
amh_train_track_a_01722,There is no entertainment and today our agenda our church is coming from this is worse be prepared Awash Bank Anti-Orthodox Bank we do not cooperate with our enemies,0,1,0,0,0,0
amh_train_track_a_01723,it's very nice my brother your time is over at home thank god for everything❤,0,0,0,1,0,0
amh_train_track_a_01724,Ilan suggests that free use of X is imminent,0,0,0,0,0,0
amh_train_track_a_01725,And she had to be a beast to her own destruction.,1,0,0,0,0,0
amh_train_track_a_01726,It's a peaceful wonderland. I know the area. It's possible.,0,0,0,1,0,0
amh_train_track_a_01727,modern cadres are what they are kiki is not seeing the terror in the street,1,1,0,0,0,0
amh_train_track_a_01728,"The birth should still be far from Amharic politics! But with Abiy, if he wants to be beaten, he can suddenly be beaten. If Abiy falls to the ground with the beating, we will slap Abiy's head.",0,1,0,0,0,0
amh_train_track_a_01729,May the most merciful Creator send his mercy to both sides and protect our country.,0,0,0,0,1,0
amh_train_track_a_01730,"Ethiopia's Oromo wife, Amara, asks the unexpected question from a member of the council:",0,0,0,0,0,0
amh_train_track_a_01731,"My father, the junta, sent his children abroad to be educated, and the Ethiopian, who did not kill them, was forced to sing and lost his body. It is surprising that they hated the way we lived for 27 years.",0,1,0,0,0,0
amh_train_track_a_01732,The purpose of the housing development guide is to provide free work from the 1090 program program starting from the capacity and needs of citizens 2080 4060 7030 association house real estate etc. the program was created to choose and participate in their choice as an inclusive program to get all citizens if we have a house in terms of curiosity we borrow property we sell but not even we get it quickly in terms of rent,0,0,0,0,0,0
amh_train_track_a_01733,"Islam is peace, Islam is love, I'm not silent, the world can be proven by the word Allah, you can be touched by Allah, Ya'al Gaza",0,0,0,0,0,0
amh_train_track_a_01734,"This is the end of goodness when the authorities put their children in a better country and the poor do not speak sadly, the soul learns to the rest of the law.",0,0,0,0,1,0
amh_train_track_a_01735,supporting the abbey means supporting the country when the country is supported the people will stand the people can walk when they stand the people have grown up if they start walking it means goodbye to the abbey,0,0,0,1,0,0
amh_train_track_a_01736,"I express my deep sorrow for the passing of the university teachers, may the creator rest their souls on his right hand, may God rest their souls, may God rest their families.",0,0,0,0,1,0
amh_train_track_a_01737,Abiy is a threat to Africa and must be removed immediately,0,1,1,0,0,0
amh_train_track_a_01738,"When he himself began to weep for victory, he himself signed the treaty that brought his country into the war.",0,1,0,0,0,0
amh_train_track_a_01739,"Hey Ethiopians, we Eritreans know that Ethiopia is going to collapse when the Constitutional Court of the Autonomous Region of Ethiopia starts to rule on Article 39 of the Constitution of the Autonomous Region of Ethiopia. This is all about war, genocide, murder and displacement of the authorities.",0,1,0,0,1,0
amh_train_track_a_01740,"Semira Hesen is a prankster, I'm afraid of her.",0,0,1,0,0,0
amh_train_track_a_01741,"My sister is unemployed, so what are you going to learn?",0,1,0,0,0,0
amh_train_track_a_01742,Turn off this video! This is a very dangerous way to promote the execution of the devil's purpose! Stop trading in the name of the people of Amhara!,1,0,0,0,0,0
amh_train_track_a_01743,Former Tesla employee denies information that his driverless cars are unsafe,0,0,0,0,0,0
amh_train_track_a_01744,I was happy to see that my children were blessed,0,0,0,1,0,0
amh_train_track_a_01745,Gaza armed soldier Sageel Israel fights a refugee camp and a hospital patient at home fighting for the freedom of the innocent or fighting with the armed on the field,1,1,0,0,0,0
amh_train_track_a_01746,"It's expensive. You can't wear it, but you can't get enough of it. It's the image of a general who paid a price for a country that paid a price. It's the best view of the day.",0,0,0,1,0,0
amh_train_track_a_01747,"because we have a hero, thank god, you are a hero, you are strong.",0,0,0,1,0,0
amh_train_track_a_01748,"Pastor Bini makes us feel alive, but Pastor Zephaniah, when you start comparing yourself to the Blessed Virgin Mary, it's sad, you don't understand, the Virgin Mary will shine your eyes!",0,0,0,0,1,0
amh_train_track_a_01749,What does gossip do?,0,0,0,0,0,0
amh_train_track_a_01750,"These are the lions that are thinking, these are the bellies that are inside! The other invader is coming, and he is going to take our weapons, and he can't fight the lions anymore.",1,1,0,0,0,0
amh_train_track_a_01751,Church of Hauli district where the funeral was held at the time of the funeral of the Defence Forces vehicles were mobilized by the youth to be emotional,1,0,0,0,1,0
amh_train_track_a_01752,"If the first dirty Onegu Abiy Ahmed, who was called a bandit killer from a traitorous country, thinks he is a defender, go and get a dirty bandit!",1,1,0,0,0,0
amh_train_track_a_01753,"I feel sorry for the man who always lies, why doesn't he fight for the country, why doesn't he fight to feed the poor boy, that's all a lie",1,1,0,0,0,0
amh_train_track_a_01754,"It is still competing, and it is a waste to spend the budget on Amara at this time, because if the situation is completely peaceful, it is dangerous, and it would be better to transfer this budget to a secular environment.",0,1,0,0,0,0
amh_train_track_a_01755,Kenyan marathon champion dies in car accident,0,0,0,0,1,0
amh_train_track_a_01756,"There is no Israel fearful and savage in the world, may Allah save them.",1,1,0,0,0,0
amh_train_track_a_01757,"Before he was martyred in the same way as now, the hero and patriot, the determined leader, President Kolem, the government, the martyr, Eritrea, is divided, it is as if a man could not live with his neck cut off. It is said that the year of the defeat of the rebel group, Shahbiya, and the Taliban in the war was a year of pride and pride.",0,1,0,0,0,0
amh_train_track_a_01758,"8 We should remember one thing: political crises are resolved by force, but religious issues have much worse consequences, and we should take advantage of them and understand them because they require special attention.",0,0,1,0,0,0
amh_train_track_a_01759,Parents are reminded to monitor the content of skin ointments used by children,0,0,0,0,0,0
amh_train_track_a_01760,"It's a great message, and that's what I'm happy about for my country.",0,0,0,1,0,0
amh_train_track_a_01761,"Let's pray for the victory of the people, so that the death, persecution and suffering of the people will end: 1 Apologize to the Iobek Christians and their followers. 2 Apologize to the TPLF",0,0,0,0,1,0
amh_train_track_a_01762,And what do you want to express in the image?,0,0,0,0,0,0
amh_train_track_a_01763,"If we hear the death of the comedians every day, what is our guarantee? Don't laugh.",1,0,0,0,0,0
amh_train_track_a_01764,"Josep Borrell at the same time said that Abiy Ahmed is a liar, it is surprising how the Ethiopian people took 5 years.",0,0,0,0,0,1
amh_train_track_a_01765,"I cried with the angels, and it became a prank.",0,0,0,0,1,1
amh_train_track_a_01766,"If you look for a village of bandits and racists, there is no one to benefit the country, there is no knowledge, a generation that is straight, it is like the dust of an empty house, if the envy of the evil one closes his mind, if he always falls, if he is a coward, if he is a coward, what can be expected, what can be expected, what can be expected, what can be expected, what can be expected, what can be expected?",0,1,0,1,0,0
amh_train_track_a_01767,"it took a long time to prove that abiy ahmed was an enemy of the oromo, so it is not possible to say that i do not know the cruelty and murder that abiy is doing in hawaii, abiy means that the enemy of all mankind is the sick and bloodthirsty satan",0,1,0,0,0,0
amh_train_track_a_01768,"It's strange that I've never seen a man die, I've never seen how he's buried, it's strange that if he's buried, what's the harm in it? There are rich people who are buried with them.",0,0,0,0,1,1
amh_train_track_a_01769,"Amen, amen, good day to all of us.",0,0,0,1,0,0
amh_train_track_a_01770,"The movie is very good, but it's a little bit more professional, for example, these are a group of girls who are detectives, they have the idea that they are not investigating a criminal, they are cheating a child with a candy, so the case is suspicious, so either change them to an adult or let them be led by a person with a grudge, but the quality of the film decreases because of them.",0,0,0,1,0,0
amh_train_track_a_01771,"A self-confident, well-educated person who accepts the demands of protesters who oppose the government he represents in a peaceful demonstration",0,0,0,1,0,0
amh_train_track_a_01772,"Don't think that if a farmer doesn't find peace and is replaced by a modern farm, he will be hungry. Read the history of the countries that have been trained in the world. Understand that the farmer has the priority. Then the warehouse office will work for the farmer.",1,0,0,0,0,0
amh_train_track_a_01773,you are a very intelligent servant,1,1,0,0,0,0
amh_train_track_a_01774,"It is sad that Ethiopia has collapsed, it is sad that Field Marshal Ma'areg has been given to Nanette, it is sad that Ethiopia has collapsed, it is sad that Field, the 10th chief without a literary education, is seen here.",1,1,0,0,1,0
amh_train_track_a_01775,"We're going to kidnap you because you're a real racist and a fraud, and when you're hungry, you're going to suffer, you're going to be kicked out of your house, you're going to die, you're going to die, and what have you seen?",1,1,0,0,0,0
amh_train_track_a_01776,"What would you give to someone who wants nothing, wants nothing, who thinks that life and death are seconds? You give nothing to someone who wants to surrender himself to death and give it willingly, you do not raise anything; there is no sense of ignorance and ignorance.",1,1,0,0,0,0
amh_train_track_a_01777,"God has freed her, even though she has eaten the same vegetable, what a joy it is for the children to eat it.",0,0,0,0,1,0
amh_train_track_a_01778,"Parents, the solution is to stay away from nightclubs, advise your children, otherwise we will hear the death of many young people this Christmas. There is no angel in the nightclub, but Satan.",1,0,0,0,0,0
amh_train_track_a_01779,To be elected an Orthodox needs to be persecuted.,0,0,0,0,0,0
amh_train_track_a_01780,It means you have a stomach ache!!! just shut up.,1,1,0,0,0,0
amh_train_track_a_01781,it is not right to compare derg ispan with the revolution at least derg fought for the unity of the country,1,0,0,0,0,0
amh_train_track_a_01782,"Lord, it's very, very sad that we've gone through this ordeal. Lord, save us this year, Exodus and Christ.",0,0,0,0,1,0
amh_train_track_a_01783,"God is patient and great in power, and will not say to the wicked, 'You are innocent.' God has a way in the storm and in the tempest, and the cloud is the dust of his feet; he covers the sea with his scales.",0,0,0,0,0,0
amh_train_track_a_01784,"If you suddenly escape the injustice you have done, the injustice you have done to your son, the tears of the elderly, the cancer of poor blood, you will sell your family and you will not die.",1,1,0,0,0,0
amh_train_track_a_01785,"It's probably a religion for money, and it's okay to say it's a joke.",1,1,0,0,0,0
amh_train_track_a_01786,"He thinks he has a greedy country that has killed even his own friends by force, he worries about the country, he worries about you!!!",1,1,0,0,0,0
amh_train_track_a_01787,"The sexual assault of Blinken, the eviction of thousands from their homes and property, was not an accident or the result of a war, but was deliberate and deliberate.",1,0,0,0,0,0
amh_train_track_a_01788,"I didn't hear the whole story, but I was surprised that a person can't follow the faith he wants, because faith is personal, everyone knows who he saves, he is the one who is asked to do the work, what else did he marry, why don't they shut up?",1,0,0,0,0,1
amh_train_track_a_01789,"Abel, stop talking about us and leave the water.",0,0,0,0,0,0
