id,text,anger,disgust,fear,joy,sadness,surprise
amh_train_track_a_02616,"The Church of the Fano is in distress, we are followers of the Oromo Orthodox, be very careful, beware of these people who say we are fighting, beware of the Fano neck-cutting bishops, you have no place in Oromia.",0,1,0,0,0,0
amh_train_track_a_02617,"What a sad world, Israel is killing children, it's not easy, it may seem cruel, but I would like its citizens to understand the pain of killing children in Israel.",1,0,0,0,1,0
amh_train_track_a_02618,"The thing that bothers me the most is that an ugly woman did an ugly thing to King Charles of England, his wife, when she was freed, when she was hiding with an Arab, when they both died in a car accident.",1,0,0,0,0,0
amh_train_track_a_02619,"I'm sorry, my sister, the creator still gives you strength, there's nothing else I can say, the words of beauty have shortened me, when I hear you, the creator of beauty is not there, hide us from this family.",0,0,0,0,1,0
amh_train_track_a_02620,"Christmas is difficult for the displaced because the roads are often closed, there is no onion, there is no merchandise, and the fear of the displaced has been solved in their lives, according to a commentator who said that it is cold in the district of Kirimu in the eastern district of Oromia.",0,0,0,0,1,0
amh_train_track_a_02621,rumors only fear still shows us a lot urban youth kkayiro gather the youth of the city urban youth,1,0,0,0,0,0
amh_train_track_a_02622,"I swear to God, what should Bikila award be called Bikila Award without a weapon of language colonizers very disappointing opinion if the donkey is the leader of the country says yes the donkey is a wonderful Ethiopian with his own God-given task but the one who builds a good country that represents Ethiopia is a great country that is called 120 million crazy people just sit on YouTube and say it is a rumor",1,1,0,0,1,0
amh_train_track_a_02623,"Where does the history of the third millennium come from, you man who has fooled the people of the north, who has fired an unintentional shot, whose son-in-law's work is exhausted and smoke rises.",1,1,0,0,0,0
amh_train_track_a_02624,"But don't trust Kenya too much, it's likely to suddenly close my career, and the race won't look like a marathon.",0,0,1,0,0,0
amh_train_track_a_02625,"We are playing with the crisis that we are in now, despite the incompetence and parental neglect of the whole, whoever waited for him to move forward with the wave, he did not move, his father woke up in a sleep, he was a public thinker.",1,1,0,0,0,0
amh_train_track_a_02626,A four-year-old girl is among the released Israeli fighters.,0,0,0,0,0,0
amh_train_track_a_02627,"The fact is that the path of the country is not the result of one person, it is clear.",0,1,0,0,0,0
amh_train_track_a_02628,"Is it good to drink to get rid of the stress of being a moderate, or is it not dry?",0,0,0,0,0,0
amh_train_track_a_02629,"You're smart! You're smarter than Satan, and you're like that!",1,1,0,0,0,0
amh_train_track_a_02630,"Wonderful! Hero and his kingdom?! Did you forget or did the singer say: The time when mankind grew like a leaf is forgotten, don't look at this: what did Ginjoro say? It's amazing --- we thought it was for human death: yes! I'll forget the story too. Let's joke, he won't die with the dead: but he won't forget that red kingdom of yours. Please leave it in his name!!!",1,1,0,0,0,0
amh_train_track_a_02631,It was an unforgettable day. May our glory be with our father.,0,0,0,1,0,0
amh_train_track_a_02632,I can't help but admire the wisdom you use to describe the complexity of life.,0,0,0,1,0,0
amh_train_track_a_02633,Daniel Kwon would have been cool to be in the team leadership,0,0,0,0,0,0
amh_train_track_a_02634,"If the journalist wants your renaissance or the airline, he should be ashamed of himself, he can use the port of Eritrea for a reasonable fee, and besides, if the American mercenary Senator Apte returns, there will be no land or sea, and we will not give him free land.",1,0,0,0,0,0
amh_train_track_a_02635,May God be with the children <unk> May peace be with all <unk>,0,0,0,1,0,0
amh_train_track_a_02636,"Death has fallen, hell has triumphed!",0,0,0,1,0,0
amh_train_track_a_02637,Amara Ghedio Gurage Kore etc. How long will we find relief from the oppression of the Oromo?,1,1,0,0,0,0
amh_train_track_a_02638,"I wonder why the truth is hidden in the saying that if Eritrea was liberated by the sea, why is it not understood that if it became independent by the sea, how was it bought by Ethiopia in the beginning of 1942 and 1952? It is surprising that Ethiopia is the only African country that has conquered the country.",1,0,0,0,0,0
amh_train_track_a_02639,we love our enemy and we should support him because he can miss the day when our country will meet again a leader like Dor Abiy his bravery and determination will not go unnoticed without appreciating the ability of the leader he can only challenge his enemies,0,0,0,1,0,0
amh_train_track_a_02640,The death of Al-Sham Lil Palestine for America and Israel,0,1,0,0,0,0
amh_train_track_a_02641,But who is like me who is happy when Jahan smiles,0,0,0,1,0,0
amh_train_track_a_02642,"No, it's not a crime to be a Muslim and speak the truth, but it's a crime to kill a human being.",1,1,0,0,0,0
amh_train_track_a_02643,What happened between the two famous Romanian singers?,0,0,0,0,0,0
amh_train_track_a_02644,"Amara Sithart says it's better than a famine war, so it's just a matter of fighting a four-kilometer herd of donkeys and bringing them to Madagascar!!!",0,1,0,0,0,0
amh_train_track_a_02645,"Allah, the Lord of the Worlds, the thief, the thief, the thief, the thief, the thief, the thief, the thief, the thief, the thief, the thief, the thief.",0,1,0,0,0,0
amh_train_track_a_02646,"When the war started, it was clear that the world was Jewish, and when it started, it was clear that it was a band of terrorists. When the war started, Putin's boss, Prigozhi Bakmut, said that he was a friend of Netanyahu, and he changed his clothes. He even became the spokesman for the world, and he was the one who waited for the round.",0,1,0,0,0,0
amh_train_track_a_02647,"This is the same as the one who broke your heart with a lie, and you, the pencil prank, okay, beautiful hell, who repays him, pay him back, very beautiful.",0,0,0,1,0,0
amh_train_track_a_02648,"You are such a politician for Derek, you are such a judge for a tough player, Derek, I stood up and applauded you. I will keep this historical interview for my 12-year-old daughter, I said that this is how I was in 2016.",0,0,0,1,0,0
amh_train_track_a_02649,The mouth hurts the most with its mouth.,0,0,0,0,1,0
amh_train_track_a_02650,"God have mercy on you, this kind of hatred is a disease, it's from the ground.",1,0,0,0,1,0
amh_train_track_a_02651,"For those who have understood the mother's corner, believe in her son, pray for him, she will perform miracles for those who have asked for it. I am a witness, she has done a lot for me, if it was not done for you suddenly.",0,0,0,1,0,0
amh_train_track_a_02652,"It is surprising that the employers of Habasha are so unjust to their own people, it is empty, everyone who throws them from the floor reaps what he sows, goodness is for himself, do not be unfair to the workers, you will inherit misery for your children and grandchildren.",0,0,0,0,0,0
amh_train_track_a_02653,Is it the death of the Illuminati? Father? Let's bring the death to the forefront,0,1,0,0,0,0
amh_train_track_a_02654,"Just as Christ was betrayed by being kissed and sold, so Ethiopia was betrayed by being kissed and sold, so Ethiopia was betrayed by being sold, so Ethiopia was betrayed by being sold.",0,1,0,0,0,0
amh_train_track_a_02655,"You Jews, we are inside the building, you beasts, don't look at the criminals, you terrorists, you terrorists, don't feel sorry for the people.",1,1,0,0,0,0
amh_train_track_a_02656,The appeal of the terror defendants was rejected by the court,0,0,0,0,0,0
amh_train_track_a_02657,Where is this media that writes from above is the creator of terrorism the country is sitting like this and it is surprising that it accepts,1,0,0,0,0,1
amh_train_track_a_02658,"Thank God that the word of our Father gives us life, that he hears our cries, that his grace multiplies us in their prayers, that he thinks of us, that he heals us, that he blesses us, that he blesses us, that he blesses us.",0,0,0,1,0,0
amh_train_track_a_02659,"Be sure that the arrow that was thrown at you is the arrow that was released, but is your age only as long as the arrow that was thrown at you?",0,0,0,0,0,0
amh_train_track_a_02660,"Shishay Teklemariam, if you die, your faith in Christ is worthless; those who belong to Christ are alive, because Christ is alive.",0,1,0,0,0,0
amh_train_track_a_02661,"Who is like me, Umar, who is happy to know the secret",0,0,0,1,0,0
amh_train_track_a_02662,"You think that the adults will do the crime and get justice from them, the creator will put his soul in heaven for us, the first person who was interviewed was called the rich man, he spoke in a very fearful manner, he covered it up, the second person was the bad one, but he explained the situation well, the creator comforted you.",0,0,0,0,1,0
amh_train_track_a_02663,"This is the first attack, the last one, and you don't think Palestine will be the first to love Israel.",0,1,0,0,0,0
amh_train_track_a_02664,"I think it's very good that you've approached it so far, but today, if you leave out the fact that Hamas has taken immediate action and said that the war has begun, because the plan that the United States and Israel put forward earlier to change the Middle East before the war was presented by the Israeli leader in September and received with applause, this is the result of the separation of the northern Gaza Strip from Palestine.",0,0,0,0,0,0
amh_train_track_a_02665,Canadian Prime Minister forced to stay in India due to technical malfunction of his plane,0,0,0,0,0,0
amh_train_track_a_02666,"I, as an Eritrean, can say one thing for sure, you will not be a sea owner if you accept it, but you can use it, I will give you transportation services, you can give me your father's inheritance, but his mind is healthy, just start the war and let's see the results together, Khadija",1,1,0,0,0,0
amh_train_track_a_02667,"When the door of the cell is slammed against you and you realize that the displacement of death is not a 40-day gift shared and that suddenly the palace guards change, you are in any case",1,0,0,0,0,0
amh_train_track_a_02668,"If you are a student of truth, try to live what you have lived for seven years. You are the one who stands boldly in ignorance, who is unthinking, who is not supportive of the person, who always tries to stand in the mind of the person.",1,1,0,0,0,0
amh_train_track_a_02669,"you are a journalist, you are a shocker, you are a messenger, enter the valley, the death of amara is bread for you and your bosses",1,1,0,0,0,0
amh_train_track_a_02670,"Millions of citizens have been displaced from their homes and are dependent on tents. The country has been ravaged by the worst war in history, with citizens suffering greatly.",0,0,0,0,1,0
amh_train_track_a_02671,"There is no army here that can drag away everything that has been thrown at it, you condemn those who have committed this dangerous conspiracy more than the Ohaded Ohangans who have made the difference as engineers.",1,1,0,0,0,0
amh_train_track_a_02672,"Gashte thought about the good, and the book is good for himself! He has no regrets for tomorrow, and the man teaches.",0,0,0,0,0,0
amh_train_track_a_02673,"God, what do we hear? May God be cruel and bring us a good time. The Virgin Mary supports you with her words.",0,0,0,0,1,0
amh_train_track_a_02674,"Putin's rival politician Alexei Navalny died in prison, officials said.",0,0,0,0,0,0
amh_train_track_a_02675,"I hadn't heard of the death of the Cissy Agena and the Suyum, but I had heard that a man's soul is learned in vain.",0,0,0,0,1,0
amh_train_track_a_02676,"Abed Benjamin is a contractor! Shame on you, your pastor.",1,1,0,0,0,0
amh_train_track_a_02677,It's amazing that you're talking to this guy.,0,1,0,0,0,1
amh_train_track_a_02678,"What do the babies do for a living? Al-Hamdulilah said, ""Islam forbids even the babies to go to the cemetery, and women are forbidden to go to the cemetery themselves because their counselors can't grieve"".",0,0,0,0,1,0
amh_train_track_a_02679,"The introduction to the Christian parliamentary question applies to all of you, including the cadres.",1,1,0,0,0,0
amh_train_track_a_02680,"If an Israeli soldier fights on foot, Hamas is more than enough, there is no need for anything else, but the children of the world are training to defend themselves.",1,0,0,0,0,0
amh_train_track_a_02681,"It's being done right, and it's going to be a great ride. I'm sure it's going to be a great ride when it gets to the beach. Then we'll take it to the beach.",0,0,0,1,0,0
amh_train_track_a_02682,The age when human actions are less than dogs,0,0,0,0,1,0
amh_train_track_a_02683,"As in the past, when a terrorist uprising with a twisted extremist turns into a terrorist uprising, the debate between himself and others, including the one that separates the people in every city, turns into a terrorist uprising, instead of calming down the people.",1,1,0,0,0,0
amh_train_track_a_02684,Ethiopians who tried to enter Saudi Arabia fired shots at us,1,0,0,0,0,0
amh_train_track_a_02685,"Man of God, I love you very much, we love you, you are the leader of my whole family, the disciple of my whole life, the teacher of my whole life, nothing is wrong, the stomach does not thank me, Jesus has shown me the truth.",0,0,0,1,0,0
amh_train_track_a_02686,"Ermi, what's the matter with you? You're looking at me like I'm an unexpected change.",0,0,0,0,0,0
amh_train_track_a_02687,Houthis who have crossed the Red Sea are blocked from cutting off an underwater Internet line,0,0,1,0,0,0
amh_train_track_a_02688,"Apple has unveiled its Augmented Reality (AR) technology, which costs 190,000 rupees.",0,0,0,0,0,1
amh_train_track_a_02689,"In the morning, the good news is that the love commando was released on bail of 2,000 rupees this morning. Teddy was released on bail of 2,000 rupees three days ago on Tuesday. Alex and Solomon were released on bail of 10,000 rupees each.",0,0,0,1,0,0
amh_train_track_a_02690,"OMN used to call Hachalu when it wanted to attack the big squads of Amaran and Amaran, and on the other hand, when it wanted to insult the TV information, it used to call Alexander, and it was necessary for the mob to kill Hachalu with a rope.",1,1,0,0,0,0
amh_train_track_a_02691,"Why did you forget that the first and foremost community media in our country is SMN? Why did you stop it? Why did you stop the airtime for the diaspora before? Let the public media go public! If you want to stop your own media, stop it!",1,0,0,0,0,0
amh_train_track_a_02692,"It's true, but in addition to the many weapons that were exposed in Gaza yesterday and controlled by the Israeli army, you didn't mention that Hamas had stored them in a health station, that they had gone into hiding in fear.",0,1,0,0,0,0
amh_train_track_a_02693,we will make ethiopia attractive only when we focus on development instead of war.,0,0,0,0,0,0
amh_train_track_a_02694,"Hey, Sarina, you're not right. Even though the EHADG didn't give us anything, he gave us peace. Suddenly, by chance, he was the partner who led the coalition of the kingdom.",1,0,0,0,0,0
amh_train_track_a_02695,"The Junta, which has been in power for 27 years, has made a lot of money by building the Abyei, but in the year of the collapse of the economy, the Abyei, who are the heroes of the people, have been left behind.",1,1,0,0,0,0
amh_train_track_a_02696,"Mr. Wadmu was already very much loved and respected, but in today's conversation he is very upset with me because he mentions the family, and we are sorry for the defeated Amaran Bsota and the struggle against the one who was killed for the family.",0,1,0,0,1,0
amh_train_track_a_02697,That's what Pastor Prank is all about.,0,1,0,0,0,0
amh_train_track_a_02698,"Their master removed four senior leaders, including the world's top leader, Gebrehad.",0,0,0,0,0,0
amh_train_track_a_02699,The death of children at the hands of explosives in Margalla Ghat makes us remember the war.,0,0,0,0,1,0
amh_train_track_a_02700,but what kind of a demon is abey my wife amara is the one on his head and my mother is the same and my children are amars etc. all this is amara if he knew his hatred,0,1,0,0,0,0
amh_train_track_a_02701,"Even if you think you're right about the issue that you're arguing with someone else, it's going to reduce your desire to avoid conflict by allowing it to be resolved through negotiation, because conflict can have unintended consequences.",0,0,0,0,0,0
amh_train_track_a_02702,"We don't know where we came from, that's why we're called dictators, it's not good for the country or the people.",0,0,0,0,0,0
amh_train_track_a_02703,"In a peaceful city, it's clear that all this turmoil and weapons are to intimidate who, more than the fear of what you're doing, your terror tells us.",1,0,1,0,0,0
amh_train_track_a_02704,"Our father, Abu Zebedee, you should make the sky a song, you should be a house of prostitution, but you should be an Ethiopian.",1,1,0,0,0,0
amh_train_track_a_02705,"And I said, ""We are not afraid of oppression, we are not afraid of oppression, we are monks of the Amhara, we are the victors of the freedom, the glory, the glory of the strong fighters, so Amhara will fight for the glory"".",1,0,0,0,0,0
amh_train_track_a_02706,Teacher God bless you but he teaches about songs and singers but he hurts when he leaves this world in death without entering the world of music because the singers do not want to enter the world of music he says say the great book of God may we always return to enter the world of music for the rest of us may God give comfort to his friends and admirers,0,0,0,1,1,0
amh_train_track_a_02707,"Kiki, now a little bit from the sale of blood to your income to the bloodless and unmade by talking and shouting, come a little bit from here like a flock of flies, you are running away from the wind of lies, you are laughing at it, you are laughing at it, you are laughing at the media, you are laughing at the people, you are laughing at the media, you are laughing at the people, you are laughing at the media.",0,1,0,0,0,0
amh_train_track_a_02708,And the Jews are among the disbelievers. Allah is the loser.,1,1,0,0,0,0
amh_train_track_a_02709,"You're wrong about this conversation, this pot.",0,1,0,0,0,0
amh_train_track_a_02710,"I'm sorry, you're the devil's father, Ahmed, the innocent elderly, the one who kills children and women, the one who kills women, you call him Akbar Antu, you call him the minister, you call him the doctor, we'll listen to you, you'll beat up Ethiopian journalists, we'll do the same to you.",1,1,0,0,0,0
amh_train_track_a_02711,"Blessed are the saints, we had a good time. Glory be to the Lord, Hallelujah, Amen.",0,0,0,1,0,0
amh_train_track_a_02712,"Now the people of Ethiopia are suffering from the war and famine in the country, and the refugees outside are suffering from prison.",0,0,0,0,1,0
amh_train_track_a_02713,"It's a very nice expression, Fima, the light of the julla, about the standard of protection that they set, the flower was renewed, it was reinforced, it was repeated, it was thought that it would be better to use an inner tube to treat the enemy, to treat Ethiopia.",0,0,0,1,0,0
amh_train_track_a_02714,"Stop thinking about your relatives and the heads of the rich, sometimes you put your own mind in it, just spreading false rumors does not reduce the pain of the Amhara",1,1,0,0,0,0
amh_train_track_a_02715,"I'm not ashamed to say that the mountain nation is academically intellectual, but it's stupid and lying. Amara has no country. It's dictatorship.",0,1,0,0,0,0
amh_train_track_a_02716,"460 Our mothers darken the joy on their faces. Have a little respect for mothers, anyway.",1,1,0,0,0,0
amh_train_track_a_02717,"My heart is broken, my mother, God will make your end beautiful.",0,0,0,0,1,0
amh_train_track_a_02718,"As long as there is a Tigray separatist group, the suffering of Ethiopia will continue. Under the Algiers Agreement, Eritrea will take back its land. The people and land stolen from Wollo and Gondar have been restored.",1,1,0,0,0,0
amh_train_track_a_02719,"When you touch someone's heart, it's good to see the end.",0,1,0,0,0,0
amh_train_track_a_02720,A leader who is followed by a follower is a follower,0,0,0,0,0,0
amh_train_track_a_02721,Thank you. It's an amazing article.,0,0,0,1,0,0
amh_train_track_a_02722,"You don't come out of this cell because you've seen what you can't see. You're like a country that's broken. Instead, why do you see so much because you say give me your age?",0,1,0,0,0,0
amh_train_track_a_02723,Why do the authorities sometimes only look at what death looks like?,1,0,0,0,0,0
amh_train_track_a_02724,"When the West, which has embraced the AAP as a pagan, national foundation, banned the AAP from entering the cities of Shewa, the AAP was humiliated by the OLAF.",1,1,0,0,0,0
amh_train_track_a_02725,"You are not called a scoundrel, you have been accused of this bloodshed, Dr. Drege is the voice of the people with the heart of Christ of truth.",0,1,0,0,0,0
amh_train_track_a_02726,what kind of journalist am i,0,1,0,0,0,0
amh_train_track_a_02727,Pastor Bini's haircut is the old woman's breast. It looks like a chicken head.,0,1,0,0,0,0
amh_train_track_a_02728,"You have cursed yourself with your words in Israel, and magic will not work without Israel. This world's religion, the whole book is a lie. The word of the foot works.",1,1,0,0,0,0
amh_train_track_a_02729,"may the god you trust still fix your life, sister",0,0,0,0,1,0
amh_train_track_a_02730,"I will support what is good for my country if we work together with Eritrea, he said.",1,0,0,1,0,0
amh_train_track_a_02731,"Today, the unprecedented Duyabilos, who is called Abiy, is the leader of Ethiopia, carrying the flag of six thousand six hundred and sixty-six, leading the way, draining the blood of the Ethiopians. But Satan always wins, and the kings, the nobles and the tyrants will perish.",0,1,0,0,0,0
amh_train_track_a_02732,"Why did the Lord love man so much that he died? What is man, and who is he that has received from the Creator undeserved mercy and kindness?",0,0,0,0,0,0
amh_train_track_a_02733,It is very sad to see the leaders of Tigray in the midst of the air force that has made Tigray a mess. It is very sad to see the remaining prosperity and recruitment madness on Thursday.,0,1,0,0,1,0
amh_train_track_a_02734,"good dancing time, miko, you're brave. tomorrow is a prank. we'll be happy, we'll be happy.",0,1,0,0,0,0
amh_train_track_a_02735,"800 thousand Tigrinya youths were sacrificed for this purpose, right? The TPLF does not represent the Tigrinya people in South Africa.",1,1,0,0,1,0
amh_train_track_a_02736,"May Allah kill him, swallow him as a flood of the blood of his children, show his suffering to the world.",1,1,0,0,0,0
amh_train_track_a_02737,"Somali region is being called a government tax, illegal work and dangerous exploitation of the people of Somalia is taking place, please do it for the administration.",0,0,0,0,1,0
amh_train_track_a_02738,"If there is any power that can stop this, let us pray that God our God will shorten the day of our suffering for the sake of his saints!",0,0,0,0,1,0
amh_train_track_a_02739,people are said to have died due to drought in the surrounding areas of Amhara and Tigray regions,0,0,0,0,1,0
amh_train_track_a_02740,"O vast Oromo people, oh, oh, how many atrocities have been committed in your name by the Oromo gangs, let the history of the Oromo gangs be the history, it will not change, it will not change, it will not be blocked, it is the history of you, you are the gangs of the Oromo people, what is your history, where is your history, what is the history of the gangs, please don't forget Allah.",0,1,0,0,0,0
amh_train_track_a_02741,"If we hadn't been healthy and sane, we wouldn't have had a hard time waking up, but our relationship is worse and our inability to see inside has led us to be attacked by demons. I'm sorry, I'm sorry, I'm sorry, I'm sorry, I'm sorry, I'm sorry.",0,0,0,0,1,0
amh_train_track_a_02742,"The truth is that the day I came out in support of the rich is a cursed day, justice.",0,0,0,0,1,0
amh_train_track_a_02743,It's not the people's decision.,0,0,0,0,0,0
amh_train_track_a_02744,"The sorrow of Palestine eats away at my heart, but if they are released, you will kill them for free.",0,0,0,0,1,0
amh_train_track_a_02745,Take my sister away from all this injustice and tell my mother that I still love her. May God give you strength.,0,0,0,0,1,0
amh_train_track_a_02746,"And when he was asked for a ten million reward, was it because he was an angel that he was suddenly chosen by the government?",0,1,0,0,0,1
amh_train_track_a_02747,We would like to thank Mr. King for presenting the real problems of the country.,0,0,0,1,0,0
amh_train_track_a_02748,"These are the people who are ashamed of what happened, and we must take revenge together, and we must take revenge until they hate the creation of the Northmen, and they are the ones who are hurt by inferiority.",1,1,0,0,0,0
amh_train_track_a_02749,"yes, it's love, but how much is your salary?",0,1,0,0,0,0
amh_train_track_a_02750,"This is the man who stood up for the truth, this is the man who stood up for the truth, this is the man who stood up for the truth, this is the man who stood up for the truth, this is the man who stood up for the truth.",0,0,0,1,1,0
