id,text,anger,disgust,fear,joy,sadness,surprise
amh_train_track_a_00837,"It's very beautiful and it's beautiful, it's eye-catching, and I think the priority of my citizens to appreciate this beautiful project is to make sure that the association is guaranteed.",0,0,0,1,0,0
amh_train_track_a_00838,"Congratulations to the entire Amharic people, who are fascinated by the world's love for our ancient language, the second most spoken language in the world after Arabic, Amharic in Russia, France, America,",0,0,0,1,0,0
amh_train_track_a_00839,Chinese court sentences Australian to death for espionage,0,0,0,0,0,0
amh_train_track_a_00840,"Abiy went to Italy last time to consult the Synod, which was divided, and today he went to consult its leader on the riots in the Amhara region.",0,1,0,0,0,0
amh_train_track_a_00841,"It is known that you cannot be a threat to the Oromo people, whether you are attacked or not. The Oromo people have great respect for their people.",1,0,0,0,0,0
amh_train_track_a_00842,It's a pity that Ethiopia has become a country humiliated by its leaders.,0,1,0,0,1,0
amh_train_track_a_00843,"Mary said, ""Peace is dead, it's dust, it doesn't hear, every creature is together in the end, we wake up, the sky doesn't hear, God, no treachery, don't forget, don't listen, except to our creator"".",1,0,0,0,1,0
amh_train_track_a_00844,"We are very saddened by the loss of their loved ones and the loss of their children, and we would like to extend our condolences to the families of the deceased.",0,0,0,0,1,0
amh_train_track_a_00845,Amara Sithart says that the mother is drunk for the drink is surprising?,0,0,0,0,0,1
amh_train_track_a_00846,"oh, it's very strange how nice it is to see the son of the 50th commander, the whole thing you said, mom used to tell us how much he loved my first son, how kind of a time it was, mom was alone, the meat your father allowed her to give to the crown, the honor she had for Mukriya, she would hang with the army, mom used to tell us that I am the son of Askaleh, tell us how much we love each other",0,0,0,1,0,1
amh_train_track_a_00847,North Korea announces the launch of more spy satellites in the new year,0,0,0,0,0,0
amh_train_track_a_00848,It's surprising to be considered a disapproval of the Ethiopian savior of a tradition. Ermias go a head!,1,0,0,0,0,1
amh_train_track_a_00849,"If death is death, then death is death by the sister's hand.",0,0,0,0,0,0
amh_train_track_a_00850,And the scribe who remembers him is no better than him.,0,1,0,0,0,0
amh_train_track_a_00851,"There are two chapters of wounded love in the anger of Caiaphas, the patience of Leon, the patience of Yildiz, the patience of Alger Bayt, the patience of Aziz, the courage of Javed, the intelligence of Yakup, the intelligence of the Turks, the patriotism of the Greeks, the friendship of the Turks, the combination of the three Himalayas, the friendship of the Ethiopians, the courage of the Ethiopians, and many other things that are not known.",0,0,0,1,0,0
amh_train_track_a_00852,"Abiy Asad, the only Malagasy dictator who proved Amil's claim to be a lie",0,1,0,0,0,0
amh_train_track_a_00853,"The main reason for the fall of the Derg was because of hatred of religion, because it was led by a conspiracy, and it was a denial of religion.",1,0,0,0,0,0
amh_train_track_a_00854,The time has come to deceive the people by using golden words to describe what is not in you. It is very common propaganda. Millions of people are preaching about love.,1,1,0,0,0,0
amh_train_track_a_00855,"I didn't expect you to die, but you came back, and God said,",0,0,0,0,1,0
amh_train_track_a_00856,God is waiting for me very much.,0,0,0,0,1,0
amh_train_track_a_00857,"Haliday, what's the matter with you? If you don't get a chance today to tell my son that you owe him,",1,1,0,0,0,0
amh_train_track_a_00858,you are grown up my country is divided but he is not like that because he is a competitor they are forced to enter peace because they do not like it when he gets down from emotion we saw that Jawar is a smart and mature politician but I am one of the few smart journalists in Ethiopia so you deserve the honor of Saak,0,0,0,1,0,0
amh_train_track_a_00859,"Denise and Jan deserve love, they wanted to find a reason for Narin to talk to Farhat, so they turned to her.",0,0,0,0,0,0
amh_train_track_a_00860,The Israelis are calm and don't move. 😀 😀,0,1,0,0,0,0
amh_train_track_a_00861,"The children and the tears of the mothers who made them like ashes, like the tears of the mother who made them like ashes, like the tears of the mother who made them like ashes, like the tears of the mother who made them like ashes.",1,1,0,0,0,0
amh_train_track_a_00862,"We have forgotten the parliament and the four-kilometer palace, have we hired them? Par Chere sent an unexpected message to his authority.",0,0,0,0,0,1
amh_train_track_a_00863,"An unofficial request is expected to be made to Eritrea... about the government's decision to resolve the war crisis of the past 18 months through negotiations. We would like to express our cooperation with a friendly country, Eritrea, to release the territory of the Tigray region that it has occupied as a result of the war... to avoid border clashes... and to continue to ensure local peace.",0,0,0,0,0,0
amh_train_track_a_00864,"There are 149,000 of them, most of them are in camps, they've gone to Kenya and Uganda, they've gone to Juba, they've gone directly to the UNHCR, they're still slaves and colonies, and we can't change the history, and no one knows that they're a hard-working people, because they didn't give them the balls.",1,1,0,0,0,0
amh_train_track_a_00865,True hearts and good spirits are invincible armies.,0,0,0,0,0,0
amh_train_track_a_00866,"No, you're going to create terror in the house of a gangster.",1,1,0,0,0,0
amh_train_track_a_00867,everything we hear is horrible for the family may allah give you patience,0,0,0,0,1,0
amh_train_track_a_00868,It's good to be surprised when a baby boy and a teenager lose their voices.,0,1,1,0,0,0
amh_train_track_a_00869,"It's amazing Wow Kahun Buhala we don't need a story, a debate or a monument Bravo the father and the savior",0,0,0,1,0,1
amh_train_track_a_00870,"Abayi Media Adarbay Media reduces the conflict in the Amaran region to show cooperation with the human rights government, which will pass the day",0,1,0,0,0,0
amh_train_track_a_00871,"Hamas did not know that it could destroy Israel without its own forces, and the outbreak of war has already led to the deaths of two innocent civilians, sadly,",0,0,0,0,1,0
amh_train_track_a_00872,Canadian bread house fined 50 million Canadian dollars for price hike,0,0,0,0,0,0
amh_train_track_a_00873,"What kind of man is it that you can't kill? Like you, it may be that the stomach of the sperm in the sperm bag is also broken, but thank you for the work that has been done here.",0,1,0,0,0,0
amh_train_track_a_00874,"But I would love to be confident, just get married.",0,0,0,1,0,0
amh_train_track_a_00875,"hello, abiy asmaisi is a liar, his tongue is a poisoned message to kill ethiopians abroad, including drones",0,1,0,0,0,0
amh_train_track_a_00876,ITV how many people are running and hiding when human dogs bite and bite and bite and bite and bite and bite and bite and bite and bite and bite and bite and bite and bite and bite and bite and bite and bite and bite and bite and bite and bite and bite and bite and bite and bite and bite and bite and bite and bite and bite and bite and bite and bite and bite and bite,1,1,0,0,0,0
amh_train_track_a_00877,"The Church of the United Kingdom says: ""We will cast out Satan"".",0,0,0,0,0,0
amh_train_track_a_00878,It's amazing how much the doll is worth.,1,0,0,0,0,0
amh_train_track_a_00879,"at your age, how many trials have you seen? it's hard to believe the suffering of a girl, that mother",0,0,0,0,1,0
amh_train_track_a_00880,"It's not the number, it's the quality, it's the heroism, it's the insight, don't touch me, it's the cowardice, so haven't you heard the message of your relatives who are fascinated by the front of the forest?",1,1,0,0,0,0
amh_train_track_a_00881,how did you bring it to me at night? i didn't sleep. i did it because i wanted to talk to you. i thought you were my sister. you are the father of tears. bless the creator.,0,0,0,0,1,0
amh_train_track_a_00882,"""When the bombs fell, I told my son, 'It's an action movie.'""",0,0,0,0,0,0
amh_train_track_a_00883,"Ethiopian and Orthodox enemies of Tigray will never be forgiven, the racist thugs from Tigray have earned their price, but the poison they sowed for us has been spared for themselves.",1,1,0,0,0,0
amh_train_track_a_00884,our religion is not a religion but a country! there is a slogan logic,1,0,0,0,0,0
amh_train_track_a_00885,"As I've noticed, in our culture, the language we use to express our feelings makes the other person feel emotional.",0,0,0,0,1,0
amh_train_track_a_00886,U.S. believes it has launched a drone over Gaza,0,0,0,0,0,0
amh_train_track_a_00887,"It's a great thing that no one is getting up and saying, ""Pranc"".",0,0,0,0,0,1
amh_train_track_a_00888,It's another day tomorrow!,0,0,0,0,1,0
amh_train_track_a_00889,"The wages of sin is death, says the Bible, God's work is wonderful, he cleans the face of the unborn child, the Creator blesses your days.",0,0,0,0,0,0
amh_train_track_a_00890,Is there a segment of society that doesn't like disgusting lectures?,0,1,0,0,0,0
amh_train_track_a_00891,"You have made the dream a false agenda, a fearful and suspicious one, you who have no expense, who do not suffer, who mock the blood of the people, you can lead as a bear.",1,1,0,0,0,0
amh_train_track_a_00892,"Globalization is knocking on our door, it's preventing us from paying our debts, so when are we going to wake up and give priority to science and research, and raise our country to the top, and wake up our country to dream together, and help us, thank you, Brook.",0,0,0,0,1,0
amh_train_track_a_00893,Is it all numbers?,0,0,0,0,0,0
amh_train_track_a_00894,"When you can't face Fanon in the name of defense, you say it's cheating to kill babies and old women with drones, but you can't escape the hands of the masses.",1,1,0,0,0,0
amh_train_track_a_00895,"American discourse is often contradictory, accepting dangerous tools that crush human beings, talking about kissing, losing her peace in the Western world, being seriously ill.",1,1,0,0,0,0
amh_train_track_a_00896,"I'm afraid to say it, I'm holding on to my word, I'm brave, you're mine, I'm mine, I'm not mine, something has broken my heart, it's too much, it's not too much, it's broken my heart.",0,0,0,0,1,0
amh_train_track_a_00897,"Allah Akbar's victory is still a disgrace to the Palestinians, the defeat is still a disgrace to the cursed Buddha, let the man be the Jew.",0,1,0,0,0,0
amh_train_track_a_00898,I don't even see you when he's wrong.,1,1,0,0,0,0
amh_train_track_a_00899,"You who have troubled us, you who have covered us with the tears of the people's oppression in the house of V8 and Villa, we do not see or hear you, and now you have made your cloaks to tell us the story, you have left us without living in the truth and in the truth, so first examine yourselves, fathers, be one, do not cover yourselves with seeds, make your voice heard for your good.",1,0,0,0,0,0
amh_train_track_a_00900,"I've never tried the so-called look, so please make me happy today.",0,0,0,1,0,0
amh_train_track_a_00901,"People should not listen to them because they work for the people and they do not stop and they do not buy for the people but for their stomachs, teach them that we are not in front of the people, the people are before us.",1,1,0,0,0,0
amh_train_track_a_00902,"Nur Zalan, do you know the cow, the cowboy?",0,1,0,0,0,0
amh_train_track_a_00903,what kind of dirty ashamed you are,1,1,0,0,0,0
amh_train_track_a_00904,"You are not a journalist, you are a politician, you give everything to the people of Ethiopia, one country, one Orthodox religion, one condom, one Amharic, one Amharic, one Amharic, one Amharic, one Amharic, one Amharic, one Amharic, one Amharic, one Amharic, one Amharic, one Amharic, one Amharic, one Amharic, one Amharic, one Amharic, one Amharic, one Amharic, one Amharic.",1,1,0,0,0,0
amh_train_track_a_00905,"He said, "" Tell the Elders to stop looking for the mighty. """,0,0,0,0,1,0
amh_train_track_a_00906,It is very surprising that the young people whose souls were tortured in the war are reflected in the hopes of Ethiopia.,0,0,0,1,0,1
amh_train_track_a_00907,I'll find him under you again,0,0,0,0,0,0
amh_train_track_a_00908,"You're so strong, I can't control my tears.",0,0,0,0,1,0
amh_train_track_a_00909,Biruk Abera racism what is racism sell and you are standing on another racism,1,0,0,0,0,0
amh_train_track_a_00910,"It is sad to see that the Prime Minister's salary is being wasted in the parks and the people's main thing from the government is peace, not parks, otherwise the tourist will run away and not come to visit.",0,0,0,0,1,0
amh_train_track_a_00911,"Mr. Takle said that the geological survey was a matter of concern, and the hydrogeological department was partially concerned about the water resources, but did not disclose any information from the earth.",0,0,1,1,0,0
amh_train_track_a_00912,"In short, Amaram is an extremist racist, and you are right not to say that OLD is right!",0,1,0,0,0,0
amh_train_track_a_00913,"It's very sad that I don't think that such a cruel and cruel person can be a healthy person...? My mother, may Allah help you to achieve your goal, you are very strong and you have endured the hardships of this oppression, may the Creator support you in your goal...!!!",0,0,0,0,1,0
amh_train_track_a_00914,"This is a classroom, the chairs and the classroom are waiting for the teachers, what worries me more than the emptiness of the classroom and the chairs that have lost their seats, is that if the classroom is full of students who are filling the flows with emptiness, hope and do not know why?",0,0,1,0,1,0
amh_train_track_a_00915,"Dear Anku Mere, you are special, I am lucky to see and see this in my generation, my country Ethiopia will still be seen as higher than the country of Europeans, Allah give me life and health, be strong, be strong, be strong, we Ethiopians, counted in millions, we all love you, we want and we follow you.",0,0,0,1,0,0
amh_train_track_a_00916,"You will be left in the corner of the streets of our capital, you will be left in the corner of the streets of our capital, you will not be a country with a stone and a plant, you will destroy the life of the noble human being as a joke, you will destroy the country and the wealth, you will say that some place has flourished, you will be confused, you will be confused, son of Lucifer, God will remove you from our land.",1,1,0,0,0,0
amh_train_track_a_00917,"Zarbabel is a man of knowledge, he was walking while we had a port by chance, he saw that the history of Haileslaase and before it is not well known, he should know the history, because we were deceived by the rulers, our fathers made it difficult for us, it would be better if we stayed in Ethiopia, we were better than the ones before, we are fighting for our country to be more recognized and free.",1,1,0,0,0,0
amh_train_track_a_00918,My room has a very nice hot shower,0,0,0,1,0,0
amh_train_track_a_00919,Ask yourself this question: Why are you doing what you're doing now? Is it because people tell you to do it? Is it because you thought you should do it? Or is it because you suddenly,0,0,0,0,0,0
amh_train_track_a_00920,"No, it's better to die than to be a journalist, he read the one that was given to him for a worthless salary.",1,0,0,0,1,0
amh_train_track_a_00921,2) the peace agreement was violated and the army was withdrawn not only from tigray but also from the areas of amhara where there was a threat. 3) olf shene and others who displaced the amhara,0,0,0,0,0,0
amh_train_track_a_00922,"First of all, this is a media that the government uses alone, so it's an idea that the government's supporters are reflecting, most of the media that promotes free thought have been shut down, journalists, representatives of the people have been arrested, so they don't pay much attention to the main issue of the country, public injustice, hunger, because it creates an agenda every time.",1,0,0,0,0,0
amh_train_track_a_00923,"I don't understand whether what has been said above is true or not, because the Dauro people are Omotok, and all of them are the closest in language and culture to the Dauro people, who are married and have children, who are a family with the ruling class: the Gamo and Gopa people, but the Tarkawi and the enemies who have made the Dauro and Gonta people to have more struggles are still the same as the previous leaders of the Dauro and Gopa people.",1,0,0,0,0,0
amh_train_track_a_00924,the only national threat in ethiopia is abiy ahmed when he is removed everything will be removed together,0,1,1,0,0,0
amh_train_track_a_00925,Somalia recalls its ambassador to Ethiopia,0,0,0,0,0,0
amh_train_track_a_00926,"The thought, the look, the speech, the action, the amazing man, the man who saw Ethiopia from afar, we are sorry if something comes from killing a person, we are cursed, the elders.",1,0,0,0,1,0
amh_train_track_a_00927,"If you are happy with the death of another person, how sure are you that it will not happen to you?",1,0,0,0,0,0
amh_train_track_a_00928,It's amazing how much they fear the organizations that sponsor the event.,0,0,0,0,0,1
amh_train_track_a_00929,"Where are we going, cruel man?",0,0,0,0,1,0
amh_train_track_a_00930,fake news stop when they are in prison,1,1,0,0,0,0
amh_train_track_a_00931,Let's hope he brings us something good.,0,0,0,1,0,0
amh_train_track_a_00932,There is no country built on lies and deceit on our planet earth is united in unity without division and differences today the most developed countries you deaf people what is the reason why wisdom is far from you because you have closed the door with a rope the spirit of vigilance the fallen army of darkness is calling his name in different ways the spirit of division the spirit of mankind has no paper or word,1,1,0,0,0,0
amh_train_track_a_00933,"Somalia will win, Oromo prosperity will win, those who cannot prosper, those who cannot challenge Somalia, will not be able to resist death, for the sake of the poor.",1,1,0,0,0,0
amh_train_track_a_00934,Is it possible that the struggle we have faced in the past will lead to the death of Gondor?,0,0,0,0,1,0
amh_train_track_a_00935,"Most of the people of southern Wollo are slaughtered in the floodplains, but the cadres of the zone are more attached to the carpet of prosperity than to the suffering of their people.",0,1,0,0,1,0
amh_train_track_a_00936,"It's the work of silence that makes you a full leader, and it's the work of a strong man, Abba Mela.",0,0,0,1,0,0
amh_train_track_a_00937,"Kote Manasseh, you are a racist who does not know your race, a racist who does not know your race, a racist who does not know your race, a racist who does not know your race, a racist who does not know your race, a racist who does not know your race, a racist who does not know your race.",1,1,0,0,0,0
amh_train_track_a_00938,What would have happened to us if we had been forced to endure a continuous crisis?,0,0,0,0,0,0
amh_train_track_a_00939,The measure of strength is the cruel slaughter and displacement of women by the Ma'asa Mohammed!,1,1,0,0,0,0
amh_train_track_a_00940,"they pointed out that the organization of regional special forces was illegal, seen as a threat between the regions, and the activity to solve problems by force undermined the organization.",0,0,0,0,0,0
amh_train_track_a_00941,Peace for All - War Is Bad for the World,0,0,0,0,0,0
amh_train_track_a_00942,Ilan Maked said that the fight against Zuckerberg will be broadcast live on X,0,0,0,0,0,0
amh_train_track_a_00943,Benjamin Pastor didn't know how to heal a deaf deceased man,0,1,0,0,0,0
amh_train_track_a_00944,"After this, desire conceives and gives birth to sin, and sin, when it has grown, gives birth to death.... Do not be those who do the word, but be those who hear it and deceive yourselves.",0,0,0,0,0,0
amh_train_track_a_00945,"I'm sorry, but if you don't appreciate it, it's because you're jealous or you can't afford it.",0,0,0,1,0,0
amh_train_track_a_00946,"If the Washington, D.C., building suddenly collapses, is it the work of Abiy Ahmed?",0,1,0,0,0,0
amh_train_track_a_00947,Your identity crisis does not represent the people of Amhara. The people have paid the price for the identity that they have been waiting for for centuries from apostates like you.,1,1,0,0,0,0
amh_train_track_a_00948,"You cattle have done well, the country is falling apart, the intestines are falling apart.",1,1,0,0,0,0
amh_train_track_a_00949,"But I've never really encountered a book that's written in the form of a poem, but I've never encountered a poem that's written in the form of a poem, but I've never encountered a poem that's written in the form of a poem, but I've never encountered a poem that's written in the form of a poem.",0,0,0,0,0,0
amh_train_track_a_00950,"If there is no strong law, we will still see a lot of killing, a lot of cruelty (the law that kills us) if it is not passed, the murderer will cry a lot, the murderer will be killed freely, he will be imprisoned, he will be released on bail, he will be happy.",1,0,1,0,0,0
amh_train_track_a_00951,So she's going to die? That's the question.,0,0,0,0,0,0
amh_train_track_a_00952,"Oh, it's hard, but it's hard to get in touch with now that this is the religion that people follow to save the world.",0,1,0,0,1,0
amh_train_track_a_00953,"believe me, people like this are very bad people who have been made by the devil's spirit, may god teach them, my sister, there are many problems like this in many homes, but this is very painful, please pray that evil will be removed from us, let us return to god.",0,0,0,0,1,0
amh_train_track_a_00954,"This Western donation is dangerous if Russia is attacked with such weapons, and nuclear bombs will be dropped on various Ukrainian cities if its Western allies intervene.",0,0,1,0,0,0
amh_train_track_a_00955,A man named Mohammed Jedir is employed by the OPL,0,1,0,0,0,0
amh_train_track_a_00956,But is there such a thing as a hot pot?,0,1,0,0,0,0
amh_train_track_a_00957,"Jeremiah for the rich man, the country is not always built by opposing the leader, when he works well, when he is supported, it is appropriate to criticize that you are not right, but it is not enough to criticize the country that your program was established to build the country, it was not enough to criticize the country.",1,0,0,0,0,0
amh_train_track_a_00958,"I wish it wasn't a movie, but the man who loves women like Jihan lives on this earth.",0,0,0,1,0,0
amh_train_track_a_00959,I don't want to be mature,1,1,0,0,0,0
amh_train_track_a_00960,"Don't be a dirty, Hamas-supporting whore, a lawyer for a brave woman, an innocent, peaceful citizen who fights for the innocent, who fights for the innocent, who fights for the innocent, who fights for the innocent, who fights for the innocent, who fights for the innocent.",1,1,0,0,0,0
amh_train_track_a_00961,Ethiopia's main threat to its security and survival as a nation is the prime minister and the government.,0,1,0,0,0,0
amh_train_track_a_00962,"The enemy of the people of Amara is only you and your criticism and your responses, the radical activists of the Maj are complaining to the enemy of the revolution, one day gather and take the Kurds and leave, and when you enter the village, Amara will live in peace with his neighbors.",1,1,0,0,0,0
amh_train_track_a_00963,An American pilot has been charged with assaulting the captain of a plane while on a flight.,0,0,0,0,0,0
amh_train_track_a_00964,"Abiy Ahmed, a criminal who has no respect for religion, country or people, has shut down the Orthodox language, Community Television, which shows his contempt and hatred for both the people and the believers.",1,1,0,0,0,0
amh_train_track_a_00965,"If you change the relationship between our government and the people, it will create a beautiful ethnic conflict and extend your term of office. Victory to Ethiopia, to Amhara, to Yiftiar, to Bandas, I have no doubt that they will adopt a new war strategy.",1,1,0,0,0,0
amh_train_track_a_00966,"The people of Tifozo, the country of Tifozo, from the media, the journalists, the artists, the scholars, the balance of the people of this country is distorted, what are you made of, he said nothing, the library that has been your archive for 40 years is like a dead man, a deadly comedian is like a dead man, but how does it spread?",1,1,0,0,0,0
amh_train_track_a_00967,The Ethiopian people's unwavering love for their country and their respect for the law have made it foolish to count the trust they have placed in their country without asking about their race and religion.,0,1,0,0,0,0
amh_train_track_a_00968,"You are a hopeless man who is doomed to die, you wish for the death of your work, you are dead.",1,1,0,0,0,0
amh_train_track_a_00969,"The dog should have been recommended as not German, but it's not fair to be fired, it's being attacked for racism, justice.",0,0,0,0,0,0
amh_train_track_a_00970,"""My goal is to promote Ethiopian folk music instruments"" - Asahle accelerated",0,0,0,0,0,0
amh_train_track_a_00971,"This work should be done to the part of the country, for example, there are many Shishabets in Shwarobit, Maghast should work hard.",0,0,0,0,0,0
amh_train_track_a_00972,"You don't know what you're talking about, donkey!",0,1,0,0,0,0
amh_train_track_a_00973,The narrow-minded demolition campaign of the 1st Independence Protectorate brought modernity and destroyed the colonial system that was the pride of all black people 2 and now the Orthodoxy for,1,0,0,0,0,0
amh_train_track_a_00974,Daniel Kwon and his colleague Zarihun are leading this terrorist group.,1,1,0,0,0,0
