id,text,anger,disgust,fear,joy,sadness,surprise
amh_train_track_a_00001,"you will not learn to be idle, you will be like a wild beast.",1,1,0,0,0,0
amh_train_track_a_00002,"I hope you passed the death of Dr. Israel's shadow in silence because he is an official, how long will the silence last, we are seeing the innocent, the rich and the murderer, the murderer, the promoter of the animal system, the new emperor, if you do not rise now, the dragon is standing at the door of your house, if you do not rise, we are spreading rumors to spread the salt system to destroy the orthodoxy, the true and the Muslim.",1,1,0,0,0,0
amh_train_track_a_00003,"And because they made him eat only once a day so that the work of the people of Addis Ababa, who love him very much and care about him very much, would not be solved.",0,0,0,0,0,0
amh_train_track_a_00004,"Etv racist nachuhu ashkabach how many of our fathers were martyrs of the badira and now they are burning their country with this new badira for the time being there is no problem but,?",1,1,0,0,0,0
amh_train_track_a_00005,"Today's chicken is different, I'd like you to tell me that you're a beginner.",0,1,0,1,0,0
amh_train_track_a_00006,I've lost my style now.,1,1,0,0,0,0
amh_train_track_a_00007,Nebiyu Mussse is afraid of being hit by the wild boar,0,1,0,0,0,0
amh_train_track_a_00008,Don't get lost in the midst of our attacks because the conflict seems to be over with Hamas!!!,1,1,0,0,0,0
amh_train_track_a_00009,He suffers more than anything else,0,0,0,0,1,0
amh_train_track_a_00010,"peace is better for us, let the sea close its doors, and let us touch it and face war with eritrea.",0,1,1,0,0,0
amh_train_track_a_00011,"If the federal government is reformed, its name is prosperity, the governor is the port, if the whole is not prosperity in every region, they say, ""No, it's not"", they say, ""The constitution is reformed"", they say, ""It's not for you in parliament"", they say, ""This is for me"", that's why they say, ""If you vote for a good parliament, you should be elected, if you have a parliament, if you have a parliament"".",1,1,0,0,0,0
amh_train_track_a_00012,Is there such a thing as unity?,0,0,0,1,0,0
amh_train_track_a_00013,Ethiopia is about to be overrun by the public with an unexpected speech and warning! via,0,0,0,0,0,0
amh_train_track_a_00014,One thousand four hundred people are said to have starved to death following the suspension of aid to Tigray,0,0,0,0,1,0
amh_train_track_a_00015,"It is good to leave a record, not just the name",0,0,0,0,0,0
amh_train_track_a_00016,"oh, what a cruel cruelty, i've never heard such a sad story, but my sister, may god give you life and health, your life will be changed with joy. hold on. and that cruel one will get his judgment in the court of law.",0,0,0,0,1,0
amh_train_track_a_00017,This abominable act is repeatedly seen in Ethiopia and this shows you the lack of government lawlessness has reigned this beast does not do it very sad you Ethiopians especially in TikTok you are shouting for fame and profit we have not heard a single day about this you say that you are religious,1,1,0,0,1,0
amh_train_track_a_00018,When the damage you've done in the past comes at you now,0,0,0,0,0,0
amh_train_track_a_00019,"the law is only because they are eritreans that ethiopians are committing more heinous and heinous crimes than this, isn't it? yes, beyond theft, the theft is accompanied by murder, isn't it? the act is getting worse, why is the judgment of ethiopians and eritreans different? oh god, where did christ go wrong?",1,1,0,0,0,0
amh_train_track_a_00020,let's put the imprisoned citizens of Saudi Arabia in a flood and take you to a name seeker,1,1,0,0,0,0
amh_train_track_a_00021,I think I'm joking. We've been through so much to get here.,0,0,0,0,1,0
amh_train_track_a_00022,"When we're cared for by men, we have a different kind of pleasant feeling, and when we're cared for and cared for by women, we have a different kind of bad feeling and inferiority, especially women.",0,0,0,0,0,0
amh_train_track_a_00023,illegal house construction will be demolished today and tomorrow will be demolished garbage facility for lies and for your nation when you start you can't bet on the truth Oromia this institution does not represent Ethiopia but Amhara,1,1,0,0,0,0
amh_train_track_a_00024,"Yes, this kind of heinous injustice is only for history, and we will punish it so that it can be questioned.",1,0,0,0,1,0
amh_train_track_a_00025,"It's very sad, the story is heartbreaking",0,0,0,0,1,0
amh_train_track_a_00026,it's sad how they hire this as the leader of amara and how they despise the people,0,1,0,0,1,0
amh_train_track_a_00027,"It is necessary to bring this crisis, this madman and madman, from the government to the prison, to the law, from crisis to crisis, from war to war.",1,1,0,0,0,0
amh_train_track_a_00028,"You can't buy anything from a poet, you can't buy anything from a friend, you can't buy anything from a friend, you can't buy anything from a friend, you can't buy anything from a friend, you can't buy anything from a friend, you can't buy anything from a friend, you can't buy anything from a friend, you can't buy anything from a friend, you can't buy anything from a friend.",1,0,0,0,1,0
amh_train_track_a_00029,"The words of the preacher, the son of david, who reigned in jerusalem: ""vanity, vanity, vanity, vanity, all is vanity. what profit is there to man in all his toil under the sun? a generation goes by, and a generation comes, and the earth remains forever. the sun rises and sets, and returns to its place.",0,0,0,0,0,0
amh_train_track_a_00030,"And her father, America, has been invading and oppressing Afghanistan for years, and finally throwing tanks and guns at us, and Israel, which has fled, is facing a worse defeat than this, because no one has ever won a war against the people.",1,0,0,0,0,0
amh_train_track_a_00031,"She was a spokesperson for the extremist ideology, and that's what you are.",0,1,0,0,0,0
amh_train_track_a_00032,It's a hateful thing to say.,0,1,0,0,0,0
amh_train_track_a_00033,"Ethiopian media first blamed Israel for the atrocities it had committed against the Palestinians, but now they blame it for the attacks on Israel.",1,1,0,0,0,0
amh_train_track_a_00034,"Friday, the day of love, Lord, for the love of human beings, for the blood you shed on Friday, for the blood you shed on Friday, please forgive us.",0,0,0,0,1,0
amh_train_track_a_00035,I'm not going to let you do that to me.,0,0,0,0,0,0
amh_train_track_a_00036,"Why did the Oromo government want to hit the Amhara? In connection with the death of Mr. Shitla, the Joint Task Force for Security and Security recently",0,1,0,0,0,0
amh_train_track_a_00037,Your tempting bosses are kissing the feet of the monkey.,0,1,0,0,0,0
amh_train_track_a_00038,"We remember the favor of the one who stole our sea, so you say it's the favor of the one, and our wicked enemy, you, the one who gave the Ethiopian sea to the country, is in a difficult situation, suddenly the unprotected thing is awakened from the seams, this is the favor that you say to the power of Isaiah, the Tigris, you may have been a thief.",1,1,0,0,0,0
amh_train_track_a_00039,"This interview will make me forget the pain of five years, I have some hope, show me the catapult.",0,0,0,1,0,0
amh_train_track_a_00040,How many millions of deaths and displacement does it teach you?,1,0,0,0,1,0
amh_train_track_a_00041,The man will rally the country's enemies because Egypt wants to take advantage of this opportunity.,0,0,0,0,0,0
amh_train_track_a_00042,African Cup winners rewarded with money and a villa,0,0,0,1,0,0
amh_train_track_a_00043,"Before calling a person a bandit, hold a proper study and information meeting. If you do not have the ability to understand Ethiopian politics, avoid emotional decisions and raise your voice.",1,0,0,0,0,0
amh_train_track_a_00044,"we should strongly oppose ghash abiy ahmed, who is a fan of terrorist terrorism!",0,1,0,0,0,0
amh_train_track_a_00045,This confusion caused the missing Planck to die.,0,1,0,0,0,0
amh_train_track_a_00046,13 children died in food shortages in Tigray: Aider Hospital,0,0,0,0,1,0
amh_train_track_a_00047,"It would have been nice if I hadn't started this drama, I know they're going to die, but I'm starting to see it.",0,0,0,0,1,0
amh_train_track_a_00048,"Let us daily renew ourselves in repentance that the coming of the Lord is nearer than ever, and let us prepare ourselves that death may come suddenly and take us away, so that by believing in Him we may enter into eternal life from eternal death, not by believing in Christ but by doing good works.",0,0,0,0,0,0
amh_train_track_a_00049,"It's very good to help others, it's a great show, it's very good.",0,0,0,1,0,0
amh_train_track_a_00050,"Now, if you don't have a stomach like that, no one will fall for you. You're still breaking the barrier of the country's exit, says the Satanic government of the children of Gine.",1,1,0,0,0,0
amh_train_track_a_00051,It was because of the abandonment of Janhoy Shem's country that he left his family in England and paid the price for creating Ethiopia in his time.,1,1,0,0,0,0
amh_train_track_a_00052,"When the government was criticized for the harvest season that prosperity brought through the father, the prayer for peace in Sudan was rejected by the government.",1,0,0,0,0,0
amh_train_track_a_00053,What is a slave? Is a person who is not contaminated by racism a slave to you? Is a slave who is proud of Ethiopia? The man is awake!,1,0,0,0,0,0
amh_train_track_a_00054,"It's a poison in his mouth, it's a band of prosperity, all the ideas he raises are hatred, Tigray and Amhara will be one.",0,1,0,0,0,0
amh_train_track_a_00055,"La Liga begins investigation after Bellingham accuses Greenwood of being ""brave""",0,0,0,0,0,0
amh_train_track_a_00056,"Borena, the drought that has been going on continuously since Amman is breaking news today, everyone is receiving it, where are all the photos that we saw today, hidden and suddenly like a flood?",1,0,0,0,1,0
amh_train_track_a_00057,But he will live for Ethiopia forever.,0,0,0,0,0,0
amh_train_track_a_00058,"You, man, feared the Mahdi, and were crucified on your fathers, Gabriel, this is the pain of the grave, not death, but suffering, you drank my blood from the big to the small.",1,1,0,0,0,0
amh_train_track_a_00059,"You are lucky to be alone, but when you miss your goal, you will be humiliated. I have not heard of anyone except Noah, who lived a thousand years. So just to get acquainted with the creator of the universe.",1,0,0,0,0,0
amh_train_track_a_00060,"It's sad that we have to learn from this, let's learn from it.",0,0,0,0,1,0
amh_train_track_a_00061,I don't think it's a very good speech! It's a dangerous speech that was made without thinking!,1,0,1,0,0,0
amh_train_track_a_00062,American survivor who killed his lover escapes Kenyan police custody,0,0,0,0,0,0
amh_train_track_a_00063,My name is Dodoche I had a boyfriend and he used to insult me a lot of times we used to argue and then he would apologize to me and I would apologize to him because I love him one day but you are a fake I was not pretending to be Ibrahim I was even asking for a wedding and I would have seen him but the phone rang less but he always told me that he loved me and when he introduced me and it was better please tell me,0,0,0,0,1,0
amh_train_track_a_00064,It's very sad that my mother is sick.,0,0,0,0,1,0
amh_train_track_a_00065,2 garbage disposal Oromia water Oromia wheat from Oromia how many then hate this big nation where will you get when you continue to hate Oromos there is no such thing as itya for the rest I am not Oromo,1,1,0,0,0,0
amh_train_track_a_00066,What is the implication of the Sudanese crisis for us? Who is the player behind the war between us?,0,0,0,0,0,0
amh_train_track_a_00067,"Thank you for your timely report, I wish the Iranian report had said that if the Israeli infantry entered Gaza after the unstable attack of 71023 by Hamas, we would join in. She said that Hamas did not succeed, she said that it was a ploy to deceive us, and now it is our own revenge.",0,0,0,1,0,0
amh_train_track_a_00068,This kind of prank is not fun when he is a baby next to you.,0,0,0,0,0,0
amh_train_track_a_00069,"Well, it's normal, it would be nice if there was a normal, at least some of it would be prepared! They're dancing in all four directions to make sure we don't have rest everywhere!",1,0,0,0,0,0
amh_train_track_a_00070,There is a lack of trust between the federal government and the TPLF.,0,0,0,0,0,0
amh_train_track_a_00071,A teacher in Kenya taught for more than two days straight,0,0,0,0,0,1
amh_train_track_a_00072,"Adwa is the great victory of great Ethiopia, the pride of Africa, the standard and the beacon of the black people of the whole world, the backbone of the future victory of the new generation, will be remembered in history as a noble sacrifice for Ethiopia and Ethiopianism.",0,0,0,1,0,0
amh_train_track_a_00073,"But her aunt is very smart, love you, what she calls dinner, thank you, thank you, thank you, thank you.",0,0,0,1,0,0
amh_train_track_a_00074,"The traditional games of the nobility are one of the best legacies of Ethiopia, and we should celebrate this game, for example, the game of the nobility is played on the shoulders and feet of the Oromo, but it includes the dance of the waist. It seems appropriate to develop with the games of the Arabs and Indians.",0,0,0,1,0,0
amh_train_track_a_00075,"Mr. Almu, my name was Salfu, and it was very surprising that we liked it so much that we left it until this is the case.",0,0,0,1,0,0
amh_train_track_a_00076,"You and Garbah have eaten the black people, you and Garbah have killed the children of the south until September 30th, there is no government in the south, their blood has been spilled, Oromia with out of Ethiopia, the heads of this herd, Al Qaeda and ISIS, are rising, the Oromo Muslims, now America and Canada are going to expel them all.",1,1,0,0,0,0
amh_train_track_a_00077,"Tdf Tigray Prevail All these problems were caused by the ruling Amhara enemy TPLF. However, you started the war and we did not reach it. Walkait and Raya are the ancient Amhara heritage. Amara will not end anyway, because the war is about to begin.",0,1,0,0,0,0
amh_train_track_a_00078,Mexican state of El Chapo sparked riots after drug trafficker's son was arrested,0,0,0,0,0,0
amh_train_track_a_00079,"it is a pity that this people live without compassion and do not know what it is to be immersed in the desert? it seems that we have a religion of the desert, the envious and the racist people",0,1,0,0,1,0
amh_train_track_a_00080,A teacher who introduced a rural village to children's books,0,0,0,1,0,0
amh_train_track_a_00081,"I don't think the BDP is a long-term strategy and plan organization, and if Abiy suddenly gets up and says that he hates Oromia and the South, there is no answer.",0,1,0,0,0,0
amh_train_track_a_00082,"You know the injustice that the fraudulent mothers who fight behind the scenes, the representatives of the people, have chosen to remain silent, the people have chosen to represent you and tell me, but you have been silent, your stomach is God and your loyalty is to whom you have paid wages.",1,0,0,0,1,0
amh_train_track_a_00083,South African man charged for pretending to be a doctor on TikTok,0,0,0,0,0,0
amh_train_track_a_00084,"We are at war, Israel is the children of the covenant land.",0,0,0,0,0,0
amh_train_track_a_00085,"When they ran, when they ran, when they ran, when they ran, when they ran, when they ran, when they ran, when they ran, when they ran, when they ran.",0,1,0,0,0,0
amh_train_track_a_00086,"It is not the hatred and tyranny of the unbeliever that has brought about the change of the innocent, but the fear of Allah that has made the hatred and tyranny of the innocent worse. We have heard the message of the unbelievers, we have stood by them with a pure heart, and our Lord has created the heart of the innocent.",0,0,0,0,0,0
amh_train_track_a_00087,"There is nothing written about these individuals on the AA Twitter page, if you have evidence, it's better to fight, otherwise it will be a baseless accusation.",0,0,0,0,0,0
amh_train_track_a_00088,"Since both experiments are highly illegal, the government should recognize this and impose the necessary legal restrictions on the migration of the participants. (44)",1,1,0,0,0,0
amh_train_track_a_00089,I am afraid that Allah will not ask you to make such knowledge accessible to Ethiopian Muslims until today. Now I ask you with brotherly love to expand your accessibility. Allah has given you a better and more rational outlook and deep knowledge of Islam.,0,0,1,1,0,0
amh_train_track_a_00090,There is no stone that cannot be thrown to gain fame in this world. Ethiopian Prime Minister surprises people that peace does not come before the creation of entertainment places everywhere. Who comes to visit a country without peace?,1,0,0,0,0,0
amh_train_track_a_00091,"It's surprising to hear you say that you've forgotten what you've announced on Tigray, that a complainer doesn't get better, that he's worse, and that he gave you your wishes, don't judge, don't be judged.",0,1,0,0,0,1
amh_train_track_a_00092,"Addis Ababa, Abiy Ahmed, your story will change in a matter of hours with a sudden shot or a sudden Las Bill. You are afraid that you will be asked to ignore and even hear the bloodshed of our people.",1,1,0,0,0,0
amh_train_track_a_00093,"It requires public support, first of all we have to worry about security, it's true, it's an agenda that hasn't stood the test of time.",0,0,0,0,0,0
amh_train_track_a_00094,"Hamas' first massacre of innocent people, Israel's attack on innocent people, and the tragedy of the Holocaust, if it had happened in South Africa, she would have been killed, so what would happen if you put something on a human wound, it wouldn't hurt you, and what happened in South Africa is the same.",0,1,0,0,1,0
amh_train_track_a_00095,"The world has defeated the Israelis on every occasion it has had so far, but that is not possible now, what is the cost of touching Israel, everyone will taste the punishment, Israel will go forward.",1,0,0,0,0,0
amh_train_track_a_00096,"MercyAbd performed a remarkable feat, the sudden speaker was a mysterious teacher, a merciful mother through orthodoxy.",0,0,0,0,0,0
amh_train_track_a_00097,"The origin of the human race is not Ethiopia, but Palestine, where Adam was created 1000%.",0,0,0,1,0,0
amh_train_track_a_00098,But Philistine is just like the attack on Fano Tigray,0,1,0,0,0,0
amh_train_track_a_00099,"Where did the extremist extremist of Amhara, Enah Dor Tantu, come from?",0,1,0,0,0,0
amh_train_track_a_00100,let me repeat to you that there is no racism in ethiopia and you are a thorn in the side of the people who are fighting to overthrow your nation.,1,1,0,0,0,0
amh_train_track_a_00101,"Your treachery has no boundaries, great Eritrea, when did you want to destroy Ethiopia like this? This year was easy, but the Eritrean army paid the sacrifice and saved it.",1,1,0,0,0,0
amh_train_track_a_00102,5 minutes without seeing it 85 minutes heard this sweet analysis wow jawe,0,0,0,1,0,0
amh_train_track_a_00103,Think of the hatred and contempt you have for the 82 nations of Ethiopia.,0,1,0,0,0,0
amh_train_track_a_00104,What kind of cruelty is going on? It's the right of human beings to live in peace. Where to go and live?,0,0,0,0,1,0
amh_train_track_a_00105,We say that the government should punish such savages for the sake of the superstitious hatred and destroy all the human dignity in public by publicly executing them in public if this is the case no one will be left with the words of murder and everything else will be feared afterwards otherwise we will wait for a terrible time or a very ripe time,1,0,1,0,0,0
amh_train_track_a_00106,Ghanaian journalist sings non-stop for 126 hours to make her name on the world's top charts,0,0,0,0,0,1
amh_train_track_a_00107,U.S. calls for justice for those who killed civilians in Marwa,0,0,0,0,0,0
amh_train_track_a_00108,"We don't have a god of light, we have a black god, but I don't pass up her analysis of the color of the blood.",1,0,0,1,0,0
amh_train_track_a_00109,The Muslims killed him because of the good hell,0,1,0,0,0,0
amh_train_track_a_00110,"You are right, it is an oppression that sheds the blood and tears of mothers and innocents.",1,0,0,0,0,0
amh_train_track_a_00111,It's amazing!,0,0,0,0,0,1
amh_train_track_a_00112,"You threatened him with the edge of your sword, saying that we would not forget that Amara's main enemy was a Mesha.",1,1,0,0,0,0
amh_train_track_a_00113,27 years of this promise have been broken by the terrorists and it will continue to get worse today. Our country is saddened.,0,0,0,0,1,0
amh_train_track_a_00114,Imagine coming home from work and having a man laughing under your bed telling jokes to your wife.,0,0,0,0,0,0
amh_train_track_a_00115,"It's because her own citizens are forced to go to work, that's why you're called no one else, not the Ethiopian Mahdi.",1,0,0,0,1,0
amh_train_track_a_00116,"I'm a poet, I've been writing for a while, but suddenly you've taken it without a break, it's a little harder for you than for me, even if you make fun of me, it's justice that doesn't appeal to me to improve you.",0,0,0,0,0,0
amh_train_track_a_00117,"Ethiopia won a great victory over the Red Sea with our great leader, our enemies died, the death of Ethiopia's prosperity was overcome, we thank our father, we will cross together from our brothers in Somaliland.",0,0,0,1,0,0
amh_train_track_a_00118,Have you ever been in the wrong house?,0,0,0,0,0,0
amh_train_track_a_00119,"Hail Jesus, congratulations, Enoch, we are glad to meet you today.",0,0,0,1,0,0
amh_train_track_a_00120,May he give our mothers a happy old age with health,0,0,0,1,0,0
amh_train_track_a_00121,"It's one thing to say that they have limited capacity, but it's another thing to say that they are doing politics for the death of the people of Tigray, which shows that you have a problem of thinking.",1,1,0,0,0,0
amh_train_track_a_00122,"He began to organize and then took the army and suddenly arrived at an unexpected place and time, throwing unexpected and unexpected dangers, and occasionally at night the Italian camp.",0,0,0,1,0,0
amh_train_track_a_00123,"And the journalist was not beaten, and the truth is beaten, because the man you don't support said, ""Oh, it's a good time, it's in there"".",1,0,0,0,1,1
amh_train_track_a_00124,"It would be good if you resigned peacefully, otherwise your failure would be worse than my failure.",1,1,0,0,0,0
amh_train_track_a_00125,"The fear, the anxiety, the pain, the loss of the wealth of the Oromo, the destruction of the property of the leaderless Amhara, the displacement, the harassment and the abuse.",1,1,0,0,1,0
amh_train_track_a_00126,"Don't be a fanatic, Israel, if you burn, it's children who don't know anything, it's burning, if you're happy, it's a genie, it's the creator, it's not the first, it's the Palestinian, it's innocent, it's burned, it's sad, it shows the barbarism of Israel, it's not to spread war, it's to pray that the creator stays.",1,1,0,0,1,0
amh_train_track_a_00127,"You are a supporter of prosperity, you show your arrogance, you tell the truth by slander, you lose it, you are not guided by slander, you are not guided by knowledge, you are not guided by desire, you seem to accept the position of defeat, the way you are going is another crisis, it does not need a miracle to talk about you, it is enough to see us for more than five years.",1,1,0,0,0,0
amh_train_track_a_00128,"I don't know what to say, I was disappointed to see the live broadcast.",0,0,0,0,1,0
amh_train_track_a_00129,The current political path and approach of Amhara is the same as the urban terror murders and the massive media campaign of hatred that the EPRDF waged in the 1960s.,0,1,0,0,0,0
amh_train_track_a_00130,Uff Jahan wakes me up but the love of the Lord is always the opposite,0,0,0,0,1,0
amh_train_track_a_00131,"If everyone asks for their rights without fear, we will not be replaced by a stupid dictator. Stop claiming that it is my right!",1,0,0,0,0,0
amh_train_track_a_00132,Have a relaxing Christmas afternoon with the special program buffets?A good Christmas? Mercy at Daggy's Surprise,0,0,0,1,0,0
amh_train_track_a_00133,"You will never walk alone, you will never walk alone, 120 million people are on your side, the greatest and most wonderful leader of our time!",0,0,0,1,0,0
amh_train_track_a_00134,"And I was surprised that this is what it is. In short, she and he are the same. It would be good if her ex-husband came and told her who she was.",0,0,0,0,0,1
amh_train_track_a_00135,"In order to eliminate the problem of post-traumatic stress disorder, we need to support women who have been sexually assaulted in Tigray with talk therapy sessions.",0,0,0,0,1,0
amh_train_track_a_00136,"If Jarmaro doesn't negotiate with the government now, the next government won't ask for reconciliation. Let's find out carefully that Dr. Abiy is going to remove the Jawi from power to put her in the palace. It's very sad that you're killing the Oromo.",0,1,0,0,1,0
amh_train_track_a_00137,"It's not nice to be hurt at the end of the day, even if it's bad in Aduniya, it's good in Amra.",0,0,0,0,1,0
amh_train_track_a_00138,The Eritrean government has combined the basic characteristics of the Amhara regional government with the magnetism of the Eritrean government.,1,1,0,0,0,0
