id,text,anger,disgust,fear,joy,sadness,surprise
deu_train_track_a_01915,"I wouldn't talk about it at all. Just be honest, a lot of people have an understanding. Any bridging stories are nothing but lies, like with your parents. I know, I did the same thing. Step 1. Confess to your parents Step 2. Job in a desired industry, without BlaBla If it doesn't work, you also just have to realize that studying isn't everything. Besides, you already have a bachelor's degree. All good. You're better off than a lot of people. Maybe go for a walk and try Fluoxetine.",0,0,0,0,0,0
deu_train_track_a_01916,But it should also be noted that alcohol is not an excuse for this.,0,1,0,0,0,0
deu_train_track_a_01917,That there's something else that comes after death that you can realize is bullshit that's been invented over the years by people to either have something tangible so you don't go crazy or to make others obedient.,1,1,0,0,0,0
deu_train_track_a_01918,"People don't tolerate constant high stress neurologically, so they use self-healing trivialization for self-protection, or dissociation, a kind of separation that's been known in psychology for a long time.",0,0,1,0,1,0
deu_train_track_a_01919,It is simply unbelievable that in Germany we can no longer speak out for democracy everywhere without fear of violence.,1,0,1,0,1,0
deu_train_track_a_01920,"Today in the newspaper: The energy transition is becoming more expensive than necessary, and the fault lies primarily with the politics of Munich.",1,1,0,0,0,0
deu_train_track_a_01921,"Opinion. Opposition is a death sentence in systems like Putin's Russia. He was an impressive personality, a man who put his attitude of conviction for a better future above his own life. This should be an incentive for us to never let Putin's system win, to support opposition in all countries who fight for freedom and democracy, and to defend our ideas against Putin's friends like the AfD.",1,1,0,0,1,0
deu_train_track_a_01922,Israel's violence against Palestinians is older than Hamas',1,1,0,0,1,0
deu_train_track_a_01923,So coachella itself wild and wild outfits is stop nh plus,0,0,0,1,0,0
deu_train_track_a_01924,"How much do you protect yourselves in these times to prevent a coronavirus infection? We are currently really very limited in our contacts: both in the home office, we meet up to 1x a week someone outside our household. I wanted to date again with friends we haven't seen for a long time and my husband was undecided whether we would rather not do without it. I'm torn and want to be completely but also not isolate myself socially - pregnant is already turbulent enough, I don't want to be alone at home. At the same time I don't want to expose myself to unnecessary risks.",0,0,1,0,1,0
deu_train_track_a_01925,"Migrants with male reading skills are a strong sign against the right in The Hague, and soon in your neighbourhood as well!",1,0,0,1,0,0
deu_train_track_a_01926,"I really can't, because I'm not home yet, so please don't hit me.",0,0,1,0,0,0
deu_train_track_a_01927,Update: [First 38km completed!] (if anyone recognizes where I am despite the blurred background!,0,0,0,1,0,0
deu_train_track_a_01928,"Well, the one on the far right wants to come back, so I hope the prosecution succeeds.",0,1,1,0,0,0
deu_train_track_a_01929,"I know there are extra babymoon hotels, but they don't appeal to me very much. Generally speaking, I prefer to vacation in a hotel, in recent years I've been more often at the Mediterranean in a place that now falls out because of pregnancy (too high risk of falling, too poor medical care,...).",0,0,1,0,0,0
deu_train_track_a_01930,"He wants to trample on the fundamental rights of millions of people, and to protect the fundamental rights of our fellow citizens, this procedure would almost be a duty.",1,1,0,0,0,0
deu_train_track_a_01931,Those who see the state as a permanent enemy do not lead a good life.,0,0,0,0,1,0
deu_train_track_a_01932,It sounds to me like you're wondering if you're Asian because glass noodles taste better than spaghetti. Young people often look for a label that fits them. Honestly?,0,0,0,0,0,0
deu_train_track_a_01933,"Hi, first of all, congratulations. I'm pregnant for the first time in 17 years, and by now the worry is a little smaller, just because of the statistics... but I feel your panic very much. My gynecologist told me that if the anxiety gets too big, I should just call and come by for a US check between the regular appointments. It takes 2 minutes. You have certainty.",0,0,1,0,0,0
deu_train_track_a_01934,"I'm an absolute true crime lover, I read everything, I watch everything, I listen to podcasts, etc. But since my first pregnancy, it has to be planned in such a way that I have to deal with it either in the morning, or if it's at night, then my husband has to be at home at night (works the night shift).",0,0,1,0,0,0
deu_train_track_a_01935,You are so fucking hot 😍,0,0,0,1,0,0
deu_train_track_a_01936,GM... your photos are always crazy.,0,0,0,1,0,0
deu_train_track_a_01937,"I know it's a bunch of tips, but maybe it'll help you.",0,0,0,0,0,0
deu_train_track_a_01938,"Hey, I've just turned 18 and I'm looking for a psychiatrist near me that I can trust, so someone who's sensitive and not shy about prescribing medication, I've had the bad experience of a psychologist who just doesn't want to do that even though I know antidepressants can help me.",0,0,1,0,1,0
deu_train_track_a_01939,"The Israeli news site Ha Makom reported that the Israeli army had located 16 hostages in a building, but the building was bombed anyway, and 10 hostages were reportedly killed.",1,1,0,0,1,0
deu_train_track_a_01940,"I've worked with refugees a lot. Most of them have definitely stayed here, and it was very hard for them not to see their families. I actually only know one case where someone came back for a vacation, and he was politically persecuted (not a war); went to see his mother after 7 years, and just took the risk. I think that's really the minority, and to be honest, as long as it's isolated cases, it doesn't scratch me.",0,0,0,0,0,0
deu_train_track_a_01941,"You've done nothing wrong and you're completely innocent according to your description, but maybe I'm too naive. I've always been perfectly open and I've always had to go through every check, never with the guard. But I haven't driven a car for years now, so the checks are out.",0,0,0,0,1,0
deu_train_track_a_01942,I don't have to prove that the person who makes the accusation or filed the lawsuit is presumed innocent.,0,0,0,0,0,0
deu_train_track_a_01943,I can sit in the sun for hours in the summer by the river and just stare at myself.,0,0,0,1,0,0
deu_train_track_a_01944,"The Greens deliver tanks and want war and the AfD wants peace and only the best for the country and the people and are hated, that's what I call GEZ supervised thinking.",1,1,0,0,0,0
deu_train_track_a_01945,"We can win with #Ukraine or lose with it. We are not on the path of victory. This is also because #Scholz is taking a special path with Russia, he does not want to deliver #Taurus or NATO membership of Ukraine @<username>",1,0,1,0,0,0
deu_train_track_a_01946,"Happy and healthy new year! Enjoy your orange. I've never had a 10 out of 10, so I prefer to eat mandarins. But I'll give it to you!!",0,0,0,1,0,0
deu_train_track_a_01947,"""Hamas has brutally slaughtered 1200 people, set them on fire, cut off people's heads, murdered babies in their cribs,..."" ""But Israeli soldiers pose with fine laundry, which means both sides are doing bad things"".",1,1,0,0,0,0
deu_train_track_a_01948,"It really depends on your family. Mine was very understanding and supportive. If yours isn't or makes you go ""Don't be like that"", it might not be worth it. Or you try and try to make them seriously understand that it's a serious disease.",0,1,1,0,1,0
deu_train_track_a_01949,"That's so beautifully written, just like your first post.",0,0,0,1,0,0
deu_train_track_a_01950,"My friend Casten gave me a rocket for my birthday. I was wondering if we wanted to go to Mon-Gon. Yes, we were.",0,0,0,1,0,0
deu_train_track_a_01951,"Asche, this has to stop. It's so embarrassing.",0,1,0,0,0,0
deu_train_track_a_01952,"Hedgehog: ""Yes, I'll eat your food. What do you want to do now, Mieze?""",0,0,0,1,0,0
deu_train_track_a_01953,"The problem is, I can't find any reviews and they both don't have a website or a Google Maps spot, there's nothing. On the midwife search on GKV, there's only email and phone number. Of course, I understand that they can just be very young and right out of school, which doesn't bother me (they'll still know more about kids than I do, haha). But I wonder how I can understand if we're, so to speak, right for each other.",0,0,1,0,0,0
deu_train_track_a_01954,BIDA if I accidentally bumped into a terrorist of the kittens tormented when he stumbled in from behind so I couldn't see him?,0,0,0,0,0,0
deu_train_track_a_01955,"Thank you South Africa, at least you're not looking away or you're not a puppet of the USA!",1,0,0,1,0,0
deu_train_track_a_01956,"But there is one who hates fascism, and that is the hypocrites in this BRD.",1,1,0,0,0,0
deu_train_track_a_01957,A little break before the man builds a high bed on the high bed.,0,0,0,1,0,0
deu_train_track_a_01958,And of course it shows that the problem of the Catholic Church is not just the spirit of the times and the abuse.,0,1,0,0,0,0
deu_train_track_a_01959,Who's going to demolish my house? What the hell? Are you sick? I'm going to freeze you!,1,0,0,0,0,0
deu_train_track_a_01960,It's a good thing we have the eco-fanatics who demonstrated for climate change so that Merkel quickly made it a law and now we have to pay horrendous electricity prices for their stupidity.,1,1,0,0,0,0
deu_train_track_a_01961,"With the racist and ultra-nationalist Netanyahu, no negotiations are possible... as long as the war continues, he can stay in power, which is why he also rejected the peace agreement.",1,1,0,0,1,0
deu_train_track_a_01962,"So I'm also a reader, I always have my book with me, but of course I know that when I'm traveling with JMD that I don't read. Have you mentioned it? Because communication is important and he fully understands it when he has to put the book away in two-way situations. And as long as he's understanding, you can also pray to him at any time within the situation, put the book away and focus on you.",0,0,0,0,0,0
deu_train_track_a_01963,"Why would you cry? To explain it on a medical level, your estrogen might be a little high. Maybe go to the endocrinologist and see how much testosterone you have in your blood. If it somehow all fits together perfectly, you can get that emotion because you're overwhelmed by something.",0,0,0,0,0,0
deu_train_track_a_01964,"The last time I had a five-mark piece in my hand, I was particularly struck by how light they are compared to euro coins.",0,0,0,0,0,1
deu_train_track_a_01965,"It's just hard to live with a depressed person. It takes a lot of patience, your own peace and balance and strength. If you're not completely grounded, you might not always succeed and you blame the depressed person. Try not to take it too personally, after all, you're criticizing your illness and not you.",0,0,0,0,1,0
deu_train_track_a_01966,Those responsible for interfering in the Ukrainian war must step down immediately!!!!! Have you learned nothing from the last two world wars?,1,1,1,0,0,0
deu_train_track_a_01967,"Not that I'd be fit, but this fight has to be!",1,0,0,0,0,0
deu_train_track_a_01968,"20 million for weapons of war, I can't put it into words.",0,1,0,0,1,0
deu_train_track_a_01969,You're not fooling around. It's a pity.,0,1,0,0,1,0
deu_train_track_a_01970,"But I'd like to remind your companion to have your playlist on his phone so he can take care of it, and you just have to say, ""Music, please"".",0,0,0,0,0,0
deu_train_track_a_01971,"When a beard accident has just been avoided, do you say, ""This went really well""?",0,0,0,1,0,0
deu_train_track_a_01972,"My child hasn't moved from the spot since the fourth month, until she rolled over to the other side during labor, until then her fists and feet were always in exactly the same place, and she stuck her ass in my ribs, so I couldn't breathe and I couldn't move.",0,0,0,0,0,0
deu_train_track_a_01973,"If the clinic or the doctor is really good, no.",0,0,0,0,0,0
deu_train_track_a_01974,Ahoi. I've been on a 12-day expedition cruise to Antarctica as a passenger. Definition: Expedition cruises are cruises with mostly smaller special ships to see which routes are off the beaten path. Expedition cruises have many other important features that are not valued in this view. Often they are seen as a mixture of cruising and study trips and open up regions that have not yet been explored by mass tourism.,0,0,0,1,0,0
deu_train_track_a_01975,A visit to the eye doctor would also be helpful for the poor.,0,0,0,0,1,0
deu_train_track_a_01976,What is not to be surpassed in hypocrisy and wickedness is the fact that care packages are thrown from the air for people sentenced to death instead of stopping the delivery of weapons to the state of Israel or bringing these perfidious psychopaths to account... and all this with the eyes of the civilized world today.,1,1,0,0,1,0
deu_train_track_a_01977,"I'm at 0.65 meters per step now and it seems a bit far to me. In heavy oncoming traffic I have concerns about being too fast on the road, I sometimes even see an anxious look in older people, but somehow I even like that. Is that just my natural pace or am I maybe a ""Bad-Boy""??",0,0,0,1,0,0
deu_train_track_a_01978,The regime now prefers to destroy the country instead of simply disappearing.,1,0,0,0,0,0
deu_train_track_a_01979,"The International Court of Justice considers it plausible that Israel is guilty of genocide, and I would stop funding and arms deliveries to Israel, but since the war, many people have realized that human rights are only selective and political and economic interests are at stake.",1,0,0,0,0,0
deu_train_track_a_01980,You spelled 2032 wrong.,0,0,0,0,0,0
deu_train_track_a_01981,Your husband is one of those people that I find repulsive. His behavior suggests that he wants to control everything around him. I hope you sleep well and can say in all seriousness that you have lived a fulfilling life. Buy yourself whatever you want and be feel free in your personal design.,0,1,0,0,0,0
deu_train_track_a_01982,How and when did you find out about this? What punishment did the other road user receive?,0,0,0,0,0,0
deu_train_track_a_01983,For all those who compare with Israel: Russia has attacked for no reason at all. Ukraine has never attacked anyone or even threatened anyone. These are completely different situations.,0,0,0,0,0,0
deu_train_track_a_01984,"I can understand the approach very well. My thoughts would probably be the possibility of getting a part-time job at all, then of course also how to compensate for the loss of money. I also mean the money you pay into the pension insurance. I knew a person who has already been able to live well with it, but also get a very small pension. Does your employer offer this or do you really have to completely reorient yourself? I think what I would change above all in your place would be this shift model.",0,0,0,0,0,0
deu_train_track_a_01985,"Negotiations, beauty, bring nothing as long as Putin wants half of Ukraine.",1,1,0,0,1,0
deu_train_track_a_01986,Just a question of interest: how many toxins actually go into the groundwater during such a glue action?,1,1,0,0,0,0
deu_train_track_a_01987,"An impressive strategic success for Putin: NATO now has 32 members, before the attack on Ukraine there were 30.",0,0,0,0,0,0
deu_train_track_a_01988,"Dear Lady, I would like to take a nose.",0,0,0,1,0,0
deu_train_track_a_01989,We as a humanity are failing across the board.,1,1,1,0,1,0
deu_train_track_a_01990,"That sounds like a lot of work, so I'd rather go through the death notices and delete them from the phone book.",0,0,0,0,1,0
deu_train_track_a_01991,"You should listen to your doctor, your midwife, or your second opinion if your current doctor doesn't convince you. No one on the Internet can tell you if it's too much or not. There may be water retention. It's definitely not advisable to lose weight or follow any diet during pregnancy. The body is changing a lot now, unfortunately in some cases not at all as you might have liked, but it's definitely safer to rely on medical advice and tests than to think about it.",0,0,1,0,0,0
deu_train_track_a_01992,"It's been 58 years, but you've behaved well.",0,0,0,1,0,0
deu_train_track_a_01993,That's exactly why I love this sub! Thank you for sharing!,0,0,0,1,0,0
deu_train_track_a_01994,"Thank you for your insight into your daily struggle, Brudi, but you don't think about it or you don't get it.",0,0,0,1,0,0
deu_train_track_a_01995,Why can 't I be like an eraser? My mistakes erase themselves someday.,0,0,0,0,1,0
deu_train_track_a_01996,We had one and were extremely satisfied with it. It can also be upgraded to carry two children and is small enough for an SUV (and our elevator).,0,0,0,1,0,0
deu_train_track_a_01997,I've died unexpectedly for the fourth time since Friday in September.,0,0,0,1,0,0
deu_train_track_a_01998,"I was 10 days over my deadline and was initiated. I also went for a walk to the end of what was possible, but unfortunately it didn't help. Sex was out for me, so I was too round for that. But: Some people it helped!",0,0,0,0,0,0
deu_train_track_a_01999,"I'm helped by the perspective of optimistic nihilism, and I can imagine that's something for you, too. [in short] (worked it out nicely): ""If you can't remember the 13.75 billion years before you were born, then the billions of years after you will fly by. Close your eyes, count to one. That's how eternity feels"".",0,0,0,0,0,0
deu_train_track_a_02000,"Good luck to you, Lena.",0,0,0,1,0,0
deu_train_track_a_02001,"Fortunately, only the light is broken.",0,0,0,1,0,0
deu_train_track_a_02002,"What is the use of courage here? Absolute folly. Even the ""right-wing radicals"" in Bautzen respect democracy and freedom of expression.",1,1,0,0,0,0
deu_train_track_a_02003,"The genocide must stop, if it were really about hostages, you wouldn't shoot a rocket at a crowd of people, you'd be wiping out your own hostages, as you clearly admit, it's about expanding territory.",1,1,0,0,1,0
deu_train_track_a_02004,"You could also just go vegan, which would be much better for the animals, the environment, the climate and your health.",0,0,0,0,0,0
deu_train_track_a_02005,"If you can add up 1+1 then you check that it is the best thing for Germany, the environment, the climate, that ministers can get from A to B as quickly as possible, can move as much as possible in as many places as possible in as short a time as possible, and then also get back home as quickly as possible.",0,0,0,0,0,0
deu_train_track_a_02006,I'm sure you'll be pleased to hear that.,1,0,0,0,0,0
deu_train_track_a_02007,"Hi, I've been suffering from depression for a year now, and in the last few weeks, I've been having this problem again and again, that I'm hungry, but I don't feel like eating or cooking, and I don't have any ideas.",0,0,0,0,1,0
deu_train_track_a_02008,"A colleague and I were about 14 years old when we both decided to go to the town hall because there was such a cool elevator that was in operation permanently and didn't stop. We jumped in and wanted to go all the way to the top. Relatively far up we realized that no more floor was waiting for us, but darkness. At that moment we both looked at each other at the same time, with the same thought that we might somehow be crushed.",0,0,0,1,0,0
deu_train_track_a_02009,"I will, thank you!",0,0,0,1,0,0
deu_train_track_a_02010,"I have to admit honestly that I always find myself trying to avoid passing other people, I prefer to wait and keep my distance, and when that's not possible, like at concerts, the stupid thoughts shoot into my head about whether the other person is sick, what if yes, and whether I have it now, because it's actually total nonsense, but that's what the whole distance has done to me.",0,0,1,0,1,0
deu_train_track_a_02011,I couldn't get vaccinated because there was no vaccine yet and there was no recommendation from the Stiko later on. We isolated the entire pregnancy. I met my sister twice outdoors and once we were picking up a friend in the baby shower. My partner and friend were already vaccinated and I just stayed out for a while. But there was no Delta. Now the baby is over three months old and we are still extremely careful.,0,0,1,0,0,0
deu_train_track_a_02012,"Instead of simply doing everything to stop the war without further violence, that should be the discourse in the comment section, in the Bundestag, and internationally, and Ukraine will not win this by its own strength, not even with Western weapons.",0,0,0,0,0,0
deu_train_track_a_02013,"The people of Gaza have been living in misery for years, not just because of the current situation, they are being held captive in their country, all the governments have ignored it, now the whole world is seeing what is going on there.",0,0,0,0,1,0
deu_train_track_a_02014,He should stay where he is - where he has just started again.,0,0,0,0,0,0
deu_train_track_a_02015,"It sounds a bit like ischia pain! It's best to stay in motion. Sitting too much often makes it worse - walking, doing a little yoga. I also had a seat wedge on the chair and alternating sitting on the petzi/yoga ball. There are also excellent exercises for the hips that you can do on the ball. I also got a prescription from the gynecologist for physiotherapy for ischia - maybe that would be an option!",0,0,0,0,0,0
deu_train_track_a_02016,Genocide and no one cares.,1,1,0,0,1,0
deu_train_track_a_02017,"It was my 18th birthday, I was just coming home from a field trip, and I wanted to tell you about it, and then I wanted to do something with my friends, and I walked in the door, and I got a gift in my hand with the words, ""Your mother and I are getting a divorce"".",0,0,0,0,1,1
deu_train_track_a_02018,"I think all the comments that tell you that you should try something new are sex-changing, you can read them carefully, because it's obviously not in your power to change anything here on your own, you really need to talk about it, you can speculate for a long time what could be the cause, but there are too many possibilities.",0,1,0,0,1,0
deu_train_track_a_02019,"It is important that the civilian population is helped and protected from starvation. Terrorism, fanaticism, despots, unscrupulous, harmful power-hungry people, corporations, decision-makers must be persecuted and severely punished by all in order to protect our societies.",1,1,0,0,1,0
deu_train_track_a_02020,BILD employees steal content for Bild.de and complain about FOCUS,1,1,0,0,0,0
deu_train_track_a_02021,We're still losing that 100%,0,0,1,0,0,0
deu_train_track_a_02022,And there's an anti-Greta car in my village.,1,0,0,0,0,0
deu_train_track_a_02023,"Böhmermann is funny, but I think you'd only get latent sarcastic answers here that don't have any relevance at all.",0,0,0,0,0,0
deu_train_track_a_02024,"Dear children, do not make up",0,0,1,0,0,0
deu_train_track_a_02025,I'd have to laugh if there's anyone involved who's involved in the COVID-19 campaign and is financially behind.,0,1,0,0,0,0
deu_train_track_a_02026,"I've been crystal addicted for 5 years, but I'm clean now.",0,0,0,1,0,0
deu_train_track_a_02027,"Berlin is called Berlin because it was built in a swamp, a wetland, a wasteland.",1,0,0,0,0,0
deu_train_track_a_02028,It is absolutely appropriate and legitimate for Israel to defend itself!,0,0,0,1,0,0
deu_train_track_a_02029,"The Lattenzaun It was once a Lattenzaun, with a space between, to look through. An architect who saw this suddenly stood there one evening - and took out the space between and built a big house out of it. The fence, however, stood quite stupid, with latten without anything around. A horrible and mean sight.",0,0,0,0,0,0
deu_train_track_a_02030,I'm currently in week 32 and for about 2-3 weeks I've been noticing how much more stressful everything is becoming and unfortunately I also have problems walking because the pelvis is loose. My stomach is now really big and in the evenings it tenses. So all in all since the 8th month I feel very pregnant :D,0,0,0,1,0,0
deu_train_track_a_02031,"Oh, now I finally know your name.",0,0,0,1,0,1
deu_train_track_a_02032,"How do you get there, are you generally in the movie business or were you approached on the street with ""Hey, you have exactly the body we need right now!"" and the probably most important question: which series or movie?",0,0,0,0,0,0
deu_train_track_a_02033,Do they pay well?,0,0,0,0,0,0
deu_train_track_a_02034,"Before any AfD sympathizers ask again why so much is being reported about the demonstrations, because they are the biggest demonstrations in German history, because they are important and right and because they are aimed at democracy, openness and tolerance and against the AfD and all enemies of democracy!",1,1,0,1,0,0
deu_train_track_a_02035,"Gaza is the scene of the most brutal crimes in world history, and the American government bears the greatest responsibility for the catharsis of the Palestinians.",1,1,0,0,1,0
deu_train_track_a_02036,"But please build it right, out of local wood, no trees should be cut down for an insect hotel, otherwise it's a paradox.",0,0,0,0,0,0
deu_train_track_a_02037,"Okay, it's nice that our collaboration is coming to an end, but I'm very disappointed in you.",0,0,0,0,1,0
deu_train_track_a_02038,"I felt the sarcasm in your words, but I lacked the certainty.",0,0,0,0,0,0
deu_train_track_a_02039,But discriminating against people just because of their gender is not that progressive...,0,1,0,0,0,0
