id,text,anger,disgust,fear,joy,sadness,surprise
deu_train_track_a_00001,"Hello to all the readers, since I'm staying home for a while now, I have a lot of time to read and hopefully answer a lot of questions. I'm looking for helpful literature on pregnancy! What books can you recommend to prepare a little? What book has scared you or was particularly helpful?",0,0,1,0,0,0
deu_train_track_a_00002,"You've probably been to different countries before, if you're so bold. Where would you rank the experience in Iraq? How was the food? How much money did you spend? Were there many tourists?",0,0,0,0,0,0
deu_train_track_a_00003,"When you play bingo for money, they start arguing.",0,0,0,0,0,0
deu_train_track_a_00004,I think #Baerbock is doing very well as Foreign Minister.,0,1,0,1,0,0
deu_train_track_a_00005,"I was already pregnant with the second vaccination and so far the child still has a normal number of arms and legs. It is more of a precaution because it is not yet possible to say for sure whether and how the vaccination affects pregnancy (although the data from the USA do not allow any concerns, for example).",0,0,0,0,0,0
deu_train_track_a_00006,Hamas will break the ceasefire as always.,1,1,0,0,0,0
deu_train_track_a_00007,Except against Gladbach.,0,0,0,0,1,0
deu_train_track_a_00008,It can't be that Tesla is being touted as an environmentally friendly car while huge areas of forest are being cleared for production!,1,1,0,0,0,0
deu_train_track_a_00009,Somehow I'm missing the steps between elementary school and junior high.,0,0,0,0,0,0
deu_train_track_a_00010,"reduce hours from 40 to 35, work 7 hours every day instead of 8 hours and if you work longer on Fridays go earlier, so after 6 hours and then you don't need a 30 minute break.",0,0,0,0,0,0
deu_train_track_a_00011,"That's art, and art comes from being able to.",0,0,0,1,0,0
deu_train_track_a_00012,Pessimist answer: Will the companies put themselves in the pocket anyway.,1,0,0,0,0,0
deu_train_track_a_00013,We help the vaccine victims among us...,0,0,0,0,1,0
deu_train_track_a_00014,"I had an online acquaintance who had a similar problem (I think). He said he's not interested in anything and he just can't find any hobbies. I don't know if it's the same for you. I think if you've been depressed for a long time, you can forget what it feels like to be interested in something.",0,0,0,0,1,0
deu_train_track_a_00015,"Brudi, your parents have to pay you alimony. It's not a charity but a law. Or you get Bafög if they don't have enough money. In cases where that doesn't work (for example, because you've been studying for too long) you can get a student loan from the country. Unlike Bafög you have to pay it back 100% but only late and in small installments. Absolutely okay 1 or 2 years to study with it. I'm very sorry that your parents don't have time.",0,0,0,0,1,0
deu_train_track_a_00016,"How political weight is increasing: With #Verdi on the side, #Neubauer and #FridaysForFuture become real players in German domestic politics.",0,0,0,1,0,0
deu_train_track_a_00017,"Is synesthesia correlated with high intelligence? Of the two synesthetists I know, one person has confirmed their high intelligence and the other I'm pretty sure she has it too.",0,0,0,0,0,0
deu_train_track_a_00018,"The climate is constantly changing every decade, every century, every millennium, when ice and snow melt and ways from Roman times have to come to light, who have had cars and airplanes or whatever.",1,1,0,0,0,0
deu_train_track_a_00019,"Dictatorship: 14 days in prison for putting flowers in Moscow or St. Petersburg because of #Nawalny. No dictatorship: If you shout ""The #Lamp must go!"" in Berlin or Munich and then go home unpunished.",1,1,0,0,0,0
deu_train_track_a_00020,If democracy only applies in one direction,1,1,0,0,0,0
deu_train_track_a_00021,"Yeah, but it depends on what I'm looking at, and I'm looking at more ""with"" and not necessarily what I'd be looking at alone, so it's kind of the other way around.",0,0,0,0,0,0
deu_train_track_a_00022,The first post in this sub where I don't feel bad about giving an upvote. Very well described. I wish you a great future together.,0,0,0,1,0,0
deu_train_track_a_00023,"It's only natural that in times of climate crisis we invest so much energy, time and money in the development of a hypokapitalist, moving small town on the sea.",1,1,0,0,0,0
deu_train_track_a_00024,Now you're even less sick.,0,0,0,0,0,0
deu_train_track_a_00025,#Putin says he has no reason to attack Poland or Latvia. That's great news. We can relax and trust him. The butcher from Ruzland has never lied or attacked a country. Blutin only wants peace and friendship with us. A true democrat and friend of people. Slava Ukrajini!,1,1,1,0,0,0
deu_train_track_a_00026,"Today we learned that a young woman from the neighborhood who was mildly affected by #MECFS after a #Corona infection for 2 years is now severely affected. We are simply so powerless against this disease, so more research is urgently needed. #LongCovid",0,0,1,0,1,0
deu_train_track_a_00027,"Fortunately, the power relations change in the autumn - finally an end to the Groko&Ampel men.",0,0,0,1,0,0
deu_train_track_a_00028,It's really complicated. Can you get away from each other? You make a day for yourself and then she in return? Your needs seem to be not being met right now. Ask her what she needs to become more balanced. And think about what you need to become more relaxed? Corona and then two children so different that's exhausting for any marriage.,0,0,0,0,1,0
deu_train_track_a_00029,"Ukraine is calling for membership of the EU and NATO, which, unlike all other former Soviet nations, it has never achieved.",0,0,0,0,0,0
deu_train_track_a_00030,"So as much as I resent your gynecologist's argument, I'm all the more pleased for you that you've found a new job and you're pregnant!",1,0,0,1,0,0
deu_train_track_a_00031,"A little tip that might help you with your learning: this is a website that provides news from around the world in simple language, and it's also recommended for people who are just starting to learn German.",0,0,0,0,0,0
deu_train_track_a_00032,"Mine's called Bitch because she's been telling me shit all day, and she's like a best friend who's not really a friend at all, but a mean bitch who's totally backwards, just wants the worst for you, but she makes it look like it's good.",1,1,0,0,0,0
deu_train_track_a_00033,Only politicians want war! What if no one wants to die for these 5 politicians anymore? Why don 't we just turn the tables?,1,1,1,0,1,0
deu_train_track_a_00034,Why criticism? Isn't the idea that she's protesting a genocide dominant here?,1,0,0,0,0,1
deu_train_track_a_00035,"By the way, dear AfD members and thinkers, this is how it ends in a country where you really can't say what you think!",1,1,0,0,0,0
deu_train_track_a_00036,"I've had this for years and I've given up at some point. I still have male friends, but women usually disappear with the relationship...",0,0,0,0,1,0
deu_train_track_a_00037,Wow. I was wondering if you could maybe ask her to draw you wearing that awful Christmas hat with the LEDs? And of course post it here.,0,0,0,1,0,0
deu_train_track_a_00038,The people at Dirk's around here are always very rude to customers.,0,0,0,0,0,0
deu_train_track_a_00039,"I can only say that I have not had any problems with the umbilical cord and, according to the midwife, it is very rare that it causes problems.",0,0,0,0,0,0
deu_train_track_a_00040,"I don't recommend separation, but let me tell you from firsthand experience that being a child in a marriage like this is totally shitty.",0,1,0,0,1,0
deu_train_track_a_00041,Lauterbach and all those involved in the poisoning (vaccination) are mass murderers!,1,1,0,0,0,0
deu_train_track_a_00042,"Fortunately, there is still a local fast-pitch football a stone's throw away.",0,0,0,1,0,0
deu_train_track_a_00043,"I was just at my gynecologist's and I told her I wanted to take the pill. She gave me folic acid pills and told me to get some. Which one did you take and can you recommend or does it matter which one you buy? What experiences have you had that I should be aware of, except no raw food?",0,0,1,0,0,0
deu_train_track_a_00044,"My favorite clip of him is ""Huch, now they're all gone.... Anyway, I was done"". I just can't find it anywhere.",0,0,0,1,0,0
deu_train_track_a_00045,"Hey, thank you for your AmA. I'm going to be a father soon and I'd like to ask you a few questions. What are the benefits for you? Did she earn more than you? Why 3 years and not 2 or 1 year? What help did the state give you?",0,0,0,0,0,0
deu_train_track_a_00046,Australia is making a significant contribution to climate action by controlling migration. It makes no sense to let people move uncontrollably from developing to industrialized countries where their CO2 footprint is much higher.,0,1,0,0,0,0
deu_train_track_a_00047,"And they have a bubble. Sometimes it's full of fresh air, sometimes it's full of nasty viruses.",0,1,0,0,0,0
deu_train_track_a_00048,"1. Volunteer? 2. How does a conversation like this work? Someone calls, expresses a desire to commit suicide, you talk, and in the end, ""Okay, I'll think about it"". 3. Have you ever had someone kill themselves on the phone or afterwards?",0,0,0,0,0,0
deu_train_track_a_00049,"These people are interfering with the traffic, they're stuck there!",1,0,0,0,0,0
deu_train_track_a_00050,"Listen to the Linguist podcast, it's got some very helpful tips, I haven't heard the episode here yet, but I've saved it for myself because I'm thinking something similar, maybe it'll help you!",0,0,0,1,0,0
deu_train_track_a_00051,I didn't know The xx was going to be on the ballot.,0,0,0,0,0,1
deu_train_track_a_00052,"Hello Dmitry. I've been rummaging around your block for a while now and I had to smile. I admire that you can take it all with such gallows humor. I also like your game taste. Unfortunately, I haven't been able to play Bloodborne yet because I don't have a PS4 for that. But for just one game, it would be too expensive for me to buy.",0,0,0,1,1,0
deu_train_track_a_00053,Because you answer everything that's not on the tree at three.,0,0,0,0,0,0
deu_train_track_a_00054,Can you describe or give examples of what is different about your son?,0,0,0,0,0,0
deu_train_track_a_00055,Have you ever had customers who wore unpleasantly little when they opened the door?,0,1,0,0,0,0
deu_train_track_a_00056,"I find it interesting that Berlin is mentioned by some. Berlin has the image that it is dirty, unfriendly and ugly. So is Berlin even dirtier, unfriendly and uglier than you think or what is overrated about it? Paris, on the other hand, has a good image. Beautiful houses, couples in love at every corner and everyone sits in cafes and eats croissants. In reality, it's an overpriced dump that has disappointed most visitors.",0,1,0,0,0,0
deu_train_track_a_00057,How embarrassing Germany has become.,0,1,0,0,1,0
deu_train_track_a_00058,"I did an AMA a few years ago, and since I'm in bed with Corona right now, I thought I'd use the time ""meaningfully"". Ask everything. So, I'm trying to sleep now, but since Corona won't go away overnight (oh how nice it would be), I'll have plenty of time tomorrow to answer more questions.",0,0,0,0,1,0
deu_train_track_a_00059,Children accidentally vaccinated with Moderna - So does that fall under the category: Immunization experiments on children?,1,1,0,0,0,0
deu_train_track_a_00060,"I had my first relationship at 30. Don't stress yourself. Concentrate on yourself, do what you enjoy, or do something nice with friends, and then it comes naturally. I know this sounds easier than it is, but you can't force it. You can also try it with dating apps to gain experience. I wish you all the best, you get it. Enjoy life and most importantly, even the smallest success is a step in the right direction.",0,0,0,1,0,0
deu_train_track_a_00061,"- Cool, just like last time, how thoughtful you were in dealing with this, you must have analyzed it very carefully and made arrangements.",0,0,0,1,0,0
deu_train_track_a_00062,"I was there and I'm still alive, how can that be if ""climate change"" is supposed to destroy everything and everyone?",1,1,0,0,0,0
deu_train_track_a_00063,"The man cooks here often enough, mostly on weekends or on days when he doesn't work until after 6:00.",0,0,0,0,0,0
deu_train_track_a_00064,"Then we should try to reach them, because they are relatively active on Twitter and Facebook, and if enough people respond to that, the chancellor candidates, or their parties, will take a look at it.",0,0,0,0,0,0
deu_train_track_a_00065,"Then you sit at the computer, crying and trembling, because the leadership is once again expressing its dissatisfaction...",0,0,1,0,1,0
deu_train_track_a_00066,Laughter is ultimately the only thing that helps and keeps you optimistic.,0,0,0,1,1,0
deu_train_track_a_00067,I would say that the church in the background is the Dresden Hofkirche and on the right there is another tower of the castle.,0,0,0,0,0,0
deu_train_track_a_00068,"I'm sorry you had to go through this. The surgeon obviously doesn't have any sense of human interaction (hopefully in the medical field). Maybe she's super proud that she can suppress her depression through work or even overcome it and considers it the cure-all. Unfortunately, there's another clear sign of how poorly understood the medical picture itself is.",0,1,0,0,1,0
deu_train_track_a_00069,"So either you're going to be blessed like Saitama, and in that case, you're going to keep training, and then in two years, you're going to be able to overthrow every dictator, or your girlfriend has some other problem, jealousy, fear of loss, she wants freedom, and she's looking for meaningless stress, or she's looking for a furry seat.",0,1,0,0,0,0
deu_train_track_a_00070,"What's going on inside of you? Probably a lot, but maybe you can give us a picture of what's going on inside of you right now? What thoughts and feelings are particularly vivid right now?",0,0,0,0,0,0
deu_train_track_a_00071,"I got the vaccine directly from my gynecologist, otherwise I'd have to go to a GP's office, and there are only vaccination centers for Covid.",0,0,0,0,0,0
deu_train_track_a_00072,BILD should finally accuse and criticize this senseless measure!,1,0,0,0,0,0
deu_train_track_a_00073,"Do bomb squadron leaders also work in the Combat Equipment Disposal Service, or do they all come from the Military EOD?",0,0,0,0,0,0
deu_train_track_a_00074,You mean the two words in the last sentence?,0,0,0,0,0,0
deu_train_track_a_00075,"Depression has nothing to do with stupidity! It's the opposite, because people who don't think think think less, so most depressed people think too much and the head works too much. I wish you all the best and I understand your feelings.",0,0,0,0,0,0
deu_train_track_a_00076,The Animal Farm became the military-industrial complex of animals.,1,0,0,0,0,0
deu_train_track_a_00077,"Because, and I quote, Spore's mother is a single parent, our son will never be able to eat there. Yeah, thank you. You have to talk to me too. I'm eight years old, not stupid or deaf. That hurt. Just like I was told I'd only play with your son because you're rich. Do you really think your son is so disgusting that I only like him because he has an N64?",0,0,0,0,1,0
deu_train_track_a_00078,"Ladies, are there any women here who are affected by having such an incredibly disgusting, funny taste in their mouths? I have to suck on Fisherman's Friends all the time or chewing gum or something like that. I just get sick because of the taste in my mouth.",0,1,0,0,0,0
deu_train_track_a_00079,I had a dream. Russian and Ukrainian soldiers laid down their weapons and went to their cities. I was awake... only dreaming.,0,0,0,0,1,0
deu_train_track_a_00080,"We were very happy with the midwives in the hospital, so we brought a birth certificate, candy (no thanks) and something for the coffee box. So, after we were home, we went there again. My gynecologist and my diabetologist also got a card and what kind of box, because I was so excited. This didn't work for me with my midwife. But I wasn't really happy with the treatment for us either.",0,0,0,0,0,0
deu_train_track_a_00081,"The Russian troops should leave Ukraine, they have nothing to lose there!",1,1,0,0,0,0
deu_train_track_a_00082,"They would much rather be poor, free and unencumbered like us, but one has to carry that burden.",1,1,0,0,0,0
deu_train_track_a_00083,"Hello! It's an exciting story and it's fun to read. I'd try to make friends. Screaming probably doesn't work and letting yourself be eaten isn't a good ending either. Well, maybe first scream and then try to make friends. I'd be happy to see a sequel, no matter what option happens!",0,0,0,1,0,0
deu_train_track_a_00084,"Since whaling has been illegal for years, 2024 is a few years too late!!!!",1,0,0,0,0,0
deu_train_track_a_00085,Isn't that what they do with gin like they do with rum?,0,0,0,0,0,1
deu_train_track_a_00086,"To the anonymous silver donor people: many love thank you, double point three people: back and thank you, smaller than three.",0,0,0,1,0,0
deu_train_track_a_00087,"Let's hope so, but in case of emergency, there must be emergency dentists in your area.",0,0,0,0,0,0
deu_train_track_a_00088,How did you decide to do this? What were your reasons?,0,0,0,0,0,0
deu_train_track_a_00089,It's not as good at destroying democracy as democracy itself.,1,1,1,0,0,0
deu_train_track_a_00090,"The Ukrainians are holding their heads up for us and many other countries, because they would have real problems if Putin's Go-West action were to succeed.",0,0,1,0,1,0
deu_train_track_a_00091,"It is totally impressive and shocking to go through it, it is incomprehensible to me that we Germans can still vote for the AfD today.",0,1,0,0,1,0
deu_train_track_a_00092,Who's got the unranked casual?,0,0,0,0,0,0
deu_train_track_a_00093,"Just make Anne want to turn on, then you're just so irrationally angry that you forgot about the full moon again.",1,0,0,0,0,0
deu_train_track_a_00094,"The 4 enemies post whenever they want haha, now I thought I'd already missed it lmao",0,0,0,1,0,0
deu_train_track_a_00095,The tragic acceptance of many people of this reality paints a bleak picture of a humanity that closes its eyes to the urgent need for a ceasefire in Gaza.,1,0,0,0,1,0
deu_train_track_a_00096,I'm going to Tokyo for a week soon. What are the dishes and snacks you shouldn't miss? What are your favorites?,0,0,0,0,0,0
deu_train_track_a_00097,"Freedom for Palestine <unk> Even if all the media and politicians are on one side of the Palestinian genocide, at some point the double standard will come to an end.",1,0,0,0,1,0
deu_train_track_a_00098,"Hey, please don't let your head hang. I think time is not easy for anyone right now. And when individual circumstances come along, you feel lost or hopeless. I've been having a really bad time these past few weeks. I'm relatively newly separated from my parents after a long relationship, had to move back in (not the best mood at home) and I couldn't really distract myself because of corona. What helped me was to plan regular and just as regular phone calls with friends and go through it, no matter what the day was or the mood.",0,0,0,1,1,0
deu_train_track_a_00099,"Just vote for the AfD, what the green left is drunk like the red socks twisting everything is hardly to endure just <unk>",1,1,0,0,0,0
deu_train_track_a_00100,"Because if you want to deter Russia from further attacks on European states, you have to strongly support Ukraine.",0,0,1,0,0,0
deu_train_track_a_00101,Garbage without Blaszczykowski and Barrios,1,0,0,0,0,0
deu_train_track_a_00102,"The question is, is the devil male?",0,0,0,0,0,0
deu_train_track_a_00103,"But if the holy Ukraine, the phony Russia, has already been defeated, why are more tax billions being poured in?",1,0,0,0,0,0
deu_train_track_a_00104,"It's been a few years since I was sitting in the tram in the fourth seat, facing a little, somewhat corpulent boy (about 10 years old) who's been staring at me pretty hard during the ride - constant frontal eye contact.",0,1,0,0,0,1
deu_train_track_a_00105,"It's not too early, it's too late, and you should discuss it before you decide on a partner, because there's no compromise.",0,0,0,0,0,0
deu_train_track_a_00106,"I think she's seen it from us humans. Since my friend ""lives"" here, every time someone sneezes, they say ""health"". That's what one of my cats has copied, and every time someone sneezes, he reacts with a chirp (like when he sees a bird outside the window). It's so cute, but unfortunately you can't make videos of it because you can't get the camera out of a sneeze that fast.",0,0,0,1,0,0
deu_train_track_a_00107,"But that so many in the West ignore the destructive fanaticism and hatred of women that Hamas drives and that they themselves would be its first victims, I find really devastating.",0,1,0,0,1,0
deu_train_track_a_00108,"Sometimes life circumstances or needs and goals don't match, and the greatest love doesn't help, and if you have to give up a significant part of your personality to have a relationship, you're going to be unhappy in the long run.",0,0,0,0,1,0
deu_train_track_a_00109,"I don't understand why people refuse to send this Taurus, but it's better in Ukraine than in Germany.",1,0,0,0,0,1
deu_train_track_a_00110,"What do you think about when a German potato like me comes up with the idea of learning Turkish? Not even for any special reason, but just like that. Where we are right now. Do you know Turkish books (novels or prose), movies/series and/or music that might not be quite so conservative in their worldview?",0,0,0,0,0,0
deu_train_track_a_00111,"Your whole organization exists only to promote socialism, and this climate is just a hook to lure naive people.",1,1,0,0,0,0
deu_train_track_a_00112,What a surprise.,0,0,0,0,0,1
deu_train_track_a_00113,"41+4, the introduction started at 41+3. But we were very late with that, more likely a birth date before ET. On Wikipedia you can find some statistics from Switzerland:",0,0,0,0,0,0
deu_train_track_a_00114,4 picture makes zero sense to you would delete,0,1,0,0,0,0
deu_train_track_a_00115,Why did you give 100 subs just for a fucking Minecraft house?,1,0,0,0,0,1
deu_train_track_a_00116,"That's exactly what I said before, at the very beginning of the invasion of Gaza. If no one stops them, they'll tear everything to shreds. Now it's happening live before our eyes, and the whole world is watching and allowing it to happen!",1,1,0,0,1,0
deu_train_track_a_00117,The boss called. They want to get rid of me. There's a threat of dismissal. It's all a misery. I miss my life and my work so much. Now I'm lying here crying. #fckcovid #longcovid #mecfs,0,0,1,0,1,0
deu_train_track_a_00118,"I was initiated because my child was too small. It was absolute hell and she was born with 3400g and 55cm. It is not uncommon that, especially when the baby is deaf, the doctors properly estimate the weight. I strongly advise against an initiation based on my experience.",0,0,0,0,0,0
deu_train_track_a_00119,"Unbelievable, you have to pay for it, even though you're actually advertising for Lidl.",1,0,0,0,0,0
deu_train_track_a_00120,67 Palestinians were killed in Rafah tonight; they fled there because Israel declared Rafah a safe area - now they have been killed there.,1,1,0,0,1,0
deu_train_track_a_00121,Can't you stay with friends or family until you find a new tenant?,0,0,0,0,0,0
deu_train_track_a_00122,"I don't care about World War III, what about peace?",0,0,1,0,0,0
deu_train_track_a_00123,"I'm often in hotels for business, just for one night, and I always wonder, ""Are they gonna throw that away now?""",0,0,0,0,0,0
deu_train_track_a_00124,"I've also been lonely for a long time, and I don't have a lot of people that I feel like I can trust, and I can understand how you feel, and if you need someone, I'm happy to listen.",0,0,0,0,1,0
deu_train_track_a_00125,Do you miss your parents from time to time? Do your parents try to make contact? How was your emigration? Were you alone or with friends or siblings? Thank you.,0,0,0,0,0,0
deu_train_track_a_00126,"Hi, I've just had my second shot, so I'm not'safe' yet. It's become a habit for us to test ourselves before we meet other people. Even if the tests aren't super reliable, it at least gives me a sense of security. We try to move as many meetings outdoors as possible, but of course that doesn't always work. Since the incidence is rising in my city, I'm also thinking about how I can reduce contacts.",1,0,1,0,0,0
deu_train_track_a_00127,"No, it works! Against exclusion, hatred and political repression",0,0,0,0,0,0
deu_train_track_a_00128,"I tried monk pepper a few months ago because I was hoping it would alleviate my PMS symptoms, but it didn't seem to have any effect on me, so it didn't affect my mood swings or my cycle length or anything else.",0,0,0,0,1,0
deu_train_track_a_00129,"Hello u/KryztallGPF, I realize you're having a pretty bad time right now. You're obviously seeing yourself as an enemy and you're going to harm yourself by your destructive behavior. How often do you go through something like this? Briefly to the context: We're professional social workers who are searching the Internet for forums and chats. Our offer is aimed at young people and young adults, who we offer free and anonymous support and advice. If you'd like, you can let us know.",0,0,0,1,1,0
deu_train_track_a_00130,"The video confirms that the IDF is shooting at people running to the food deliveries, this murder happens every day and the world is watching.",1,1,0,0,1,0
deu_train_track_a_00131,"The magician of Letzebuerg is checking out the gin at Beauxbatons, nice Hogwarts.",0,0,0,0,0,0
