id,text,anger,disgust,fear,joy,sadness,surprise
deu_train_track_a_01284,"I've invested a five-cent sum in equipment to ""look at the stars"" on a balcony in a big city and fulfill a childhood dream of mine. Astronomy has nothing to do with signs. One is science, the other is like Globoli. & my favorite pictures: [ Thank you for the many interesting questions. I have to go away for a few hours now, but I'll continue to answer them in the evening. Edit2: Wow, I didn't expect such a big response. Thank you for the great and interesting questions! I'll check again on Monday night.",0,0,0,1,0,0
deu_train_track_a_01285,"This could be a new version of Tales from the Crypt. Thank you for sharing, we're looking forward to it!",0,0,0,1,0,0
deu_train_track_a_01286,"I experienced something similar last week, but I can't describe it as well as you.",0,0,0,1,0,0
deu_train_track_a_01287,What do you think can be done in schools to teach people media literacy so that they don't fall for the obvious fakes?,0,0,0,0,0,0
deu_train_track_a_01288,"It's nice that you write here. I often feel the same way. You have to force yourself to do something. The good thing is that after a down comes a high again - so that's it. Some people also help to set a kind of time limit, 2 days and then it goes on.",0,0,0,1,0,0
deu_train_track_a_01289,"Most software isn't updated as regularly as it should be, and there are some very serious security flaws, and it's a wonder that there are so few leaks or cyberattacks of this magnitude.",0,0,1,0,0,0
deu_train_track_a_01290,Years of oppression of the Palestinian people in their own country is the decisive point.,1,1,0,0,0,0
deu_train_track_a_01291,"Are there any hostages left to be freed, or has Israel bombed and killed them all?",0,1,0,0,1,0
deu_train_track_a_01292,"Well, your flags in the profile say it all.",0,1,0,0,0,0
deu_train_track_a_01293,"It's not that it wasn't bad before, but since Putin gave this interview to Tucker Carlson, the Western media and politicians have only had more snaps.",0,1,0,0,0,0
deu_train_track_a_01294,"As someone who's worked at a funeral home, I can tell you that this is one of the most normal things. Death is part of life. I've seen a lot of parents with their babies at funerals, and it didn't bother anyone.",0,0,0,0,0,0
deu_train_track_a_01295,"When you go to the swimming pool, you logically have to go to a changing room to change. ""Family changing rooms"" doesn't tell me anything, to be honest, but only group changing rooms.",0,0,0,0,0,0
deu_train_track_a_01296,"A discussion on concrete military alternatives to an attack on the Crimean Bridge with Taurus by high-ranking German soldiers, that's the explosion, not the eavesdropping alone. An attack on a country with which we are not at war. But what can you expect from Green politicians there. By the way, the bridge is civilian infrastructure.",1,1,1,0,0,0
deu_train_track_a_01297,"So first of all, I would definitely like more because I really adore this setting. I, as a lovecraft and horror fan that I am, love the fisherman's village setting so unusually much that it's incredible and you've put it into a brilliance with these two chapters that I was deeply amazed by. Thank you for letting me read such a work and I'm honestly very excited to see how this story continues.",0,0,0,1,0,0
deu_train_track_a_01298,Is Germany really the last European country to take any consequences?,1,1,0,0,0,0
deu_train_track_a_01299,"Great, thanks for the quick response!",0,0,0,1,0,0
deu_train_track_a_01300,All my followers who live in the Küsren region: Stay save. I'll give you my thumbs up that everything is going well #Zeynep #Sturm,0,0,1,0,0,0
deu_train_track_a_01301,"Only the Ukrainians have the right to decide and negotiate a diplomatic solution, they pay the price and they are the only ones entitled to quantify the value of their freedom.",1,0,0,0,0,0
deu_train_track_a_01302,"We should be ashamed that we are allowing a whole region to be razed to the ground in retaliation for a bestial attack by Hamas. With 30,000 dead and every spark of reconciliation becoming increasingly impossible, the petty thinking of the Houthi friends is unfortunately gaining ground. At least our chancellor still knows the limits.",1,1,1,0,1,0
deu_train_track_a_01303,Why is Israel above all international laws?,1,0,0,0,0,1
deu_train_track_a_01304,"In my experience, it's only very conditionally that you can change that. You're attracted to dominant men, he's not dominant. Maybe he lacks creativity, imagination, or it just doesn't match his personality. You often make the mistake of thinking that everyone should like the same kind of sex or be attracted to this or that.",0,0,0,0,1,0
deu_train_track_a_01305,Madness! I can still remember when a Mr. Dirk Müller predicted exactly that over a year ago!,0,0,0,0,0,1
deu_train_track_a_01306,I collected 3k with this picture 4 months ago. Good luck! Good taste in the selection of pictures.,0,0,0,1,0,0
deu_train_track_a_01307,A justified reaction to last year's massacre - defense.,0,1,0,0,0,0
deu_train_track_a_01308,We are now dealing with a motion for a change of the statute to give the JA a permanent seat on the state board. #LPT #AfD #Stuttgart,0,0,0,0,0,0
deu_train_track_a_01309,I would simply ban cruises and I mean that completely seriously,1,1,0,0,0,0
deu_train_track_a_01310,This makes the church officially greenlit for the AfD.,0,1,0,0,0,0
deu_train_track_a_01311,"My highlight: I had my first job after college and was always really pissed off in the evenings and wanted to spend 10 minutes for myself to cuddle on the couch and watch some shit on YouTube about brain softening. Her argument against it: I've been waiting for the semester holidays, 10h a day. I was never so tired, now don't act like that. Joa as the lady had her first internship, she never apologized or anything.",0,1,0,0,0,0
deu_train_track_a_01312,"The deep problem lies in your attitude in your head. If your brain immediately decides between'readable' or not, even if subconsciously, it means that you already have the intention in your head and always have someone to find and date again. Were you emotionally dependent on your last relationship? You may be looking for a replacement.",0,0,0,0,0,0
deu_train_track_a_01313,"I got a baby tooth on one of those pedals in kindergarten in the early '90s, and it makes me shudder.",0,0,1,0,0,0
deu_train_track_a_01314,"One step forward, two steps back. I've finally accepted my debt after years of (!) so that it finally comes from my soul. For that, I broke a tooth halfway yesterday. I don't know if I can go to the dentist, but it's a tooth that is visible when I smile. Sorry and hate myself, it keeps me from doing other important things.",1,0,1,0,1,0
deu_train_track_a_01315,"I feel like I should see it, but no one wants me to see blood.",0,0,1,0,0,0
deu_train_track_a_01316,I know that too well.,0,1,0,0,0,0
deu_train_track_a_01317,"That's how slowly you recognize the dove in him. ""When he was a little chick, I wouldn't have guessed what kind of bird it was.",0,0,0,0,0,1
deu_train_track_a_01318,"First of all, I wish you all the best and that the symptoms will subside soon. As far as I know, gynecologists are not supposed to issue employment bans. My gynecologist also said that if she could, she would actually send every pregnant woman to the hospital. Have you been to a doctor for this reason?",0,0,0,0,1,0
deu_train_track_a_01319,"In Germany, there is a systematic denial that there is a genocide in the Gaza Strip, and if you have wondered how it could be that the German majority society has silently accepted the Holocaust, we are experiencing it live right now.",1,1,0,0,1,0
deu_train_track_a_01320,"I think you're talking about 12 weeks of pregnancy, which is the first day of the last period before pregnancy, which is about two weeks before you can even get pregnant.",0,0,0,0,0,0
deu_train_track_a_01321,"How come you speak German so well? What, would you say, is the opinion of the Russians about Germany? Thank you for the Q&A.",0,0,0,0,0,0
deu_train_track_a_01322,The thought of a serious illness keeps me up at night.,0,0,1,0,0,0
deu_train_track_a_01323,He has more honor than all the rest here on Twitter but good that he did it doc did not,0,1,0,1,0,0
deu_train_track_a_01324,Only love for the stump,0,0,0,1,0,0
deu_train_track_a_01325,"Religion is when the death of an individual 2,000 years ago is more important than the death of hundreds of people every day.",0,1,0,0,1,0
deu_train_track_a_01326,"I also had an early abortion in my last pregnancy, but I didn't get any pills prescribed. (Now in week 35) I would just see it as support. Progesterone is especially important until week 12 and if you can reduce the chance of another miscarriage, that's good. But if you're not sure, ask your doctor again or read the package insert.",0,0,0,0,1,0
deu_train_track_a_01327,"We're paying the other perpetrators directly, as if everything that's sent to Gaza isn't going to Hamas.",1,1,0,0,0,0
deu_train_track_a_01328,Twitter is like crack if it's harmful.,0,1,0,0,0,0
deu_train_track_a_01329,Who protects us from environmentalists?,1,1,0,0,0,0
deu_train_track_a_01330,"I finally pulled myself together and walked out of church today, and it feels good.",0,0,0,1,0,0
deu_train_track_a_01331,Thank you for this! Your work for the cause is so important!,0,0,0,1,0,0
deu_train_track_a_01332,"Is there something serious going on between your ex-fiancé and your oldest friend right now? Wow, that's a wild story.",0,0,0,0,0,1
deu_train_track_a_01333,"I had this with my big one pretty strong, so I had half a loaf of bread to get me full for half a day. It was just stupid because I was breastfeeding full and my midwife was talking to me very conscientiously because it was just not healthy for me and my child. I was back to my pre-pregnancy weight within two months... I tried to eat more and took a lot of vitamin C because I also had a severe iron deficiency. After a few months it went away but until then I really remembered every meal.",0,0,0,0,0,0
deu_train_track_a_01334,"The AfD is right-wing, but it's not right-wing extremist, there's a huge difference.",0,0,0,0,0,0
deu_train_track_a_01335,"Moin, I'm going to be a father for the first time, and I have a question about ultrasound appointments. Have you taken time off for this every time, or how did you do it? How often is that in pregnancy? Thank you for your help.",0,0,0,0,0,0
deu_train_track_a_01336,"Hi, so under Corona you could rather say the opposite has been the case for 16 years.",0,1,0,1,0,0
deu_train_track_a_01337,How does it work when there's a damage? It can always happen. Whether it's parking or just one of the special requests. Or asked differently.,0,0,0,0,0,0
deu_train_track_a_01338,What can we do in the face of Israel's genocide? 1. Criticize and condemn Israel whenever and wherever possible! 2. No more voting for pro-Israel politicians and parties! 3. Support pro-Palestinian action alliances! 4. Outlaw Zionist lobbying!,1,1,0,0,0,0
deu_train_track_a_01339,"I'm already sick, so I'm not that sick yet.",0,0,0,0,0,0
deu_train_track_a_01340,My sister is keeping her distance!!️!!️,1,0,0,0,0,0
deu_train_track_a_01341,"Are you good-looking? Babyface, 1.70m? If so, I think it has something to do with people thinking they can do anything to you because you're shorter and have a babyface and want to piss you off because you look better than them.",0,0,0,0,1,0
deu_train_track_a_01342,Discrimination is punishable and we really live in a dictatorship. News only reports what the state says. Puten is and was right about everything. We let ourselves be oppressed.,1,1,0,0,0,0
deu_train_track_a_01343,"As the eldest of your siblings, it's your job to tell all the younger ones that they were found in the trash.",0,0,0,1,0,0
deu_train_track_a_01344,The United States should admonish moderate Israel. Israel is acting morally right.,0,0,0,0,0,0
deu_train_track_a_01345,"I know all too well. I'm curious to see what tips come up here. I also think it's funny that because of your profession you have a certain expertise in your field, but the people at the table are more interested in the half-knowledge of others and have a hard time clarifying some things.",0,1,0,0,0,0
deu_train_track_a_01346,Why is the murder in Münster suddenly silenced? Why are the perpetrators reinterpreted as victims?,1,0,0,0,0,1
deu_train_track_a_01347,Just like in the past in <unk> under communist rule.,0,0,0,0,0,0
deu_train_track_a_01348,The idea is great! I bet you're a role-player! Thank you for the great story!,0,0,0,1,0,0
deu_train_track_a_01349,"The best vacation of my life was a Mongolian expedition. 4,000 kilometers of off-road across this wonderful, wild land was breathtaking. The hospitality of the nomads was as impressive as their way of life. EVERYTHING is recycled, no trash or debris is left behind when the family looks for a new location after a few weeks.",0,0,0,1,0,1
deu_train_track_a_01350,"A few weeks ago, a policeman shot three times at a fleeing vehicle near here. The car had probably accelerated before and drove straight at the officers. As far as I know, the colleague could take a week's leave to write a report for each bullet.",0,0,0,0,0,0
deu_train_track_a_01351,What a surprise! My parents gave me a car.,0,0,0,1,0,1
deu_train_track_a_01352,"Next time, please take my cats, my wife, our fishing and me with you.",0,0,0,1,0,0
deu_train_track_a_01353,"Maybe it's an unpleasant question, but I've been wondering for a long time, like in a cross-sectional paralysis, does your bowel movement work, or do you notice, despite the paralysis, when you have to?",0,0,0,0,0,0
deu_train_track_a_01354,"As long as the manufacturer's guarantee of compensation for vaccine damage is rejected, NO vaccination!",1,1,0,0,0,0
deu_train_track_a_01355,"I'm 24 years old, and since 2020 I've been a patient in a custodial facility for a crime committed in 2019 under the influence of alcohol.",0,0,0,0,0,0
deu_train_track_a_01356,"I think you have to distinguish between ""medication side effects"" and ""vaccination side effects"". When you vaccinate, the body goes from full course defense - that's fine - even if there's no danger. Side effects would be if you get a third arm or green pustules on your butt.",0,0,0,0,0,0
deu_train_track_a_01357,"Digga, anything yellow is annoying or ugly. Bees, wasps, yellow candy. No one wants to eat lemons.",1,1,0,0,0,0
deu_train_track_a_01358,"The easiest way is to contact the police, who have the opportunity to take the accident on one hand and on the other there is the possibility of a report to check the suitability (paragraph 2 paragraph 12 StVG). This report is the fastest way to inform the driver's license office of such incidents. And as for leaving your tip with the note at the accident, legally speaking, this is not enough to fulfill his duties.",0,0,0,0,0,0
deu_train_track_a_01359,"Good improvement, I'm really sorry about that: unfortunately, a lot of people don't know that real cat bites (even from their own cat) should always be clarified by the doctor and can be emergencies.",0,0,1,0,1,0
deu_train_track_a_01360,"I'm so sorry for you, but I always try to be grateful for the good times we had together, and I try to remember the good times.",0,0,0,0,1,0
deu_train_track_a_01361,The driver who wanted to drive at 0:37 on the highway was very frightened.,0,0,0,0,0,0
deu_train_track_a_01362,"First, Selensky allows civil war in his eastern parts to eliminate Ukrainians of Russian descent, and now he watches his young men die on the battlefield or flee abroad.",1,1,0,0,0,0
deu_train_track_a_01363,"I'm from Berlin, but I can't answer your question, but I just wanted to give you a little linguistic tip: c-section is German for ""Kaisercut"" to avoid confusion.",0,0,0,0,0,0
deu_train_track_a_01364,"In a deep tunnel, Yahya Al-Sinwar hides and protects himself with children, women and the elderly. After the war is over, he will emerge like a mouse from the tunnel and say: ""I have won"". Unfortunately, those who have been expelled and the hungry and those who have lost their homes and their children will applaud him.",1,1,0,0,1,0
deu_train_track_a_01365,Many shelves would be empty,0,0,1,0,0,0
deu_train_track_a_01366,"Funny crocodile edit: thank you for the awards, the first time I've ever won any, and then for such an intellectually high-quality comment!",0,0,0,1,0,1
deu_train_track_a_01367,"Anyway, I started ""first"" in the 12th week, and a lot of them were already full. I don't like to talk on the phone, so I also wrote some midwives an e-mail when an address was given to find out if they still have the capacity. Do you have any friends who can recommend a midwife? If you can draw on personal experiences from others, that's fine too.",0,0,0,0,0,0
deu_train_track_a_01368,"I think Boris Johnson renounced his U.S. citizenship because as a U.S. citizen, he would have had to pay taxes there as well.",0,0,0,0,0,0
deu_train_track_a_01369,No city hall for Nazis.,1,1,0,0,0,0
deu_train_track_a_01370,"With international aid to Ukraine, your Kremlin money-lender will soon be finished.",1,1,0,1,0,0
deu_train_track_a_01371,The evil creatures when you turn off the light in the basement and run up again.,0,0,0,0,0,0
deu_train_track_a_01372,"Energy will never be cheaper again, because the government needs every penny to be able to waste billions all over the world.",1,1,0,0,0,0
deu_train_track_a_01373,"If you want to support them, just ask them on chat if and where you can support them, and depending on how close you are, you can offer to help them with the household chores, but also bring food, go shopping, or just be there for a while.",0,0,0,1,0,0
deu_train_track_a_01374,"This night I hope for many burning orcs, this anger and hatred grows and grows into immensity.",1,1,0,0,0,0
deu_train_track_a_01375,Another step forward but you're really cute!!,0,0,0,1,0,0
deu_train_track_a_01376,"I'm pretty sure that five days is the guideline, but I've also heard of longer waiting times, and a good doctor looks at it again and then says, ""I'll let you know how the results are"", and then says, ""I'll let you know how the results are"".",0,0,0,0,0,0
deu_train_track_a_01377,"When I was a kid, my aunt sent me a package for Christmas, and the cardboard box said it would be a sound blaster for the PC, and we were in the age of self-built PCs, and we couldn't wait until Christmas Eve, and the cardboard box was torn up, and it said, ""Hack!",0,1,0,0,1,1
deu_train_track_a_01378,"I also need a size 38 from 36 or 37, but that's all after my second pregnancy, so I couldn't wear 36 after the first one, and my podiatrist said it's not that rare, because it puts more weight on your feet, and you often get wider feet.",0,0,0,0,0,0
deu_train_track_a_01379,"If he's reasonable, he's in a toxic relationship. Fucking hell, when I read through the comments like this, it's really scary what kind of bad friends people are here... just don't interfere and so on. If friends are betrayed and disrespected by me and I can stay in a relationship for a long time without knowing it and I can change that, then it's a moral duty.",0,1,0,0,0,0
deu_train_track_a_01380,The process is mainly in our opponent's hands when he runs the long balls.,0,0,0,0,0,0
deu_train_track_a_01381,"The biggest problem of the #AfD bubble: complete lack of media competence, ""informing"" exclusively in the AfD bubble and the consistent refusal to read more than one headline. #Corrective",1,1,0,0,0,0
deu_train_track_a_01382,Correction: it's called climate terrorists.,1,1,0,0,0,0
deu_train_track_a_01383,So providing money for the consequences while you're still part of the cause?,1,1,0,0,0,0
deu_train_track_a_01384,I'm so happy for you! It's never too late to find love :) Good luck to you all <3,0,0,0,1,0,0
deu_train_track_a_01385,"Why is there so little talk about the fact that the work of UNRWA is very dangerous, so dangerous that more than 150 staff have already been killed trying to organize humanitarian aid for the desperate population in Gaza?",1,1,0,0,1,0
deu_train_track_a_01386,When the complete idiots have disappeared from politics.,1,1,0,0,0,0
deu_train_track_a_01387,"Especially popular is the phrase ""We had to give up so much during Corona"". The phrase is probably from those who also liked to give up the mask during Corona.",1,1,0,0,0,0
deu_train_track_a_01388,"I come from a very educational Hartz IV family, I was the only person in the entire (also extended) family to go to high school and graduate from high school. After that, I studied at home and abroad, now I work and I'm part of the middle class.",0,0,0,1,0,1
deu_train_track_a_01389,"Would you find it as entertaining as I do if we had a doping Olympiad where everyone could take as much stuff and inject as they wanted and then just walk away for it? 100 meters running at 40 km h, wide throw over 2 km and the whole basketball team is 3 meters on average?",0,1,0,1,0,0
deu_train_track_a_01390,"What do you have to do to emigrate there? And what do you have to take into account? Not only in terms of the pure process of emigrating, but also in terms of what changes the most in life.",0,0,0,0,0,0
deu_train_track_a_01391,"There were two guys at school who were fighting, and I went in and I tried to pull them apart, and I grabbed one of them from behind, and I grabbed both of his arms, and I pulled him back, and I broke his right arm, and I did it wrong.",0,0,0,0,1,0
deu_train_track_a_01392,"Very nice! Also get the little animal in the spotlight, I like the lighting too. Very good :) My girlfriend is also a bit talented and I also often try to fight against it and improve myself :D Stay on top",0,0,0,1,0,0
deu_train_track_a_01393,War is hell on earth!,0,1,0,0,1,0
deu_train_track_a_01394,"As everyone else has said... Cyto and rubella are no fun when you're pregnant. If you're hesitant to go into a ban, then it's best to ask yourself beforehand if you're someone who would quickly blame yourself if it didn't work out in the end.",0,0,1,0,0,0
deu_train_track_a_01395,"My collecting heart is very jealous, but of course you're allowed to keep it in honor.",0,0,0,1,0,0
deu_train_track_a_01396,"It's well written, but it sounds like the end goal is suicide.",0,0,1,0,1,0
deu_train_track_a_01397,"Life is so much cooler when you're fit, and it's never too late.",0,0,0,1,0,0
deu_train_track_a_01398,"#War-mongers, #Hetzers and #Relief-lobbyists #Masala rejects #Maischberger negotiations in #NATO #Vice-War in #Ukraine against #Russia and says we should get used to #War. #Militarization in public law is expanding.",1,1,0,0,0,0
deu_train_track_a_01399,"In the early stages, you can't say that right, but period-like cramps are at least not unusual. Your uterus is already stretching. I had these pains in the beginning, but more in the upper abdomen and back instead of further down like I used to have my period, and not so strongly.",0,0,0,0,0,0
deu_train_track_a_01400,What kind of people are they to lead a country into war and destroy their own country?,1,1,0,0,1,0
deu_train_track_a_01401,"I think it was around the 20th S.W. that I felt the little one, but through the frontal placenta, even at the end of pregnancy, I never had any large bumps on my stomach caused by kicks.",0,0,0,0,0,0
deu_train_track_a_01402,"Climate bonus for asylum seekers is good for feeding refugees behind the borders of Austria, that's dirty politics by politicians.",1,1,0,0,0,0
deu_train_track_a_01403,"Born to be a cop, all that's missing are the Oakleys pressed on the thumbs.",0,0,0,0,0,0
deu_train_track_a_01404,Any other country would have seen endless sanctions and would be economically and politically ostracized... but not Israel.,1,1,0,0,0,0
deu_train_track_a_01405,Both support and finance the genocide in Gaza and then he wants to be generous and throw away aid after he himself is responsible for the famine. #freePalestine <unk>,1,1,0,0,0,0
deu_train_track_a_01406,Free Palestine <unk> I hope the wishes of the Israelis come true and Netanyahu is deposed!,1,1,0,0,0,0
deu_train_track_a_01407,"Dear Quaker, if you get COVID and or need intensive care, treat yourself at home. If you have long-term complications or you are Long COVID sick, don't go to a specialist, that goes at home too. If you are consistent, then right. Recently I had an inconsistent Quaker who was suddenly in the COVID intensive care unit and didn't want to die at home.",1,1,0,0,0,0
deu_train_track_a_01408,"""The earth is on fire"". If that stupid chatter stops, I'll be all right.",1,1,0,0,0,0
deu_train_track_a_01409,"It's not just Ukrainian children who are affected, but children of other nationalities are often not allowed to attend school in a timely manner, despite the compulsory schooling.",0,0,0,0,1,0
deu_train_track_a_01410,"Well, with optimism, nothing can go wrong.",0,0,0,1,0,0
deu_train_track_a_01411,I'm afraid I'll never find the right partner.,0,0,1,0,0,0
deu_train_track_a_01412,"I think I'd rather throw family planning overboard. In the end, you don't know how it works with pregnancy. The second child can also be left to wait for itself and then you would have hastily stopped training, which might not have been necessary. Or you get pregnant unplanned but early. Children are really difficult to plan. Besides, siblings can understand each other well or badly no matter what age.",0,0,1,0,0,0
deu_train_track_a_01413,"Sorry, but when I hear questions like that, I really wonder what's wrong with some of them... ""My mother wants me to do something that I don't want to do, but what do I do now?"" You're a man who's been a full-time adult for six years and who's in love with someone with epilepsy.",1,0,0,0,0,0
deu_train_track_a_01414,Does anyone know a good alternative to Digga? Look for something with class. Maybe even noble.,0,0,0,0,0,0
