id,text,anger,disgust,fear,joy,sadness,surprise
deu_train_track_a_00658,Hi. Thank you for your AMA. Where did your mother and her family come from? Did she marry a German? Did you leave when you were 19 and build your life somewhere else or how did that develop?,0,0,0,1,0,0
deu_train_track_a_00659,"Fighting the right in Germany and supporting a right-wing religious government in Israel, that's my humor.",1,0,0,0,0,0
deu_train_track_a_00660,"The green planned economy is caricaturing itself and moving further and further away from its sectarian goals, and the Greens are happy to accept that the German economy is going to go into a Nirvana and society is going to be further and further divided.",1,1,0,0,0,0
deu_train_track_a_00661,The Czechs will find themselves in the position of your government.,1,1,0,0,0,0
deu_train_track_a_00662,"I've also been sick for 10 months because of various mental illnesses. So for the first four or five months, I've been getting almost weekly calls from the health insurance company, and it looks like, at first, I thought it was very nice that you asked me to go, but when they asked me to resign ""right away"" because I was out of sick pay, I was also upset.",1,0,0,0,1,0
deu_train_track_a_00663,"I don't mean to be rude, but you've been away from each other for an hour and a half and you can't meet regularly? Or did I misunderstand? This unconditional preservation of your own freedom has definitely caused you a lot of trouble. The question is whether she wants it to be different at all and how to continue this after studying.",0,0,0,0,0,0
deu_train_track_a_00664,We will never forgive Israel,1,1,0,0,0,0
deu_train_track_a_00665,Thank you for the song.,0,0,0,1,0,0
deu_train_track_a_00666,"War is not a solution but a cycle of violence. I am infinitely sorry for what is happening now and I cannot imagine how painful this is for the civilian population. It goes against my imagination. I have a dream, I wish for a great country where all religions can live together in peace.",0,0,1,0,1,0
deu_train_track_a_00667,"Sounds to me like she's met some other interesting people at the party, but honestly, if you haven't had sex in years, then it's about time you broke up, because then you don't have an intact relationship, and you haven't had sex in years.",0,1,0,0,1,0
deu_train_track_a_00668,I'm going to make the stomach really bad.,0,1,0,0,0,0
deu_train_track_a_00669,"Quality person, first of all, thank you for your intervention! We need more people like you",0,0,0,1,0,0
deu_train_track_a_00670,"I've been depressed for over 10 years (as well as a borderline) and I've had some suicidal thoughts. I've been to three psychotherapists, I've been to group therapy, I've been to a self-help group, I've been to occupational therapy, I've read self-help books, I've been to a psychiatrist and I've tried meds. Nothing has helped, it's just gotten worse over the years. I don't know where to turn now.",0,0,1,0,1,0
deu_train_track_a_00671,"In 90% of cases, ""POV"" is used incorrectly. It drives me crazy.",1,0,0,0,0,0
deu_train_track_a_00672,"I'm xy years old and I worked at WKDA (WerkaufendeinAuto). I had completed an apprenticeship in another company as a salesman for office management. For the time at WKDA I worked as a service assistant in customer support. As bad as this company's reputation is, so was the work.",0,1,0,0,0,0
deu_train_track_a_00673,"Dear leader, creator? No, I can't identify with that. I'm just like everyone else here with the only difference being that I clicked on ""create"" on Subreddit at some point. But I guess that wasn't meant to be taken seriously. Thank you for the announcement!",0,0,0,0,0,0
deu_train_track_a_00674,"That's not bad, because streams let your voice rest for a while and I hope you'll be fine soon.",0,0,0,0,0,0
deu_train_track_a_00675,"Well, she's just afraid that you're gonna get women to do it or something, and she probably didn't think you were gonna go straight to the club.",0,0,0,0,0,0
deu_train_track_a_00676,"The more you shout, lie and slander, the more convinced I am that the #AfD is the right choice, because whoever leads false campaigns against a political opponent, lets the opposition demonstrate from the government, wants to ban the opposition and deprive people of basic rights, associates with left-wing extremists who demand the death of ""AfD"", is more fascist than he himself realizes.",1,1,0,0,0,0
deu_train_track_a_00677,The stench in this public toilet is unbearable!,0,1,0,0,0,0
deu_train_track_a_00678,It's embarrassing who votes for the AfD,0,1,0,0,0,0
deu_train_track_a_00679,"It is not true to say that food has been supplied since the beginning of the war, because without the intervention of the United States, they would all have starved long ago.",1,0,0,0,0,0
deu_train_track_a_00680,"The Palestinians have chosen Hamas. Now they are paying the price. It can be ended immediately: Hamas lays down its weapons, releases all hostages immediately and surrenders. If not, Hamas will be completely destroyed.",1,1,0,0,0,0
deu_train_track_a_00681,Because he gets more on the cottage and can unpack more parades?,0,0,0,0,0,0
deu_train_track_a_00682,Why do you always have to break up? Where does the mentality come from that you have to throw someone away just because the sex isn't good? Working together and growing together is the only way to make the sex more intense and weld one more together.,0,0,0,0,0,0
deu_train_track_a_00683,I hope she makes it.,0,0,0,0,1,0
deu_train_track_a_00684,The news of the death of a childhood hero strikes me very much.,0,0,0,0,1,0
deu_train_track_a_00685,"It's important to keep one thing in mind, you're not in charge of other people's happiness. Breakups are never easy, and it shows that you're making up your mind by seeking advice. But once you've made your decision, it won't help her or you if you keep the relationship going. If you still like her, offer to be there for her when she needs help.",0,0,0,0,0,0
deu_train_track_a_00686,The whole country is corrupt and so are their foreign funders and warmongers!,1,1,0,0,0,0
deu_train_track_a_00687,"Correction: RAUM Offenbach, not directly in Offenbach, but we are easily accessible with Öffis!",0,0,0,0,0,0
deu_train_track_a_00688,"Actually, you've already answered your question. Template houses are much cheaper than architectural masterpieces. For example, if you read around here on Reddit, you'll find that most people take out high loans and often sew on edge to afford a property. If they had more money, most people would probably prefer to put something individual instead of the one-size-fits-all.",0,0,0,0,1,0
deu_train_track_a_00689,"Daily consumption is harmful, and every stoner knows that.",0,0,0,0,0,0
deu_train_track_a_00690,"Yeah, I've had exactly the same experiences. First they complain that you should report. If you report, there's no answer, you don't report and then you're seen, these sayings come right away like ""you should have said something"" etc. I'm too stupid by now, the last one who arrived like this I rubbed the phone under his nose and showed him that I wrote him 5x and nothing came back. Then I can leave him with a stupid face.",1,1,0,0,1,0
deu_train_track_a_00691,I'm not feeling well either.,0,0,0,0,1,0
deu_train_track_a_00692,"I've also stopped it because I've got something else and Venlafaxin had to be out before. I've slowly eliminated it under medical supervision, so the dose has been reduced over a longer period of time. Then there should be no major problems. From today to tomorrow it just won't go wrong and cause withdrawal symptoms. I had no other problems than that.",0,0,0,0,0,0
deu_train_track_a_00693,Bayern Bremen was the number one hunter.,0,0,0,0,0,0
deu_train_track_a_00694,"I think every windmill should have a guardian like a lighthouse, I don't know what he'd do, but I want the job, I'd have peace of mind.",0,0,0,1,0,0
deu_train_track_a_00695,"It doesn't matter if the subreddit can separate sex and love, you know it's a no-go for you.",0,1,0,0,0,0
deu_train_track_a_00696,"I'd like to write more here, but I'm running out of time.",1,0,0,0,0,0
deu_train_track_a_00697,"I'm currently between 10th and 11th SSW and I'm getting a booster from my FA in the 12th week. My second vaccination was in June, so 6 months before. For me it looks very important, I'm asthmatic and don't want to have corona, I also have 2 toddlers at home who are not vaccinated and for me the extra protection is important",0,0,1,0,0,0
deu_train_track_a_00698,"Do you have a therapist? You could work with him on your fears. Maybe doctors can help you, too, and they help me personally with fears quite well.",0,0,0,0,0,0
deu_train_track_a_00699,"My knowledge of Doctor Who is admittedly limited, but I think it's unwise to repair Daleks.",0,0,0,0,0,0
deu_train_track_a_00700,"So a famine caused by a natural disaster is one thing and worse enough, but a man-made, deliberately caused famine like in #Gaza is disgusting.",1,1,0,0,0,0
deu_train_track_a_00701,You're on the hit list of washing machine manufacturers now. When the doorbell rings on Sunday night - MACH NOT UP! Hi but congratulations:) Repairing things is so satisfying!,0,0,0,1,0,0
deu_train_track_a_00702,First you deliver weapons to Israel and now they want to drop aid by air!,1,1,0,0,1,0
deu_train_track_a_00703,"Mostly on the phone, but also requests by chat, mail, letter, fax, WhatsApp, Facebook, Twitter - actually on pretty much every medium imaginable.",0,0,0,0,0,0
deu_train_track_a_00704,"Gabs actually did some demo on the Hildmann, but wasn't taken away by the police?",0,1,0,0,0,0
deu_train_track_a_00705,It's going really well.,0,0,0,1,0,0
deu_train_track_a_00706,"Yes, but unfortunately most of you are completely underdosed or poorly composed... especially in Germany. With healthy diet and exercise you will sleep 90% better.",0,0,0,0,0,0
deu_train_track_a_00707,"Hi, I'm looking for recommendations for bikinis or swimsuits that I can wear during pregnancy for (sporty) swimming. I'm in my 26th week and unfortunately my bathing suits and bikinis don't fit me anymore - especially because of the grown breasts (but unfortunately I've also gained weight overall). Before the SS I was already 80E. I don't even know, I think 1-2 at larger sizes. Where does anyone know brands for large bellies that hold a ""bikini cup"" since the top here in the remaining weeks is good enough, and I have to grow?",0,0,0,0,0,0
deu_train_track_a_00708,"Good luck and all the best for the new season. Fortunately, you're only playing on the last day against my favorite club.",0,0,0,1,0,0
deu_train_track_a_00709,"I've also been in long-term relationships, the last one was 11 years ago, 4 years ago. And yes, I have to say that everything has changed, but it's also because of age, I would say. I now had two ""experiences"" after all this and it was always sex in the game at the first meeting. Again, both were very open and very different from what I knew. I also had my hand directly on the throat, which was strange but okay for me.",0,0,0,0,0,0
deu_train_track_a_00710,"I've got my nose full of Putin trolls, and if you pay homage to Putin like that, then go to Russia, he's looking for cannon fodder.",1,1,0,0,0,0
deu_train_track_a_00711,"Everything other than normal. So extreme statements are made by the least of them several times a year, but more often in a week? No, this is a cry for lack of self-love and attention. There is someone trying to balance that with external lovers and co, what is missing inside, even if it is described as extreme. Especially something like this is not possible. The partner should also want this and not be forced, because this crosses boundaries and harms the partner rather for his own need to hear something.",0,1,0,0,0,0
deu_train_track_a_00712,"Unfortunately, the comments section cannot be loaded at the moment, please try again later.",0,0,0,0,0,0
deu_train_track_a_00713,Hopefully they won't drive their parents' SUV to school and cancel the next city trip on a plane.,1,1,0,1,0,0
deu_train_track_a_00714,Is being against wind farms automatically a climate change denier? Or is this the same story as during Corona? I don't want vaccination and then I'm also a climate change denier?,1,0,0,0,0,0
deu_train_track_a_00715,"We alone in the family have two serious problems that they didn't have before the vaccination: pulmonary embolism, heart rhythm disorders, but of course that has nothing to do with the vaccination and it's just imagination.",1,1,0,0,1,0
deu_train_track_a_00716,"I will not coalition with this AfD, the so-called alternative, and I will not work with it. That is a promise I make to you here today. Anything else would be dishonest!"" #hartaberfair",0,1,0,0,0,0
deu_train_track_a_00717,Irrenhaus Germany,1,1,0,0,0,0
deu_train_track_a_00718,"I'm thinking of putting together a little box for my wife with things she'll have to give up during her pregnancy, including liquorice, sushi, bath oils, a small bottle of wine.",0,0,0,1,0,0
deu_train_track_a_00719,"Basically, it's purely medical that with a caesarean section, the likelihood of further caesarean sections increases in further births. After 2-3 caesarean sections, even vaginal spontaneous birth is discouraged. But that *must* not be the case, especially after one, the chances are definitely not bad that it will happen spontaneously.",0,0,0,0,0,0
deu_train_track_a_00720,"Don't be so hard on yourself with other dating apps. Just download it, write a little bit with people and most importantly, don't take such apps seriously. If you look at them as what they are, it's quite funny: apps where you write with strangers. And as ""fixes"" as it sounds at first, you don't have any obligations and you just can't write with people if you don't feel like (any more) on the apps.",0,0,0,1,0,0
deu_train_track_a_00721,"To all the Putin Russians, finally go to your great Putin (use your countrymen as cannon fodder) where you can freely express your opinion.",1,1,0,0,0,0
deu_train_track_a_00722,"So first of all, you probably have the coolest hobby in the world. If there's any videos, let me know. Your boyfriend is also an idiot. He probably can't accept your hobby. The fact that he reacts to it with such immense anger doesn't make him look very good. Maybe you can talk to him one last time and tell him that this is just for ice skating. But if he doesn't understand and assumes such things, I would break up with you instead.",1,1,0,1,0,0
deu_train_track_a_00723,"Unfortunately, the pictures have become so beautiful.",0,0,0,1,0,0
deu_train_track_a_00724,"I got most of it from Vinted. I'm very satisfied with it. I first asked for a few things and then after a while I made a table so that I could keep track of how much we need, how things fit together, etc. I didn't get too many different brands because the sizes are very different.",0,0,0,1,0,0
deu_train_track_a_00725,"This comment has been overwritten as a protest against Reddit's handling of the recent [protest against them killing 3rd-party-apps]( To do this yourself, you can use the python library [praw]( See you all on [Lemmy](",0,0,0,0,0,0
deu_train_track_a_00726,"It's a beautiful story, but I'm still so afraid of death. And when I hear about 70... it sounds old, but at almost 30, I still feel so inexperienced in life, and even if I get that old, half of it will soon be gone.",0,0,1,0,0,0
deu_train_track_a_00727,"High-quality BHs, well-processed, the right size, makes a huge difference in comfort and back, high-quality shoes, detergent.",0,0,0,0,0,0
deu_train_track_a_00728,I can't believe he's playing some kind of shit today.,1,0,0,0,0,0
deu_train_track_a_00729,"I had a PDA put on me when my daughter was born, and it was really great, and I'm going to give this to myself as an option for my son's birth in May, and you don't have to if you don't need it, but knowing that there are options to ease the pain takes a little bit of anxiety for me.",0,0,0,1,0,0
deu_train_track_a_00730,The little girl loves to stuff blocks of wood into her body and gets upset when she can't get them out.,0,0,0,1,0,0
deu_train_track_a_00731,"I don't have an answer to that question, but I have to say one thing: the choice of the image is brilliant - the Mülheimer in the foreground is epic! *MadeMyDay*",0,0,0,1,0,0
deu_train_track_a_00732,"After the first child, yes. After the second child, well, in most cases.",0,0,0,0,0,0
deu_train_track_a_00733,"If a party is too strong, of course you try to get rid of it democratically...",1,1,0,0,0,0
deu_train_track_a_00734,And yet you are constantly bombarded with lack of humanitarian aid to Gaza.,1,1,0,0,0,1
deu_train_track_a_00735,"I have the impression that a right-wing head of state is proposing unclean solutions!!! The Palestinians need their own state in which they have all the rights, as do the Jews.",1,1,0,0,0,0
deu_train_track_a_00736,"I'm glad to hear that you're getting the support you need! The wait for therapy is really hard. You might want to take a look at DIGAs. These are digital health applications (quasi apps on a prescription) that can be prescribed directly by your doctor or your health insurance company, and especially in the area of depression, they're really well researched and definitely helpful for my time-saving.",0,0,0,1,1,0
deu_train_track_a_00737,People who really mourn Karin Ritter Wtf,0,1,0,0,0,1
deu_train_track_a_00738,What is your plan after graduation? Do you want to stay in the EU or Germany or go back to the hopefully soon peaceful country or do you leave that open?,0,0,0,0,0,0
deu_train_track_a_00739,"I bought some extra breastfeeding supplies and find them to be more annoying to breastfeed than my normal clothes. You have to shovel the openings with the baby in your arm somehow! Instead, I prefer to wear normal, wide T-shirts, where I can either pull my chest out directly from the top (if cut far enough) or just pull the shirt up from the bottom.",0,1,0,0,0,0
deu_train_track_a_00740,"A lot of success, the railway is ruthlessly overwhelmed again, who would have thought that today so many people want to use the railway",1,1,0,0,0,1
deu_train_track_a_00741,"Of course, I'll still be panting and moaning all day long, and when asked, I'll say, ""Oh, no, I'm very cold, but I have to"", as casually as possible, especially when a superior is nearby, and I'll often lean over and put my hand on my forehead and say, ""Fuuuh"".",0,1,0,0,0,0
deu_train_track_a_00742,Fashion decisions rarely have anything to do with rationality.,0,1,0,0,0,0
deu_train_track_a_00743,"He's right. If you want to enjoy nature or be in nature, you should clean up your dirt. It's best to take it back, but unfortunately many people can't even use the garbage can that's 1.5 meters away.",0,1,0,0,1,0
deu_train_track_a_00744,"#Putin is a master strategist! He has achieved everything he never wanted. NATO enlargement, 2 years of 3-day war, Russia's coal is gone, its oligarchy is about to go bankrupt, Russia still has 1.5 years of foreign exchange reserves and he has to kiss the little man from North Korea on the feet.",0,1,0,0,0,0
deu_train_track_a_00745,No weapons and no money for Ukraine then the ghost is over quickly..,1,1,1,0,0,0
deu_train_track_a_00746,Spit is just water somewhere.,0,0,0,0,0,0
deu_train_track_a_00747,You don't think it's been haunting me my whole life. I'm generally traumatized by it.,0,0,1,0,1,0
deu_train_track_a_00748,"I had to show my mother's passport when I was boosting; so I wouldn't lie at the SSW. I was already in the second trimester, but theoretically I had three more days until the six-month gap to the second vaccination was full - but that didn't interest me and I got the vaccination without any problems. Honestly: take the vaccine and mother's passport, go to the vaccination center and describe your specific situation. Try it.",0,0,0,0,0,0
deu_train_track_a_00749,"Maybe the YouTube channel has some helpful information for you: [TheraminTrees] (e.g. the video here [coming out a road map for before, during and after] Ex-girlfriend you can definitely forget, something you told her in confidence to tell your family without thinking about the consequences for you is absolutely not possible.",0,1,0,0,1,0
deu_train_track_a_00750,"If we don't have sex, I won't do it.",0,1,0,0,0,0
deu_train_track_a_00751,"Rights stand up for themselves: they deny man-made climate change and hate refugees, whose main reason for fleeing is climate change.",0,1,0,0,0,0
deu_train_track_a_00752,And because we finally need an expert on international football.,0,0,0,1,0,0
deu_train_track_a_00753,What does South Africa do as a representative of Hamas? Nothing! This proves that the lawsuit at the IGH was only about Israel and Jewish hatred. There is no evidence of a genocide to this day. #BringThemHomeNow,1,1,0,0,0,0
deu_train_track_a_00754,"I'd rather call, I haven't actually gotten any feedback on the emails I've written. Just, ""Hello, I had a positive pregnancy test last week and I'm looking for a midwife now, especially for the weekly bed. I'm probably in week sounds"" And then they tell you if they're still free or not.",0,0,0,0,0,0
deu_train_track_a_00755,Lauterbach doesn't have a reasonable explanation.,1,0,0,0,0,0
deu_train_track_a_00756,"I've decided to do this AMA because I haven't found a contribution to it yet. Because this problem can affect any age group, and especially young men, it's rarely addressed, I'd also like to show others that there's no reason to be ashamed of it.",0,0,0,0,0,0
deu_train_track_a_00757,Will cry has to stop with dates again,0,0,0,0,1,0
deu_train_track_a_00758,"At the beginning of 'roner, my local Aldi had a sign in front of the entrance that only 88 people were allowed in, and now there's a digital counter at the top that shows how many people are still allowed in.",0,0,0,0,0,0
deu_train_track_a_00759,I'm afraid I might lose my job. The economy is so uncertain.,0,0,1,0,0,0
deu_train_track_a_00760,"Hi, I'm in my 12th week of pregnancy and I've gained about 10 pounds. I'm 170 centimeters tall and weighed 55 kilograms before pregnancy. I've actually always had enough exercise because of football. I still go for a walk after work. I also eat my usual two meals. The amount may have changed a little bit here and I have to eat a little more. But that can't be the reason why the Internet should be here.",0,0,1,0,0,0
deu_train_track_a_00761,"I agree with everything that Constance AndVars has written, but I would also suggest that you take advantage of offers like the [telephone counseling] [there are also other] [help offers] [just please don't forget the most important thing: your feelings are valid and you should never be ashamed of them! I think it's great that you want to talk about it and don't seek help. Because even if you are diagnosed with depression, it's right and it's very important to take the help of the small steps: don't try to think about things.",0,0,0,1,1,0
deu_train_track_a_00762,Boy honestly such a machine otherwise fierce &lt;3,0,0,0,1,0,0
deu_train_track_a_00763,"If it was great, you wouldn't have to see the poison anymore.",0,1,0,1,0,0
deu_train_track_a_00764,"Is there a Plan B? It looks like Russia is moving forward slowly. Wouldn't diplomacy be appropriate slowly? Otherwise, Ukraine will disappear completely and more and more people will die. Then it's too late to negotiate.",0,0,1,0,0,0
deu_train_track_a_00765,Hello everyone! I'm looking for a good book to help me through my pregnancy. Almost a manual. I'm in the 6th grade. Can you recommend a good one? Thank you in advance! Thank you very much for your feedback!!,0,0,0,1,0,0
deu_train_track_a_00766,"Mac is NOT Windows it doesn't need much is like Linux, but of course Apple has always wanted to release something new yes make money xD",0,1,0,1,0,0
deu_train_track_a_00767,"Once because of a meme that he didn't think was funny, and once because I ""spoiled"" Cyberpunk by saying that I thought the level system was stupid.",0,1,0,0,0,0
deu_train_track_a_00768,"How did it go in court and what exactly was your charge, what did your lawyer say about this sentence, and why didn't you go to trial?",0,0,0,0,0,0
deu_train_track_a_00769,"I have a thyroid dysfunction myself, and I experienced it shortly before I got pregnant. As far as I know, nothing happens that fast because she's taking L-thyroxine anyway. From the 12th week onwards, the baby also produces thyroid problems on its own. I just didn't quite understand one thing in your post. If the TSH is too high, the medication is increased. If it's too low, it's reduced.",0,0,0,0,0,0
deu_train_track_a_00770,I'm in luck.,0,0,0,1,0,0
deu_train_track_a_00771,Didn't they say two months ago that Palestinians are dying because Hamas is preventing them from fleeing to the south?,1,0,0,0,1,0
deu_train_track_a_00772,"Remember, the highest compliment right now is a 'not bad'!",0,0,0,0,0,0
deu_train_track_a_00773,That's when he remembered the Monday morning snack.,0,0,0,0,0,0
deu_train_track_a_00774,"It's embarrassing who doesn't cry in the morning on the train when rap raps ""little brother, little thief""",0,0,0,0,1,0
deu_train_track_a_00775,"Courageous, and you don't have to be afraid of that.",0,0,0,1,0,0
deu_train_track_a_00776,Italian juvenile prisons are full of children cooking ketchup spaghetti. #mustknow,0,0,0,0,0,0
deu_train_track_a_00777,"After seven years, the ""I don't know yet"" train has just left, but you both should know very well what you have in common or not, and a decision on whether you want this for the rest of your life or not should be easy to make, but it also involves dealing with the unpleasant truth that it may not be what you want for the rest of your life.",0,0,0,0,1,0
deu_train_track_a_00778,"You're on a class trip, vacation, etc., and you're allowed to pick a song for the morning that wakes you up from the house.",0,0,0,1,0,0
