id,text,anger,disgust,fear,joy,sadness,surprise
ukr_train_track_a_00498,"I've been told that I'm a poet, that I've been painted on paper, that I've been painted on walls, that I've been cursed, that I've been cursed, that I've been cursed.",0,0,0,0,1,0
ukr_train_track_a_00499,"Chernobyl is very interesting, though sad.",0,0,0,0,1,0
ukr_train_track_a_00500,I'm not sure if it's because I'm Russian or because I'm not interested in other countries.,0,0,0,0,0,0
ukr_train_track_a_00501,To wake up from the sun shining through the window.,0,0,0,0,0,0
ukr_train_track_a_00502,"This is a picture of the explanation of the cruel, the evil, the bad",0,0,0,0,0,0
ukr_train_track_a_00503,"Deep down, he's shy and afraid to admit it.",0,0,0,0,0,0
ukr_train_track_a_00504,"Senorita Olya let herself into the dance with the words: ""My life is a chicken. I can't do it with them"".",0,0,0,0,0,0
ukr_train_track_a_00505,"But I miss home, my dog, and my girlfriend.",0,0,0,0,1,0
ukr_train_track_a_00506,"I got out of bed to make tea, throw away my laundry, and go to the bathroom.",0,0,0,0,0,0
ukr_train_track_a_00507,"Someone made a butcher's shop out of bread, dough, and bait for the cockroaches in between.",0,0,0,0,0,0
ukr_train_track_a_00508,The 10th European University Volleyball Championship was held in Larnaca.,0,0,0,0,0,0
ukr_train_track_a_00509,And I don't use it for anything...,0,0,0,0,0,0
ukr_train_track_a_00510,Opened the season of grilled meat with new friends Audrey Honavar Jaideep Honavar & Aolani.,0,0,0,0,0,0
ukr_train_track_a_00511,"I don't want to go to your birthday party, but I have to.",0,0,0,0,1,0
ukr_train_track_a_00512,"Put me back on the piano, please.",0,0,0,0,0,0
ukr_train_track_a_00513,"And my question is, people, if you're so afraid of #Euromaidan, then why are you so afraid of Schengen?",0,0,0,0,0,1
ukr_train_track_a_00514,"2+2 is the same thing as 1+1, 1+2, 1+2, 1+2, 1+2, 1+2, 1+2, 1+2, 1+2, 1+2, 1+2, 1+2, 1+2, 1+2, 1+2, 1+2, 1+2, 1+2, 1+2, 1+2, 1+2, 1+2, 1+2, 1+2, 1+2, 1+2, 1+2, 1+2, 1+2, 1+2, 1+2, 1+2, 1+2, 1+2, 1+2, 1+2, 1+2, 1+2, 1+2, 1+2, 1+2, 1+2, 1+2, 1+2, 1+2, 1+2, 1+2, 1+2, 1+2, 1+2, 1+2, 1+2, 1+2, 1+2, 1+2, 1+2, 1+2, 1+2, 1+2, 1+2, 1+2, 1+2, 1+2, 1+1, 1+1, 1+1, 1+1, 1+2, 1+2, 1+2, 1+2, 1+1, 1+2, 1+2, 1+2, 1+2, 1+2, 1+2, 1+1, 1+2, 1+1, 1+1, 1+",0,0,0,0,0,0
ukr_train_track_a_00515,I even have a dried cactus.,0,0,0,0,0,0
ukr_train_track_a_00516,RT: I got a job offer.,0,0,0,1,0,0
ukr_train_track_a_00517,The owner of the tattoo of one of my students.,0,0,0,0,0,0
ukr_train_track_a_00518,I'm worried about not running in and eating any meat today.,0,0,1,0,0,0
ukr_train_track_a_00519,And it turned out that he was Jonas.,0,0,0,0,0,0
ukr_train_track_a_00520,I want this matte lipstick.,0,0,0,0,0,0
ukr_train_track_a_00521,I've never seen a graphics card like this before. #LOVE,0,0,0,0,0,0
ukr_train_track_a_00522,I've closed the audition and I'm happy!,0,0,0,1,0,0
ukr_train_track_a_00523,You can write it down on a piece of paper and hang it in your room to keep your motivation going.,0,0,0,0,0,0
ukr_train_track_a_00524,"I'm sorry, but I was in a movie where the guy was eating poop and the pig was crying.",0,1,0,0,0,0
ukr_train_track_a_00525,"I, for one, have a couple of best friends.",0,0,0,0,0,0
ukr_train_track_a_00526,"I want to close up a little, it's an inner desire... although the lock doesn't give anything)",0,0,0,1,0,0
ukr_train_track_a_00527,I didn't get to 35 but I did get a few words in.,0,0,0,0,0,0
ukr_train_track_a_00528,He must have been very upset today.,0,0,0,0,0,0
ukr_train_track_a_00529,And it's sad that he's almost completely forgotten.,0,0,0,0,1,0
ukr_train_track_a_00530,"I didn't expect that reaction, the size of the glass even impressed me.",0,0,0,0,0,1
ukr_train_track_a_00531,You're all laughing? [Blog] About laughs and bad people,0,0,0,0,0,0
ukr_train_track_a_00532,You're a wonderful woman. I'm telling you to do what you know how to do.,0,0,0,0,0,1
ukr_train_track_a_00533,- What are you doing there?,0,0,0,0,0,0
ukr_train_track_a_00534,"""Oh, that's just awful, that's all, little one.",0,0,0,0,0,0
ukr_train_track_a_00535,The failure of the Soviet sparsman,0,0,0,0,1,0
ukr_train_track_a_00536,I'd like to say hello to my editors and editors.,0,0,0,0,0,0
ukr_train_track_a_00537,"(Sighs) Oh, I laughed with you.",0,0,0,1,0,0
ukr_train_track_a_00538,It's funny how people who are constantly using others - once they've used them once - are surprised by it....!!!,0,0,0,0,0,1
ukr_train_track_a_00539,"Congratulations to a wonderful woman, with a great sense of humor, on her birthday!",0,0,0,1,0,0
ukr_train_track_a_00540,"For a couple of months now, I've had this feeling that someone's been following me around the apartment...",0,0,1,0,0,0
ukr_train_track_a_00541,"Well, surgeons aren't that scary, and dentists aren't that scary, and those drills are scary.",0,1,0,0,0,0
ukr_train_track_a_00542,"In this plan, the living dead are cute.",0,0,0,0,0,0
ukr_train_track_a_00543,"I'm not sure if it's a good idea or not, but the price of the book is really low.",0,0,0,0,1,0
ukr_train_track_a_00544,But sometimes it's really useless work.,0,0,0,0,0,0
ukr_train_track_a_00545,"My hair is dyed, and I don't smell that poisonous smell.",0,0,0,0,0,0
ukr_train_track_a_00546,That's so sweet and nice.,0,0,0,1,0,0
ukr_train_track_a_00547,"The band will release their new album tomorrow, but they won't be releasing it on CD.",0,0,0,0,0,0
ukr_train_track_a_00548,I remembered one recent night and now I'm smiling.),0,0,0,1,0,0
ukr_train_track_a_00549,I have to thank Irvants for the translations. That's why the translations into Ukrainian are not so frequent and it's a pity.,0,0,0,0,1,0
ukr_train_track_a_00550,"The Georgians laughed, got to the mountains, even drank coffee there.",0,0,0,0,0,0
ukr_train_track_a_00551,It's been sad here for over a year.,0,0,0,0,1,0
ukr_train_track_a_00552,I'm also wondering if we should shake up all the cultural scholars on this subject.,0,0,0,0,0,0
ukr_train_track_a_00553,I'm afraid I'm going to get into it with a bone.,0,0,1,0,0,0
ukr_train_track_a_00554,A minute of racism in the tape,0,0,0,0,0,0
ukr_train_track_a_00555,"When strangers see me brushing my teeth, they're afraid I'm having an epileptic seizure.",0,0,0,0,0,0
ukr_train_track_a_00556,I took the Magellano test for career orientation and realized why I wasn't all that great.,0,0,0,1,0,0
ukr_train_track_a_00557,"I'm not sure if I'm going to be able to get a separate account, but I'm going to have to pay for it myself.",0,0,0,0,0,1
ukr_train_track_a_00558,"Well, I ran away from the stop.",0,0,0,0,0,0
ukr_train_track_a_00559,I'm staying in the tribe tonight. I'll sleep!,0,0,0,1,0,0
ukr_train_track_a_00560,"I was minimizing it in the fall, thinking it would be worse, but it got better.",0,0,0,0,0,1
ukr_train_track_a_00561,What's so scary about the tape?,0,0,0,0,0,1
ukr_train_track_a_00562,#twitter on the topic 'what to do?',0,0,0,0,0,0
ukr_train_track_a_00563,I have a cat in class.,0,0,0,0,0,0
ukr_train_track_a_00564,"I'm confused, happy, or is it all an illusion?",0,0,0,0,0,0
ukr_train_track_a_00565,When a big red cat happened to be in the yard and he had to prove his coolness to him.,0,0,0,0,0,0
ukr_train_track_a_00566,"I never thought that thanks to LSH I would find a person who loves me and who loves me, without falsehood, for real.",0,0,0,1,0,1
ukr_train_track_a_00567,I read the FB tape and laugh.,0,0,0,1,0,0
ukr_train_track_a_00568,"I'm getting paid five times as much as they are, and I'd love to help, but I can't.",0,0,0,0,1,0
ukr_train_track_a_00569,But what a great grandfather he is now!,0,0,0,1,0,0
ukr_train_track_a_00570,Congratulations to Daddy on the new year.,0,0,0,0,0,0
ukr_train_track_a_00571,RT : Mobile addicts sleep badly and often argue with their loved ones,0,0,0,0,0,0
ukr_train_track_a_00572,"He's got a few pieces of cloth, a few pieces of paper, and he's got a bunch of dirty, rotten clothes that are going to be a problem.",1,0,0,0,0,0
ukr_train_track_a_00573,"She barely got up, and it wasn't the first time.",0,0,0,0,1,0
ukr_train_track_a_00574,We decided to go in the direction of Troodos.,0,0,0,0,0,0
ukr_train_track_a_00575,"I'm afraid the phone's going to run out of power and I won't be able to make an emergency call, so I'm going to have to take a nap.",0,0,1,0,0,0
ukr_train_track_a_00576,Don't wipe the floor with a woman.,0,0,0,0,0,0
ukr_train_track_a_00577,How can you not love Gwar if it's Gwar?,0,0,0,0,0,1
ukr_train_track_a_00578,"R.I.P. (I'm not kidding, I'm a bit of a bisexual myself)",0,0,0,0,0,1
ukr_train_track_a_00579,I wonder if there's a service that can turn off the unconstructive and malicious comments under the articles?,0,0,0,0,0,0
ukr_train_track_a_00580,The date of the first participant of the Stare Misto 2013 festival has been announced.,0,0,0,0,0,0
ukr_train_track_a_00581,"But you're at least a first or second year, and I'm a year away from collecting money and saying goodbye to university life.",0,0,1,0,0,0
ukr_train_track_a_00582,Brushing your teeth in the airport bathroom?,0,0,0,0,0,0
ukr_train_track_a_00583,Working dialogues: - Do you have curtains?,0,0,0,0,0,0
ukr_train_track_a_00584,"You have to be able to answer for your words, damn it.",1,0,0,0,0,0
ukr_train_track_a_00585,And the main meat is eaten with bread;),0,0,0,1,0,0
ukr_train_track_a_00586,"Oh, you got a new job already?",0,0,0,0,0,1
ukr_train_track_a_00587,I don't know what could be more terrifying than the first cover of Nora's book.,0,0,1,0,0,0
ukr_train_track_a_00588,I don't have one myself.,0,0,0,0,1,0
ukr_train_track_a_00589,So you're one of the speakers?,0,0,0,0,0,1
ukr_train_track_a_00590,"It's a horror movie tune, but you'll appreciate it.",0,0,0,0,0,0
ukr_train_track_a_00591,I've had enough of that.,1,0,0,0,0,0
ukr_train_track_a_00592,"I also ""feel"" that it's from a movie... but I didn't know which one.",0,0,0,0,0,0
ukr_train_track_a_00593,"Hardcore rap about Hitler, naked women and drugs.",0,0,0,0,0,0
ukr_train_track_a_00594,He's as cute as a bear when he meets you.,0,0,0,1,0,0
ukr_train_track_a_00595,"If you're looking for a #VivaLIFE, don't miss it, we're not coming!",0,0,0,0,0,0
ukr_train_track_a_00596,Now my heart hurts.,0,0,0,0,0,0
ukr_train_track_a_00597,I want to go somewhere for the weekend. Shh. No Twitter and a big k-stick mime.,0,0,0,0,0,0
ukr_train_track_a_00598,I'm already scared when they call me.,1,0,1,0,0,0
ukr_train_track_a_00599,"That's great, maybe one day I'll learn to draw like that.",0,0,0,1,0,0
ukr_train_track_a_00600,And I can't see it now.,0,0,0,0,0,0
ukr_train_track_a_00601,To live outside the city is to open the window and breathe in the smell of the field flowers.,0,0,0,0,0,0
ukr_train_track_a_00602,"The Panhandle is a little over 170 miles away, and it's a little over a year away from being a major city.",0,0,0,0,1,0
ukr_train_track_a_00603,The prow of our dog in the cabin.,0,0,0,0,0,0
ukr_train_track_a_00604,I'm sitting at work watching interviews with French footballers.,0,0,0,0,0,0
ukr_train_track_a_00605,"Some talked to the girls about hair, one says she saw rice in Cherkasy and things like sausages.",0,0,0,0,0,0
ukr_train_track_a_00606,I put myself in the shoes of the person and I know what I'm afraid of.,0,0,1,0,0,0
ukr_train_track_a_00607,"Happy birthday to you, Kit.",0,0,0,0,0,0
ukr_train_track_a_00608,I went to bed at 21 yesterday and didn't sleep.,0,0,0,0,1,0
ukr_train_track_a_00609,I don't have a job.,0,0,0,0,1,0
ukr_train_track_a_00610,I like the first and seventh visually.,0,0,0,0,0,0
ukr_train_track_a_00611,I got on the bus and stood by the back door surrounded by someone's bags.,0,0,0,0,0,0
ukr_train_track_a_00612,And my little girl finally graduated from medical school. There are people for whom your support is vital.,0,0,0,1,0,0
ukr_train_track_a_00613,"Thoughts are so material, it's scary.",0,0,1,0,0,0
ukr_train_track_a_00614,"When you're happy, how would you like to scream with your chest full of silence.",0,0,0,0,0,0
ukr_train_track_a_00615,I'm waiting for the vegetable grill in the Bernardine yard.,0,0,0,0,0,0
ukr_train_track_a_00616,I'm just having a good time on a cold winter's day.,0,0,0,1,0,0
ukr_train_track_a_00617,"Oh, that's a great mask!",0,0,0,1,0,0
ukr_train_track_a_00618,"I like him too, and his boo-boo.",0,0,0,1,0,0
ukr_train_track_a_00619,The only thing worse than pouring a washing machine into a bath is pouring a washing machine into the bathroom.,0,1,0,0,0,0
ukr_train_track_a_00620,"Old man, all my life I've been afraid to look and I've dared.",0,0,1,0,0,0
ukr_train_track_a_00621,"Oh, my God, that's wonderful! Why can't I dream of anything?",0,0,0,1,1,0
ukr_train_track_a_00622,It's like a cold wind blows through me.,0,0,0,0,1,0
ukr_train_track_a_00623,It's 12 o'clock and my internet is down.,0,0,0,0,0,0
ukr_train_track_a_00624,With a thought about ;),0,0,0,0,0,0
ukr_train_track_a_00625,I dreamt that night that I was on the tech support line again.,0,0,0,0,0,0
ukr_train_track_a_00626,"I'll tell you what, Turkish scooters and gliders are no worse, I'll tell you. But they're cheaper.",0,0,0,0,0,0
ukr_train_track_a_00627,I remembered what tomorrow would be like.,0,0,0,1,0,0
ukr_train_track_a_00628,"The cat put his wet nose to my wrist, and he just kept it there.",0,0,0,0,0,0
ukr_train_track_a_00629,I've got the 18mm SJU.,0,0,0,1,0,0
ukr_train_track_a_00630,I finally got to see the Zaporizhia news.,0,0,0,0,0,0
ukr_train_track_a_00631,"We have a new tour, thank you to everyone who loves us!",0,0,0,1,0,0
ukr_train_track_a_00632,The fact that he's Georgian made me even more upset.,0,0,0,0,1,0
ukr_train_track_a_00633,"Putin, Russia, Putin <unk> It's strange to see such a thing in a non-Russian.",0,0,0,0,0,1
ukr_train_track_a_00634,"I bought a sausage in a dough...such a shape, it's embarrassing to eat in public:D But delicious!",0,0,0,1,0,0
ukr_train_track_a_00635,"What do you do when you want a hug and they make you a cup of tea, and everyone's afraid to even go into your room?",0,0,0,0,0,0
ukr_train_track_a_00636,"It was not in vain that all those years when I was too detached from reality and suffocated with hunger, when I stayed at home alone.",0,0,0,1,0,0
ukr_train_track_a_00637,"My backpack has always been a backpack, it is and always will be.",0,0,0,0,0,0
ukr_train_track_a_00638,I missed this place.,0,0,0,0,1,0
ukr_train_track_a_00639,"I'm a photographer, and I'm a photographer, and I'm a photographer, and I'm a photographer, and I'm a photographer, and I'm a photographer, and I'm a photographer.",0,0,0,0,1,0
ukr_train_track_a_00640,I can list two positive scenarios in my life.,0,0,0,0,0,0
ukr_train_track_a_00641,I don't accept any more methods of education except the threat of a soldering iron.,0,0,0,0,0,0
ukr_train_track_a_00642,The sequel to Madoka is aesthetically wonderful.,0,0,0,0,0,0
ukr_train_track_a_00643,Something knocked on the train; children in the next compartment: <unk> What was that?,0,0,0,0,0,0
ukr_train_track_a_00644,"With that, I ordered Ali a bottle to wash her nose.",0,0,0,0,0,0
ukr_train_track_a_00645,"I was suspicious and scared, too.",0,0,1,0,0,0
ukr_train_track_a_00646,"I'm not a moralist, but I know a 15-year-old girl who had to give birth to a rapist.",0,0,0,0,0,0
ukr_train_track_a_00647,"That's what you think you're good at in life, and then when you listen to your friends, it's sad for them.",0,0,0,0,1,0
ukr_train_track_a_00648,It's a lot of fun out there.,0,0,0,1,0,0
ukr_train_track_a_00649,I seek my own in the hearts of strangers.,0,0,0,0,0,0
ukr_train_track_a_00650,"When in all competitions they write in the instagram ""If you have more friends, you have a better chance of winning"", I cry.",0,0,0,0,1,0
ukr_train_track_a_00651,"Ksenia, why are you so scary?",0,1,0,0,0,0
ukr_train_track_a_00652,It's sad. Why can't I walk lightly?,0,0,0,0,1,0
ukr_train_track_a_00653,A year and a half after Dubno Twenty and life has changed that I didn't think and didn't guess :),0,0,0,1,0,0
ukr_train_track_a_00654,"When Kruger read the poem about the girl, she remembered Olshek.",0,0,0,0,0,0
ukr_train_track_a_00655,"Oh, the normal list came up, I'll see.",0,0,0,1,0,0
ukr_train_track_a_00656,They were afraid you'd find a replacement.,0,0,1,0,0,0
ukr_train_track_a_00657,She washed her head with her own shampoo.,0,0,0,0,0,0
ukr_train_track_a_00658,I'm taking a vacation in January from all this.,0,0,0,0,0,0
ukr_train_track_a_00659,You're riding a little bit on the bus and all of a sudden you see. And you're in a good mood right away:,0,0,0,1,0,0
ukr_train_track_a_00660,"Other people bring leaflets, sweets, and I bring socks.",0,0,0,0,0,0
ukr_train_track_a_00661,"I can't even get into the hall right now, sadly.",0,0,0,0,1,0
ukr_train_track_a_00662,I thought you couldn't tweet in the theater...,0,0,0,0,0,0
ukr_train_track_a_00663,"It's true) I he as I look at some of my classmates <unk>great teachers<unk>, it's even scary, because they studied in pairs",0,0,1,0,0,0
ukr_train_track_a_00664,"She always sipped katnis with a drink, because my gael.",0,0,0,0,0,0
ukr_train_track_a_00665,I'll be in a dress today.,0,0,0,0,0,0
ukr_train_track_a_00666,I asked a simple question at night: has the army's supply really changed at all in the last two years?,0,0,0,0,0,0
ukr_train_track_a_00667,How poorly it is tormented.,0,0,0,0,1,0
ukr_train_track_a_00668,#TIME when no one likes anything anywhere anymore,0,0,0,0,0,0
ukr_train_track_a_00669,His sister is also a good singer #Eurovision,0,0,0,0,0,0
ukr_train_track_a_00670,Ukraine is no longer for people!,1,0,0,0,0,0
ukr_train_track_a_00671,She's not afraid to take responsibility for the entire planet.,0,0,0,0,0,0
ukr_train_track_a_00672,I'll make you happy here. I'll take care of the garage.,1,0,0,0,0,0
ukr_train_track_a_00673,She poured tea on her cheek.,0,0,0,0,0,0
ukr_train_track_a_00674,"I've heard the argument that if you don't vote for #silentpeople, you're a Yankee.",1,1,0,0,0,1
ukr_train_track_a_00675,I had to let go of the last month.,0,0,0,1,0,0
ukr_train_track_a_00676,Watched a movie about the wife of the leader of the far-right in Greece.,0,0,0,0,0,0
ukr_train_track_a_00677,A mosquito was sitting on the cat's nose.,0,0,0,0,0,0
ukr_train_track_a_00678,"When the sun goes down, it's beautiful, and when the battery goes down, it's sleep.",0,0,0,0,0,0
ukr_train_track_a_00679,And I didn't know either,0,0,0,0,0,0
ukr_train_track_a_00680,I fell in love with the first series.,0,0,0,1,0,0
ukr_train_track_a_00681,"My uncle from Canada called and said, ""We celebrated the 4th birthdays of my grandfather, Stepanovich, my father-in-law and Jesus"".",0,0,0,0,0,0
ukr_train_track_a_00682,"Oh, how I'm going to behave when I'm so different from the way people see me.",0,0,0,0,0,0
ukr_train_track_a_00683,"I was scared today and almost fainted at the same time (really!!!), because it seemed to me that under Redison on Yarval, I saw Shenon Leto.",0,0,1,0,0,0
ukr_train_track_a_00684,I'm going to write chemistry on the 13th.,0,0,0,0,1,0
ukr_train_track_a_00685,I didn't lose my legs.,0,0,0,1,0,0
ukr_train_track_a_00686,I'm afraid of the virus that is transmitted via Twitter.,0,0,0,0,0,0
ukr_train_track_a_00687,Last day with my kids.,0,0,0,0,1,0
ukr_train_track_a_00688,"I've got the mushrooms in a dried form, and I'm happy.",0,0,0,1,0,0
ukr_train_track_a_00689,I should have worn a hat instead of talking about porn on Twitter.,0,0,0,0,0,0
ukr_train_track_a_00690,I'm kind of nostalgic for Ukraine today.,0,0,0,0,1,0
ukr_train_track_a_00691,"All night long, while sleeping, she lived in Odessa...",0,0,0,0,0,0
ukr_train_track_a_00692,"Pytor, where are the big boards from Poroshenko?",1,0,0,0,0,0
ukr_train_track_a_00693,"It's sad, although there are many...",0,0,0,0,1,0
ukr_train_track_a_00694,#FilmFilmFilm is a collaboration between Natalia Sergiana and...,0,0,0,0,0,0
ukr_train_track_a_00695,"The horse is standing with a cigarette, talking to the guy, and everything would be fine if that smoke didn't go to her baby in the stroller.",1,1,0,0,0,0
ukr_train_track_a_00696,I'm a fan of kindness,0,0,0,0,0,0
ukr_train_track_a_00697,I'm impressed with such expensive prizes!,0,0,0,0,0,1
ukr_train_track_a_00698,I'm sorry. My dad would have liked it too.,0,0,0,1,0,0
ukr_train_track_a_00699,"'Cause they say a full-length movie is worse than a TV show, and I'm just a full-length movie.",0,0,0,0,0,0
ukr_train_track_a_00700,It's nice to know that there are people in this world who don't know about the existence of Imagine Dragons.,0,0,0,1,0,0
ukr_train_track_a_00701,"I'm telling you, the dirt that's been dragged in here",0,0,0,0,0,0
ukr_train_track_a_00702,"Natalia Galina is a bit of a weirdo, but she's not a weirdo.",0,0,0,0,0,0
ukr_train_track_a_00703,"It's a mistake, but I'm going to make it.",0,0,0,0,0,0
ukr_train_track_a_00704,"I can't remember exactly what I was dreaming about, but there was definitely an airport.",0,0,0,0,0,0
ukr_train_track_a_00705,"After that, it was even worse.",0,0,0,0,1,0
ukr_train_track_a_00706,"It's nice to have a backpack, too.",0,0,0,1,0,0
ukr_train_track_a_00707,Aren't you in Dubna sometimes?,0,0,0,0,0,0
ukr_train_track_a_00708,"Come, let's read the names of reptiles, plants and sea creatures",0,0,0,0,0,0
ukr_train_track_a_00709,"I like Misha and Jurkesh, but I think Misha's victory is more needed, so for him #xfactor",0,0,0,0,0,0
ukr_train_track_a_00710,"I'd buy a shed, but it's going to stick.",0,0,0,0,0,0
ukr_train_track_a_00711,"I spent four hours in the kitchen, staring at someone at the mill with a knife, a spoon, fried fish, and a cheese plate.",0,0,0,0,0,0
ukr_train_track_a_00712,"The exam was supposed to be tomorrow, but now it's Monday! Is that normal?",0,0,0,0,0,1
ukr_train_track_a_00713,"I dreamt that there was a bombing of Kiev, that there were fighters everywhere and that I was hiding =>",0,0,1,0,1,0
ukr_train_track_a_00714,"""A novelty in the mouth is a health in the stomach.",0,0,0,0,0,0
ukr_train_track_a_00715,Westerners are so good and so proud.,0,0,0,0,0,0
ukr_train_track_a_00716,"I've been thinking about the 30th hurricane for a while now, and I'm thinking about the time I saw it in the woods in Chernivtsi before breakfast at Tiffany's.",0,1,0,0,0,0
ukr_train_track_a_00717,"In short, I hug you, I hug you, with a holiday, sunshine Stay the same wonderful and talented, happiness, health, love and inspiration to you!",0,0,0,1,0,0
ukr_train_track_a_00718,And here's the wild laughter of the older brother.,0,0,0,0,0,0
ukr_train_track_a_00719,The game is a great interactive online game for kids.,0,0,0,0,0,0
ukr_train_track_a_00720,"It's scary, but it's funny, and the number 11 is everywhere.",0,0,1,0,0,0
ukr_train_track_a_00721,"""Kerry"" is not a horror movie.",0,0,0,0,0,0
ukr_train_track_a_00722,I'm going to sit down and cry.,0,0,0,0,1,0
ukr_train_track_a_00723,"You can lie to yourself and the world that you're happy, smile, rejoice, laugh, and then go and hang yourself.",0,0,0,0,0,0
ukr_train_track_a_00724,"I get paid a lot, but unfortunately not for that.",0,0,0,0,1,0
ukr_train_track_a_00725,"""Semen, we'll refresh you in the heat of the day, we'll make you desolate and enjoy you.",0,0,0,0,0,0
ukr_train_track_a_00726,"I can see that Poroshenko and Turchin are writing code at night, and Poroshenko's son is wearing a hat.",0,0,0,0,0,0
ukr_train_track_a_00727,I didn't even think it could be that bad.,0,0,0,0,0,1
ukr_train_track_a_00728,"Yesterday I saw two people who were out of their minds, who were drinking water right out of their throats, and, calling themselves ""knowledgeable students"", they were misleading everyone.",1,1,0,0,0,0
ukr_train_track_a_00729,The boys are cooking dinner. It's heaven!,0,0,0,1,0,0
ukr_train_track_a_00730,"In the oak forest, in the hollow of the protein, the woman cooks borscht",0,0,0,0,0,0
ukr_train_track_a_00731,There was a lot of good alcohol yesterday.,0,0,0,1,0,0
ukr_train_track_a_00732,They demanded that Putyn join the army.,0,0,0,0,0,0
ukr_train_track_a_00733,How terrible it is when Russians are masked in Ukrainian.,1,0,0,0,0,0
ukr_train_track_a_00734,"I've been going through the archives of tweets from 2010 and 2010 and I've come across some really good tweets, and I remember almost all of them because I wrote them.",0,0,0,0,0,0
ukr_train_track_a_00735,I woke up in tears because I didn't feel you were there.,0,0,0,0,1,0
ukr_train_track_a_00736,I haven't eaten pasta this year.,0,0,0,0,0,0
ukr_train_track_a_00737,"People are dancing, lasers are flashing, fireworks are bursting!",0,0,0,1,0,0
ukr_train_track_a_00738,I don't want to sit on a park bench and breathe your smoke.,1,1,0,0,0,0
ukr_train_track_a_00739,I have a friend who is starting to get a little drunk.,0,0,0,0,0,0
ukr_train_track_a_00740,"The host of the show, Gromadsky, is on the air tonight.",0,0,0,0,0,0
ukr_train_track_a_00741,"Oh, that's not nice at all.",0,0,0,0,1,0
ukr_train_track_a_00742,"It's our family business, and I'm flattering love.",0,0,0,0,0,0
ukr_train_track_a_00743,"I still love horror movies, you know?",0,0,0,1,0,0
ukr_train_track_a_00744,"For a child, vinegar is poison.",0,0,0,0,0,0
ukr_train_track_a_00745,"But you have a son, and that's what makes this world so wonderful!",0,0,0,1,0,0
ukr_train_track_a_00746,"In a small photocopy, a woman is eating soup and watching a TV show.",0,0,0,0,0,0
ukr_train_track_a_00747,I've heard some terrible stories about a student who got a 95 and went to the bathroom.,0,0,1,0,0,0
ukr_train_track_a_00748,"She sat down, tucked herself in a blanket, brewed tea, and gave a lesson.",0,0,0,0,0,0
ukr_train_track_a_00749,The guy in the neighborhood asked why he was wearing a cross under his evening gown.,0,0,0,0,0,0
ukr_train_track_a_00750,The worst thing about new phones is that they're everywhere.,0,0,0,0,1,0
ukr_train_track_a_00751,I love that you can do it through Google Docs.,0,0,0,0,0,0
ukr_train_track_a_00752,Litvin wants to resign...,0,0,0,0,0,0
