id,text,anger,disgust,fear,joy,sadness,surprise
ukr_train_track_a_00994,The mayor voted for the lesser of two evils.,0,0,0,0,0,0
ukr_train_track_a_00995,"It's a bit sad, but more sad than not.",0,0,0,0,1,0
ukr_train_track_a_00996,It saved my day today.,0,0,0,1,0,0
ukr_train_track_a_00997,"I don't know about you, but I'm sure you've heard of the Lone Ranger #RocketRocket.",0,0,0,0,0,0
ukr_train_track_a_00998,She soaked herself in body milk.,0,0,0,0,0,0
ukr_train_track_a_00999,"I know both, it's just that I've already figured out the downsides, and I'm still hesitating about the pros.",0,0,0,0,0,0
ukr_train_track_a_01000,I've hardly ever seen you painted.,0,0,0,0,0,1
ukr_train_track_a_01001,It's the second year in a row I've been saved.,0,0,0,0,0,0
ukr_train_track_a_01002,And we miss you.,0,0,0,0,1,0
ukr_train_track_a_01003,"I've always been a fan of horror movies, but I've always been a fan of horror movies, and I've always been a fan of horror movies, but I've always been a fan of horror movies.",0,0,0,0,0,0
ukr_train_track_a_01004,"They say there's an alarm in Paris, but there's no panic.",0,0,0,0,0,0
ukr_train_track_a_01005,The cheeks are burning like radiators!,0,0,0,1,0,0
ukr_train_track_a_01006,"Alien: Covenant (2017) <unk> as they say, like eyes in shit melted.",0,0,0,0,0,0
ukr_train_track_a_01007,"Thank you, and I just got a smile from fate.",0,0,0,1,0,0
ukr_train_track_a_01008,"The Alpine Jazz Festival is now in its third year, and the festival is now in its fourth year.",0,0,0,0,0,0
ukr_train_track_a_01009,"Suddenly, she became a millionaire on Instagram.",0,0,0,0,0,0
ukr_train_track_a_01010,"Well, that's good, because I got scared.",0,0,1,0,0,0
ukr_train_track_a_01011,I want to go to Ternopil in winter too!,0,0,0,0,0,0
ukr_train_track_a_01012,#GoldenEye: Please come to #StandUp!,0,0,0,0,0,0
ukr_train_track_a_01013,"Of the 158 horror films I've seen, five are true, and the rest are either just creepy moments or rather ugly.",0,0,0,0,0,0
ukr_train_track_a_01014,"We keep the name, we cry when we cry.",0,0,0,0,1,0
ukr_train_track_a_01015,"I'm wearing a S.O.B.I. hat. But from February, for example, it's free.",0,0,0,0,0,0
ukr_train_track_a_01016,"I've got a hairy cat on my lap, so have a good day.",0,1,0,0,0,0
ukr_train_track_a_01017,"I don't know what you mean by ""public money""",0,0,0,0,0,0
ukr_train_track_a_01018,I'll be open at 11;-),0,0,0,0,0,0
ukr_train_track_a_01019,"We can hear it, and we can smell the spring outside.",0,0,0,0,0,0
ukr_train_track_a_01020,"You know, it's been a long time.",0,0,0,0,0,0
ukr_train_track_a_01021,"I'm sick, but my neighbor is worse, and I'm better off.",0,0,0,1,0,0
ukr_train_track_a_01022,I'm nervous when I'm asked to lend a pen or a ruler.,1,0,0,0,0,0
ukr_train_track_a_01023,"Yeah, I'll snap my fingers at the son!",0,0,0,0,0,0
ukr_train_track_a_01024,"In the night on Ivan's bed, Tatiana arranged for herself a guessing game. Which of the three horror films will be downloaded first?",0,0,0,0,0,0
ukr_train_track_a_01025,"How wonderful it is to go home in shoes, not boots, without jackets and coats.",0,0,0,0,0,0
ukr_train_track_a_01026,"I'm not sure if I'll be able to get in touch in two years, but I'm getting a lot of calls from people.",0,0,0,0,0,0
ukr_train_track_a_01027,"And the scariest thing is that I have a room in the attic, and I'm here alone, the whole family is downstairs.",0,0,1,0,0,0
ukr_train_track_a_01028,I don't even know what you've been tweeting about lately.,0,0,0,0,0,0
ukr_train_track_a_01029,"If I was afraid of difficulties, I wouldn't have gotten involved. I believe in you.",0,0,0,1,0,0
ukr_train_track_a_01030,"I'm going to bed at 2am today, and I'm going to be so excited to see you, and I'm going to be so excited to see you, and I'm going to be so excited to see you, and I'm going to be so excited to see you.",0,0,0,0,0,0
ukr_train_track_a_01031,"I went to bed at 7am yesterday, so I'm not sure if I'm going to be able to sleep, but I'm sure I'll be able to sleep tonight, so I'm going to be able to sleep.",0,0,0,1,0,0
ukr_train_track_a_01032,"The smell of toast, the hair in my nose, I'm going to eat.",0,0,0,0,0,0
ukr_train_track_a_01033,A little sunshine on this gloomy day...,0,0,0,1,0,0
ukr_train_track_a_01034,And I was driving on the roof of the Bra... as if I liked it,0,0,0,1,0,0
ukr_train_track_a_01035,"It's not bad or good, just information.",0,0,0,0,0,0
ukr_train_track_a_01036,I'm so glad I'm not the only one who's laughing at the three dots in the A-Z-A-A.,0,0,0,1,0,0
ukr_train_track_a_01037,"I feel like I'm coming home earlier than usual, but I'm so exhausted.",0,0,0,0,1,0
ukr_train_track_a_01038,Whether to grieve over the love-sickness or to rejoice over the patricks and to live.,0,0,0,0,0,0
ukr_train_track_a_01039,"I kissed and hugged the English teacher from Green Forest because I mistook her for my sister, whom I hadn't seen in ten years.",0,0,0,1,0,0
ukr_train_track_a_01040,And we congratulate you on your last holiday.,0,0,0,1,0,0
ukr_train_track_a_01041,The first thing I noticed in the hall was that the coach was so impressed with the performance.,0,0,0,0,1,0
ukr_train_track_a_01042,Happy holiest day of the year!,0,0,0,1,0,0
ukr_train_track_a_01043,The supermarket in Korsun.,0,0,0,0,0,0
ukr_train_track_a_01044,The bands that will be performing at the #Zazfest,0,0,0,0,0,0
ukr_train_track_a_01045,You've never seen anything like it.,0,0,0,0,0,1
ukr_train_track_a_01046,Give me honey for all the holidays,0,0,0,0,0,0
ukr_train_track_a_01047,#Raj is not on the promotional SMS from Kyivstar.,0,0,0,0,0,0
ukr_train_track_a_01048,"Vinnytsia is a beautiful city. The boys are great, too, if you ask me.",0,0,0,0,0,0
ukr_train_track_a_01049,Three weeks at home with complications.,0,0,0,0,1,0
ukr_train_track_a_01050,I am 16 years old and I am afraid to be home alone.,0,0,1,0,0,0
ukr_train_track_a_01051,But the show scares the hell out of me. There's been too many signs lately.,0,0,1,0,0,0
ukr_train_track_a_01052,"RT: And from the tears of those hot ones will melt That ice-cold, solid crust, Maybe the flowers will fall - and there will be another happy spring for me.",0,0,0,0,1,0
ukr_train_track_a_01053,It's sad. I'd be so stressed out about it.,0,0,0,0,1,0
ukr_train_track_a_01054,"We'll sit down with wine on a bench near the gallery and build a synonymous row to the word ""vaginal"".",0,0,0,0,0,0
ukr_train_track_a_01055,It's dull and smells bad.,0,1,0,0,0,0
ukr_train_track_a_01056,"I'm not sure if I'm going to be able to make it, but I'm sure I'll be able to make it.Vilnius news",0,0,0,0,1,0
ukr_train_track_a_01057,"My mother had seen the key a couple of weeks before, and yesterday my niece and I were visiting the village.",0,0,0,0,0,0
ukr_train_track_a_01058,When I wanted to be first,0,0,0,0,0,0
ukr_train_track_a_01059,"I made my choice today, but I'm very, very unsure about it.",0,0,1,0,0,0
ukr_train_track_a_01060,"The only thing worse than an absentee is an integrated student who has all the hallmarks of an absentee, but is studying in a boarding school.",0,0,1,0,0,0
ukr_train_track_a_01061,Is it really possible to fly to Copenhagen and back on the weekends?,0,0,0,0,0,0
ukr_train_track_a_01062,The worst thing is when you think your superficiality is wisdom.,0,0,0,0,1,0
ukr_train_track_a_01063,"We're just kidding, no one's going to bother you. Come on, we're happy for everyone. We have no idea what's going on.",0,0,0,1,0,0
ukr_train_track_a_01064,One of the most charming men I've ever read about.,0,0,0,0,0,0
ukr_train_track_a_01065,I've been eating a silkworm that is not sweet.,0,0,0,0,1,0
ukr_train_track_a_01066,Thank you for the advice.,0,0,0,1,0,0
ukr_train_track_a_01067,"R.I.P. Bumppo, you are one of a kind. #Bumppo",0,0,0,0,0,0
ukr_train_track_a_01068,The ears are full of lipstick.,0,0,0,0,0,0
ukr_train_track_a_01069,Triol RT: The feast of the Trinity:),0,0,0,0,0,0
ukr_train_track_a_01070,"She: He looked at me like that, he touched my shoulder, took my hand.",0,0,0,0,0,0
ukr_train_track_a_01071,It hurts to know that you still can't trust me with some things.,0,0,0,0,1,0
ukr_train_track_a_01072,I'm not sure I'm going to be able to chew my way through the waltz.,0,0,0,0,0,0
ukr_train_track_a_01073,I'm in the mood to cry today.,0,0,0,0,1,0
ukr_train_track_a_01074,"You know, I'm glad I didn't go there.",0,0,0,1,0,0
ukr_train_track_a_01075,Why don't you faggots vote for laws that are vital to the country?,1,0,0,0,0,0
ukr_train_track_a_01076,"Where to go, what to see in #Cherkassy?",0,0,0,0,0,0
ukr_train_track_a_01077,I wonder where Ukraine will be) #Eurovision,0,0,0,0,0,1
ukr_train_track_a_01078,A ticket. What a cute number!,0,0,0,0,0,0
ukr_train_track_a_01079,"Don't be shy, call the class.",0,0,0,1,0,0
ukr_train_track_a_01080,There is also the issue of free speech and the imposition of knowingly ugly things.,1,1,0,0,0,0
ukr_train_track_a_01081,It reminded me of New Year's in Prague:),0,0,0,1,0,0
ukr_train_track_a_01082,"Good morning, tv, have a good day. Be warm today and don't get sick.",0,0,0,1,0,0
ukr_train_track_a_01083,"They're scary and not cool, although there are exceptions.",0,0,0,1,0,0
ukr_train_track_a_01084,My favorite jokes are about necrophilia and gays.,0,0,0,0,0,0
ukr_train_track_a_01085,"It's delicious, I guess, and I've got a lot of work to do.",0,0,0,0,0,0
ukr_train_track_a_01086,"I'm not sad, but I'll remember it in my best days.",0,0,0,0,1,0
ukr_train_track_a_01087,A little bit of a push-up here and there and the panels and the drills and all that.,0,0,0,0,0,0
ukr_train_track_a_01088,It was a strange thing to happen.,0,0,0,0,0,0
ukr_train_track_a_01089,"""Don't worry"", the doctors say.",0,0,0,0,0,0
ukr_train_track_a_01090,Probably without tips on such issues it's difficult #quizwall_support is there a possibility of tips?,0,0,0,0,0,0
ukr_train_track_a_01091,I'm afraid of making decisions.,0,0,1,0,0,0
ukr_train_track_a_01092,"Congratulations, you've got a +10 to your vision.",0,0,0,0,0,0
ukr_train_track_a_01093,I'm afraid to conclude that kindness is a neurosis.,0,0,1,0,0,0
ukr_train_track_a_01094,So much for cabbage in the soup!,0,0,0,0,0,0
ukr_train_track_a_01095,I'm going to be a part of #Twimicola this year.,0,0,0,0,0,0
ukr_train_track_a_01096,I got my gift in August.,0,0,0,1,0,0
ukr_train_track_a_01097,But it's good that we're seeing each other.,0,0,0,0,0,0
ukr_train_track_a_01098,The potatoes are delicious. They're baked and with fish.,0,0,0,1,0,0
ukr_train_track_a_01099,"It's still a great show, though, no matter what.",0,0,0,1,0,0
ukr_train_track_a_01100,"Yeah, and the wind in the freezing cold is terribly inappropriate.",0,0,0,0,0,0
ukr_train_track_a_01101,I don't want kids yet.,0,0,0,0,0,0
ukr_train_track_a_01102,Show him with a voice?!,0,0,0,0,0,1
ukr_train_track_a_01103,I'm going for a walk in Chernobyl.,0,0,0,0,0,0
ukr_train_track_a_01104,"Well, I was out with my girlfriend in the park, and the kid was telling me a story.",0,0,0,0,0,0
ukr_train_track_a_01105,"Maybe it's the best thing for me right now. I just want to live in the summer, and other times of the year, I'm burdened.",0,0,0,1,1,0
ukr_train_track_a_01106,I got on the bus and smelled the same perfume.,0,0,0,0,0,0
ukr_train_track_a_01107,I read in a book that we don't like housework when there are inconvenient moments.,0,0,0,0,0,0
ukr_train_track_a_01108,"The other side of the coin is that the 54-year-old is a bit of a weirdo, but the other side of the coin is that the three-year-old is a bit of a weirdo, and the four-year-old is a bit of a weirdo.",0,0,0,0,1,0
ukr_train_track_a_01109,I have a friend who is a night owl in the kitchen.,0,0,0,1,0,0
ukr_train_track_a_01110,"From the army, hospitals, kindergartens and schools, to roads, landfills and lots of other things.",0,0,0,0,0,0
ukr_train_track_a_01111,Don't be fooled by the head of the #Rose,0,0,0,0,0,0
ukr_train_track_a_01112,"And these Frenchmen have been drinking from the same plastic glasses for three days, so dirty and sticky, even though they have a whole pack of new ones.",0,1,0,0,0,0
ukr_train_track_a_01113,Terra Incognita Zeta 3 is a great game.,0,0,0,0,0,0
ukr_train_track_a_01114,#FourthTruths at festivals I'm scared because someone accidentally pulls a #Zaxidfest on me,0,1,1,0,0,0
ukr_train_track_a_01115,I'm not sure if I'm the only one who thinks that the Corsican government is too afraid to mention itself on the Internet.,0,0,0,1,0,0
ukr_train_track_a_01116,The swimsuit is not a good fit for a woman with a neck that is so tight.,1,0,0,0,0,0
ukr_train_track_a_01117,"I've been looking at the I-Spot, the I-Spot, the I-Spot, the I-Spot, the I-Spot, the I-Spot, the I-Spot, the I-Spot.",0,0,0,0,0,0
ukr_train_track_a_01118,"For the first five minutes, I was terrified.",0,0,1,0,0,0
ukr_train_track_a_01119,I got out of the subway carelessly and grabbed the guy who showed up at the last minute.,0,0,0,0,0,0
ukr_train_track_a_01120,I've been without a laptop since May.,0,0,0,0,1,0
ukr_train_track_a_01121,I'm lying on the bed like a piece of boiled potato.,0,0,0,0,0,0
ukr_train_track_a_01122,"After our holidays, we need two more days of rest.",0,0,0,0,0,0
ukr_train_track_a_01123,I'm sitting in the bathroom looking at the poop in the tray.,0,1,0,0,0,0
ukr_train_track_a_01124,"But it's not about people beating nature, it's about people beating people. I don't even know what's worse.",0,0,0,0,1,0
ukr_train_track_a_01125,"I was wondering if you had time for the trains, I think so.",0,0,0,1,0,0
ukr_train_track_a_01126,"I'm not sure if I'm going to be able to do it, but I'm going to have to ask Victor Pavlik to do it.",0,0,0,0,0,1
ukr_train_track_a_01127,What's the fun in having a dacha?,0,0,0,1,0,0
ukr_train_track_a_01128,The great-grandmothers feared that the doll would be the soul of the child.,0,0,1,0,0,0
ukr_train_track_a_01129,The White Lion (URL #1),0,0,0,0,0,0
ukr_train_track_a_01130,I would say it's hardly a neo-romantic saga about Moses and his people.,0,0,0,0,0,0
ukr_train_track_a_01131,"I smeared the lava with peanut butter, sliced the banana, twisted it and grilled it.",0,0,0,0,0,0
ukr_train_track_a_01132,"I'm talking about classic horror! all kinds of mystical stuff like that, because reality as such is always scary.",0,0,1,0,0,0
ukr_train_track_a_01133,"Hey, good luck with that!",0,0,0,1,0,0
ukr_train_track_a_01134,A skirt with a scarf.,0,0,0,0,0,0
ukr_train_track_a_01135,"But when I spoke to the actors, it was strange.",0,0,0,0,0,1
ukr_train_track_a_01136,What about the trash?,0,0,0,0,0,0
ukr_train_track_a_01137,Addiction to people is worse than any drug,0,0,0,0,1,0
ukr_train_track_a_01138,The evening air of Kiev smells of freedom,0,0,0,0,0,0
ukr_train_track_a_01139,I think I stretched my wrists last night.,0,0,0,0,1,0
ukr_train_track_a_01140,"I can't write, I can't draw, I can't draw, I can't draw, I can't draw.",0,0,0,0,1,0
ukr_train_track_a_01141,"It's delicious, but it's very fatty.",0,1,0,0,0,0
ukr_train_track_a_01142,It's a new covenant against an old one.,0,0,0,0,0,0
ukr_train_track_a_01143,I've never seen a father at a graduation.,0,0,0,0,0,0
ukr_train_track_a_01144,"The election is a close one, and the highest turnout is for the ""Yes"" vote.",0,0,0,0,0,0
ukr_train_track_a_01145,"He was not willing to communicate, wished success and left.",0,0,0,0,0,0
ukr_train_track_a_01146,I didn't meet him there.,0,0,0,0,1,0
ukr_train_track_a_01147,"Thank you for your kind words, and I hope you enjoyed the day. *sigh* I'm sorry, but I'm not sure what to do.",0,0,0,1,0,0
ukr_train_track_a_01148,"Kit, happy birthday ^^ All the best and make your dreams come true ~",0,0,0,1,0,0
ukr_train_track_a_01149,The reason why the kids are so excited about the new year is because they are 9 months old and they are so excited about the new year.,0,0,0,0,0,1
ukr_train_track_a_01150,"Summer is coming to an end for me, and I'm going to have to get my pants back on and put on my sweatpants, and I'm going to have to get my pants back on.",0,0,0,0,1,0
ukr_train_track_a_01151,In the evening: (called the master at double rate),0,0,0,0,0,0
ukr_train_track_a_01152,"I had a really bad night's sleep, and I couldn't sleep at night, and then the sleep was so weak, I couldn't sleep.",0,0,0,0,1,0
ukr_train_track_a_01153,"I'm not sure if I'll be able to get on the 30th bus, but I'm sure there's a reason why I'm not going.",0,0,0,0,0,0
ukr_train_track_a_01154,"I'm a little confused today, so I'll be fine.",0,0,0,0,1,0
ukr_train_track_a_01155,I want to go to the mountains and sit by the fire with my guitar.,0,0,0,0,0,0
ukr_train_track_a_01156,I'd like to read about Italy.,0,0,0,0,0,0
ukr_train_track_a_01157,The post clearly reflects such despair and a mental and physical crisis that the author is even a little sorry,0,0,0,0,1,0
ukr_train_track_a_01158,I wasn't going to provoke anyone.,0,0,0,0,0,0
ukr_train_track_a_01159,"I always wanted to be loved, but I pushed away the people who managed to love me.",0,0,0,0,1,0
ukr_train_track_a_01160,"Good night, by the way. Sweet dreams and all that.",0,0,0,1,0,0
ukr_train_track_a_01161,It's a nervous breakdown. It's a good start to the week.,0,0,1,0,0,0
ukr_train_track_a_01162,"I'm scared, but by the end of the race, it was blue and red.",0,0,1,0,0,0
ukr_train_track_a_01163,I want to play the guitar again and learn to play.,0,0,0,0,1,0
ukr_train_track_a_01164,"With a schedule like this, it's easy to get a job.",0,0,0,1,0,0
ukr_train_track_a_01165,"I've been sitting on them for 4 hours now, and they're not so bad.",0,0,0,0,0,0
ukr_train_track_a_01166,This creates a lot of funny situations.,0,0,0,1,0,0
ukr_train_track_a_01167,And I've never been here before.,0,0,0,0,1,0
ukr_train_track_a_01168,I think it's worth the money.,0,0,0,0,0,0
ukr_train_track_a_01169,Are you wondering what Kharkiv is?,1,0,0,0,0,1
ukr_train_track_a_01170,Unpunished reading on vacation is the chapter about me right now.,0,0,0,0,0,0
ukr_train_track_a_01171,Pinterest is a good place to find me.,0,0,0,1,0,0
ukr_train_track_a_01172,"But I can't drive a car, D. Kreyzi.",0,0,0,0,0,1
ukr_train_track_a_01173,#Return to the police station in Lviv.,0,0,0,0,0,0
ukr_train_track_a_01174,"We're eating in a shopping cart, and there's a cow's poop.",0,1,0,0,0,0
ukr_train_track_a_01175,Why should I help you compensate for that now?,0,0,0,0,0,1
ukr_train_track_a_01176,"This evening is dedicated to Epolets ""Zradjuj"" and ""Melody"" on the wonder of life",0,0,0,0,0,0
ukr_train_track_a_01177,I feel better in my soul.,0,0,0,1,0,0
ukr_train_track_a_01178,Thank you for taking me on this crazy walk (I haven't walked the streets of the city in a long time) and for the crazy coffee shop.,0,0,0,1,0,0
ukr_train_track_a_01179,"After work, I go to #Euromaidan #euromaidan",0,0,0,0,0,0
ukr_train_track_a_01180,"I'm not sure what the circumstances are around me, but I'm interested in the plot.",0,0,0,0,0,0
ukr_train_track_a_01181,"I missed my kids so much, but now I have to get up in the morning.",0,0,0,0,1,0
ukr_train_track_a_01182,I woke up to this...worse phrase.,0,0,0,0,0,0
ukr_train_track_a_01183,The mistress's sweetness washes the dust from her eyes.,0,0,0,0,0,0
ukr_train_track_a_01184,Or a picture of the kitchen with a mess on it.,0,0,0,0,0,0
ukr_train_track_a_01185,"And I'm made of wood, and I have an athletic stretcher in my sister's, which is also a strange thing.",0,0,0,0,0,0
ukr_train_track_a_01186,The landlord asked me why I didn't want to get married.,0,0,0,0,0,1
ukr_train_track_a_01187,"I slept too much, and that's a sin for a graduate.",0,0,0,0,1,0
ukr_train_track_a_01188,The white-haired woman in the bright red coat with the healed fur coat was scrubbing her palms and rubbing these brain fragments on her clothes.,0,1,0,0,0,0
ukr_train_track_a_01189,"But I always walk by myself at night, you just have to calm down and stop shaking your own shadow.",0,0,1,0,0,0
ukr_train_track_a_01190,The company of girls from Odessa #lviv,0,0,0,0,0,0
ukr_train_track_a_01191,"I've been waiting for you to put the dust off the lamp, and here's the thing.",0,0,0,0,1,0
ukr_train_track_a_01192,I'm sorry you brought Catherine to Instagram.,0,0,0,0,1,0
ukr_train_track_a_01193,The tower of the High Castle is like the Eiffel Tower at night.,0,0,0,0,0,0
ukr_train_track_a_01194,"As always, I'm emotionally drained.",0,0,0,0,1,0
ukr_train_track_a_01195,"People are signing up, massively. Well, I'm not keeping anyone.",0,0,0,0,0,0
ukr_train_track_a_01196,"And then I was on the beach, and I was so shaken up, I was scared.",0,0,1,0,0,0
ukr_train_track_a_01197,There's nothing worse than unkempt nails and uncovered gestures.,0,0,0,0,0,0
ukr_train_track_a_01198,I still can't believe I lost my little girl.,0,0,0,0,1,0
ukr_train_track_a_01199,Invite me to your dreams... grief in your heart is bad...,0,0,0,0,1,0
ukr_train_track_a_01200,"At the stop of the Rustaveli Show #Lviv, boys and men gather.",0,0,0,0,0,0
ukr_train_track_a_01201,"Well, that's weird for me too.",0,0,0,0,0,1
ukr_train_track_a_01202,"In the village, cats are fat too, and the girl is fat too.",0,0,0,0,0,0
ukr_train_track_a_01203,"It's crazy that the Internet only works on the first floor, and I have to sit here. So it also slows down, like I do in algebra.",1,0,0,0,0,0
ukr_train_track_a_01204,I went to the bookstore and I regretted it.,0,0,0,0,1,0
ukr_train_track_a_01205,"I don't even want to look at him, to be scared and panic (because he's so big and fat - he'll fall to the ground for no reason).",0,0,1,0,0,0
ukr_train_track_a_01206,"I mean, it's all pretty detailed and unexpected (as if the author himself was there).",0,0,0,0,0,1
ukr_train_track_a_01207,#Good night friends now and in the future:),0,0,0,1,0,0
ukr_train_track_a_01208,But that's the impression the new peaches have gotten.,0,1,0,0,0,0
ukr_train_track_a_01209,"I'm afraid to watch the British, not to watch the American, but that's as long as all the seasons go up. I've got three series of season one.",0,0,1,0,0,0
ukr_train_track_a_01210,Greetings from a very nice family:),0,0,0,1,0,0
ukr_train_track_a_01211,"I'm not going to lie, I've met some really cool guys and I'm looking forward to seeing them win.",0,0,0,1,0,0
ukr_train_track_a_01212,"God, that's worse than if you wrote that you had another one.",0,0,0,0,1,0
ukr_train_track_a_01213,"It's a video, it's an audio, it's wonderful, and it's only two albums.",0,0,0,1,0,0
ukr_train_track_a_01214,I accidentally stumbled upon the coolest Ukrainian channel.,0,0,0,1,0,0
ukr_train_track_a_01215,I never thought I'd googled Vinny's text.,0,0,0,0,0,1
ukr_train_track_a_01216,I don't understand why they're selling it so cheap.,0,0,0,0,0,1
ukr_train_track_a_01217,"When I'm nervous, I get terribly shy, and sometimes I can even start to catch my breath.",0,0,1,0,0,0
ukr_train_track_a_01218,"When I came to Sheva, there was courage.",0,0,0,0,0,0
ukr_train_track_a_01219,"I have a fever, sneezes and tears in my eyes.",0,0,0,0,1,0
ukr_train_track_a_01220,"The seating is in favor, the filtration is in favor, more than in favor!",0,0,0,0,0,0
ukr_train_track_a_01221,"That's not the word, even if you play it.",0,0,0,1,0,0
ukr_train_track_a_01222,The rabbit is known for this.,0,0,0,0,0,0
ukr_train_track_a_01223,Sleep alone when I'm not around...,0,0,0,0,0,0
ukr_train_track_a_01224,I didn't see the millionaire because I was afraid I wouldn't appreciate it.,0,0,1,0,0,0
ukr_train_track_a_01225,"I wanted to be Monica, but not a brunette.",0,0,0,0,0,0
ukr_train_track_a_01226,But it's really going to change your life.,0,0,0,1,0,0
ukr_train_track_a_01227,"I've been laughing at it for two weeks, uh, fun.",0,0,0,1,0,0
ukr_train_track_a_01228,I don't like guys with long hair.,0,1,0,0,0,0
ukr_train_track_a_01229,"It's very cool and interesting, and you can get stuck in the south.",0,0,0,1,0,0
ukr_train_track_a_01230,The selfie of the Malibu and Larnaca survivors under the umbrella.,0,0,0,0,0,0
ukr_train_track_a_01231,"But when I drink water, it's like I'm cotton candy.",0,0,0,0,1,0
ukr_train_track_a_01232,You need to get some sleep or watch a TV show.,0,0,0,0,0,0
ukr_train_track_a_01233,(R.I.P. - you guys are really good at cooking.),0,0,0,1,0,0
ukr_train_track_a_01234,Sometimes I want a vacation from life.,0,0,0,0,1,0
ukr_train_track_a_01235,You have no idea what a fight I'm having tomorrow.,0,0,0,0,1,0
ukr_train_track_a_01236,It was the best kiss of my life.,0,0,0,1,0,0
ukr_train_track_a_01237,"The harvest has come, and everyone is still late...",0,0,0,0,1,0
ukr_train_track_a_01238,A grandmother's napkin was wrapped in the sacraments of the family - use it in cooking,0,0,0,0,0,0
ukr_train_track_a_01239,"The festival ""I want to go to Odessa"" will be held from June 28 to 30.",0,0,0,0,0,0
ukr_train_track_a_01240,"Mom: ""I want this elephant!""",0,0,0,0,0,0
ukr_train_track_a_01241,"I don't think 55 is a good number, but I think it's higher than me.",0,0,0,0,0,0
ukr_train_track_a_01242,I wonder if I'm home alone today or not.,0,0,0,0,0,0
ukr_train_track_a_01243,"Oh, my God, you're such a cool guy.",0,0,0,1,0,1
ukr_train_track_a_01244,A photo of a girl in a embroidered dress.,0,0,0,1,0,0
ukr_train_track_a_01245,Last day of work with the kids.,0,0,0,0,0,0
ukr_train_track_a_01246,"I'm baking brownies, reading a book, and I feel at home.",0,0,0,0,0,0
ukr_train_track_a_01247,"I was so touched by this familiar, offensive caress near the body under the wheels.",0,0,0,0,1,0
ukr_train_track_a_01248,Somehow with this garbage sorting I got lost.,0,0,0,0,1,0
ukr_train_track_a_01249,"If you'd seen it, it's panicking because it's afraid of transparent elevators!",1,0,1,0,0,0
ukr_train_track_a_01250,"53mm, who told me?",0,0,0,0,0,0
ukr_train_track_a_01251,"#Buddhism and the ""Spirit of the Church"" #Buddhism and the ""Spirit of the Church"" #Buddhism and the ""Spirit of the Church"" #Buddhism and the ""Spirit of the Church"" #Buddhism and the ""Spirit of the Church""",0,0,0,0,0,0
ukr_train_track_a_01252,I can't understand why the name Lida is associated with the cold.,0,0,0,0,0,1
