id,text,anger,disgust,fear,joy,sadness,surprise
ron_test_track_c_00409,How do you say something like that? It's De La Ante.,,,,,,
ron_test_track_c_00410,The number of new cases of Covid-19 in Romania is increasing alarmingly.,,,,,,
ron_test_track_c_00411,They collected nine lei but have to give back 468 the absurd situation in which thousands of Romans were because of a strange law,,,,,,
ron_test_track_c_00412,"The Russian vaccine will not be considered if it comes from the Russian Federation, China or another country, it must be pre-qualified by the WHO.",,,,,,
ron_test_track_c_00413,I'm glad there are people who think and have souls around here.,,,,,,
ron_test_track_c_00414,You're out of your mind. This is against 5G.,,,,,,
ron_test_track_c_00415,"""I'm so sorry, I'm so sorry, I'm so sorry"" - The last few weeks have been filled with a lot of ""I'm so sorry, I'm so sorry"" podcasts.",,,,,,
ron_test_track_c_00416,The EP was inspired by the visit of the singer to the George Enescu Festival.,,,,,,
ron_test_track_c_00417,"""The main conflict between London and Paris is about to break out,"" the French foreign minister said.",,,,,,
ron_test_track_c_00418,"Happy New Year to you all, and may the Lord bless you with a new year of happiness and fulfillment.",,,,,,
ron_test_track_c_00419,The sea is once again in terror.,,,,,,
ron_test_track_c_00420,A story of a story of a story of a door through the light Fine and simple could be heard so well and beautiful An episode of Alma <unk> Mulțumim <unk>,,,,,,
ron_test_track_c_00421,"Epidemiologists say that in the winter, there are two types of viruses, and it's a big problem if you get both.",,,,,,
ron_test_track_c_00422,Protests against the ban at the Chisinau airport in Romania,,,,,,
ron_test_track_c_00423,"I'm not afraid of the BAU, I'd rather die buried in art deco than in the victory of socialism.",,,,,,
ron_test_track_c_00424,"""I'm going to put a straw on the fire, and I'm going to ask you to stop buying fuel from Mol in the gas station.",,,,,,
ron_test_track_c_00425,"The Social Justice Party of the PSD (PSD) has appointed a new category of pensioners, called ""Veterans of war in misery"" (VVW), to be eligible for the pension.",,,,,,
ron_test_track_c_00426,It's okay. It's the first time. I was also very emotional.,,,,,,
ron_test_track_c_00427,"I'm a man of my word, but I forget and I want to cry when I look at these people who have done nothing wrong.",,,,,,
ron_test_track_c_00428,It's hard to express emotions in Romanian after living in another country for so long.,,,,,,
ron_test_track_c_00429,The mayor of Chisinau is on the verge of an ecological catastrophe,,,,,,
ron_test_track_c_00430,"""We are cursed"" ""Catastrophic famine explosion and coronavirus"" ""Huge blow to Lebanon""",,,,,,
ron_test_track_c_00431,"The Peril of Falling Earthquake of March 4, 1977",,,,,,
ron_test_track_c_00432,"I respect the team for their work, they do an exceptional job and I love them.",,,,,,
ron_test_track_c_00433,The murder of a young Romanian teenager with a broken head in a field in Italy is a case of the most horrific crime in history.,,,,,,
ron_test_track_c_00434,The bear is in the mouth with the uAutoModerator bear is breaking,,,,,,
ron_test_track_c_00435,Johnson's vaccine is also causing problems for the 180-year-old population.,,,,,,
ron_test_track_c_00436,"I've seen it three times, and I'm fascinated.",,,,,,
ron_test_track_c_00437,"The people who are infected with Covid-19 from Victor Babeș Hospital in Timișoara cannot vote, the members of the section do not want to send the mobile ballot box, fearing that they can infect the media.",,,,,,
ron_test_track_c_00438,"Artist at the 7th Festival of Living Statues in Bucharest, Romania, June 2017",,,,,,
ron_test_track_c_00439,The SPD's investigative committee is unconstitutional Those who do not come to the hearings will not be prosecuted as the PSD wanted,,,,,,
ron_test_track_c_00440,The effects of the earthquake that shook Turkey and Greece a minitsunami sparge the walls of houses and flood the port of Samos people are trapped between the dams,,,,,,
ron_test_track_c_00441,I'm working this afternoon listening to the mountain. Thank you.,,,,,,
ron_test_track_c_00442,"All the ""dinosaurs"" of Romanian politics that have not gotten a seat in Parliament",,,,,,
ron_test_track_c_00443,With hundreds of people saying a thousand Covid positive patients are on demand in hospitals with idiots protesting with exhausted and working continuously for four months with fewer and fewer places in hospitals I'm really afraid of what will follow,,,,,,
ron_test_track_c_00444,A teenager in a coma after being hit by a 15-year-old boy has died.,,,,,,
ron_test_track_c_00445,"The flooding of the river in the counties of Covasna, Harghita, Brașov and Botoșani, which occurred on Tuesday morning, caused a flood in the national road in Botoșani on Monday evening.",,,,,,
ron_test_track_c_00446,If she wants to resist the cunning covid I'm in isolation with so she can deal with something after I'm out of wartime like wartime victory requires sacrifices or we'll be lost on the battlefield,,,,,,
ron_test_track_c_00447,"The weather forecast for the next few days is for a severe and extreme drought in many regions of Romania, with crops being destroyed.",,,,,,
ron_test_track_c_00448,"The scene of the gunman with a pair of sticks and a stone, ten boys from the neighborhood or beaten because of a program at the fridge Video",,,,,,
ron_test_track_c_00449,"We thank him for having favored and protected the birth and intellectual evolution of such a man, so that his science may reach us through him.",,,,,,
ron_test_track_c_00450,Attention Yellow Cod of hydrological drought <|URL|>...,,,,,,
ron_test_track_c_00451,A man was beating the mechanic with a screwdriver dissatisfied with the way the piece was fixed,,,,,,
ron_test_track_c_00452,The person is now in police custody.,,,,,,
ron_test_track_c_00453,A young man accuses four gendarmes of illegally confiscating anti-AIDS treatment,,,,,,
ron_test_track_c_00454,What are the genetic and non-genetic traits that are written in your DNA?,,,,,,
ron_test_track_c_00455,Hello presenter the mask fell too low,,,,,,
ron_test_track_c_00456,One of the few beautiful and intelligent women.,,,,,,
ron_test_track_c_00457,What's been circulating on Facebook lately? What's EXPLOZIVE and NUCLEAR from DIICOT?,,,,,,
ron_test_track_c_00458,God fresteeeee of causalorrrr stam incasa God what nsesmintt,,,,,,
ron_test_track_c_00459,The blackest and most shameful day in the history of the Chamber of Deputies Gloriosi Fugitive as a rabbit,,,,,,
ron_test_track_c_00460,What the hell am I doing with kids?,,,,,,
ron_test_track_c_00461,I've just donated a lot of money to the reporters.,,,,,,
ron_test_track_c_00462,"The beautiful, intelligent, diplomatic and subtle I understood and knew better and I did well listening to you Felicitari and you <unk>PERSON<unk> you managed to bring out in the evidence the essence and the essential",,,,,,
ron_test_track_c_00463,One of the most unprofessional and unprofessional moderators is based on the notoriety of the form without background...,,,,,,
ron_test_track_c_00464,Scenes of horror in the U.S. A URIAS entered the protesters,,,,,,
ron_test_track_c_00465,The first state offices were divided after negotiations between the leaders of the right.,,,,,,
ron_test_track_c_00466,<unk> New Normal <unk> in the new totalitarian society built on a banal virus paranoid fear and ideological conformity will be generalized,,,,,,
ron_test_track_c_00467,A huge change in the famous surgeon X,,,,,,
ron_test_track_c_00468,I've been following this fascinating Felicitari for years.,,,,,,
ron_test_track_c_00469,The first edition of the Street Food Festival Cluj 2017,,,,,,
ron_test_track_c_00470,<p>Person will control the list of firms verified by ANAF,,,,,,
ron_test_track_c_00471,"The experiment ""mocheta"" failed The mayor <|PERSON<unk> gives up the plastic lawn after the wave of criticism",,,,,,
ron_test_track_c_00472,It's fascinating to discover the man behind such projects thank you for this material ,,,,,,
ron_test_track_c_00473,The river Prut exceeds the danger level by more than a meter.,,,,,,
ron_test_track_c_00474,The kind of self-discipline and self-discipline that many of today's young people should be building for the rest of their lives. - S.P.R.E.P.E.N.D.,,,,,,
ron_test_track_c_00475,"Super Investigation Recorder, I'm so sorry about that.",,,,,,
ron_test_track_c_00476,The PSD is still under siege and not under political siege.,,,,,,
ron_test_track_c_00477,"The ""Penalty"" for the ""Mineral Victim"" is the ""Anomaly"" of the Book of Records.",,,,,,
ron_test_track_c_00478,"""I'm a big fan of the ""Slow Down"" series, and I'm sure you'll find that it's a great way to get to know your audience and change your perspective on life.",,,,,,
ron_test_track_c_00479,Public debates on the amnesty ordinances and the penal code,,,,,,
ron_test_track_c_00480,We wish them a bright future in this wonderful existence. Don't forget to make copies. Many copies.,,,,,,
ron_test_track_c_00481,The images of nightmares in Ciuperceni after a BMW was dusted in a head of a bridge Three orphans remained,,,,,,
ron_test_track_c_00482,Thank you very much <|PERSON<unk> and <|PERSON<unk> ❤,,,,,,
ron_test_track_c_00483,I have a catfish in my house and I have a great fear of catfish.,,,,,,
ron_test_track_c_00484,"<p>Personally, I don't think you can see",,,,,,
ron_test_track_c_00485,Romania was dragged on the trail of the Bank of England Huge losses for the country Explosive Act signed by <|PERSON|>,,,,,,
ron_test_track_c_00486,"""I'm a good person"" - I'm a good person, and I'm a good person, and I'm a good person. - ""I'm a good person"" - I'm a good person, and I'm a good person.",,,,,,
ron_test_track_c_00487,I love you so much. Thank you so much for choosing to share this with us.,,,,,,
ron_test_track_c_00488,Thank you <>PERSON<> for this wonderful podcast I think everyone has a book of <>PERSON<> Congratulations to everyone❤,,,,,,
ron_test_track_c_00489,The unprecedented attack on his wife's address is the message of the former German manager.,,,,,,
ron_test_track_c_00490,"The psychologist known as the ""mind trainer"" warns that the use of smartphones by children has disastrous effects Their growing nervous system is faulty by this radiation.",,,,,,
ron_test_track_c_00491,A very valuable teacher of appreciated lucky students at Cluj,,,,,,
ron_test_track_c_00492,Rational consumption of water resources Meteorologists have issued the Cod Portocaliu of hydrological drought <|URL|>,,,,,,
ron_test_track_c_00493,He was fined for posting an insulting message to a police officer.,,,,,,
ron_test_track_c_00494,"The new spores will be calculated by the mayor's sons and daughters, multiplying the old ones by 0.",,,,,,
ron_test_track_c_00495,The tragedy of the Urias and the irreversible damage Who pays,,,,,,
ron_test_track_c_00496,The PSD is a party that can't vote for the government.,,,,,,
ron_test_track_c_00497,"""I am a true Om, a pure soul, who brings a lot of light around.",,,,,,
ron_test_track_c_00498,"This lady, with her personality, with the total gift with which she understood her life, is the proof of the power of the good soul.",,,,,,
ron_test_track_c_00499,"You're anxious, but you're afraid to acknowledge and treat yourself when everyone around you is anxious, your priest, your doctor, anyone who lives with a dose of anxiety.",,,,,,
ron_test_track_c_00500,"The actor is a natural in film and theater, and in everyday life, and in Moroccan culture he is a master of identification.",,,,,,
ron_test_track_c_00501,"Thank you for your kind words, I'm very happy to see you in Hungary, you are a great person, you have a great personality.",,,,,,
ron_test_track_c_00502,"When you're in a good mood, you're in a good mood, and you're smiling.",,,,,,
ron_test_track_c_00503,A large amount of rubble fell near a dam and endangered the belt of Cluj.,,,,,,
ron_test_track_c_00504,A very inspired car number.,,,,,,
ron_test_track_c_00505,My favorite podcast with the most wonderful people Greetings from Timișoara and good luck in the future,,,,,,
ron_test_track_c_00506,"He has filed a statement of defense with the Supreme Court, which has resumed the trial of the accused for perjury.",,,,,,
ron_test_track_c_00507,Wow a real lady What a wonderful chance they're offering <|PERSON<unk> <unk>,,,,,,
ron_test_track_c_00508,Panic clips for <|PERSON<> after she crashed on the field <unk> I ran out of air <unk>,,,,,,
ron_test_track_c_00509,What's going on with the USR Antenna 3?,,,,,,
ron_test_track_c_00510,How a young woman who refused to sleep with her boss was threatened with having her leg tendons cut off.,,,,,,
ron_test_track_c_00511,I love the way you're doing it. Good luck with the recorder. Good recorder.,,,,,,
ron_test_track_c_00512,COVID-19 arrests in Iran following the posting of some <unk> alarmist rumors <unk> on the internet about the coronavirus,,,,,,
ron_test_track_c_00513,"I'm not ashamed to admit it, but I've listened to it twice in a row.",,,,,,
ron_test_track_c_00514,The first data was a long time before the so-called official data rather than the data made from pixels It's all a kind of double accounting,,,,,,
ron_test_track_c_00515,Alarm signal issued by food distributors in the coronavirus crisis <unk> Major food supply disruptions could occur <unk>,,,,,,
ron_test_track_c_00516,"What he ""recommends"" to the new minister of the company he ran went into insolvency then bankruptcy",,,,,,
ron_test_track_c_00517,This character lies with shamelessness and creates with good knowledge panic and hysteria hoping to shut everyone's mouth thus allowing himself to threaten the Constitutional Court and the opposition Who do you think he is?,,,,,,
ron_test_track_c_00518,Hundreds of people in cars with Sv numbers driving through other counties are working to buy food or medicine.,,,,,,
ron_test_track_c_00519,"Thanks for the video, and for letting the characters speak for themselves, I hope you'll keep it that way.",,,,,,
ron_test_track_c_00520,The interview with Amandine was a great way to showcase the work of the people who have been in the industry for so long and who have made it so successful.,,,,,,
ron_test_track_c_00521,"The failed vaccination program that led to the deaths of over 17,000 women in Romania, hundreds of thousands of doses thrown away.",,,,,,
ron_test_track_c_00522,The Prime Minister of Norway held a press conference exclusively for <unk> It is normal to be afraid <unk>,,,,,,
ron_test_track_c_00523,The war is in another part if it stays these cases will disappear as if they were nau rescribe history maybe even a fatuca appears laughing on TV but if it comes out these will be the crimes of one who killed,,,,,,
ron_test_track_c_00524,Flood hazard in several municipalities of Brașov County,,,,,,
ron_test_track_c_00525,"The film, titled ""Amen"" (Amen) is based on the true story of a man who was arrested in a hotel room with his wife, another man, and a woman, a woman.",,,,,,
ron_test_track_c_00526,The winds of the Târgu Jiu have knocked down several trees in Central Pericol Park all the way...,,,,,,
ron_test_track_c_00527,"So we've just entered a mini-glacial period whose climax will be in about two years. These climaxes of solar cycles are often accompanied by catastrophic volcanic eruptions. After two years of cold winters, harvests will decrease drastically, leading to famine.",,,,,,
ron_test_track_c_00528,A new earthquake was detected in the Vrancea area at 222337 with a magnitude of <|URL|> on the Richter scale at a depth of <|URL|> km,,,,,,
ron_test_track_c_00529,I was a little freaked out at the test and had a panic attack. I'm afraid of the result. I can't even send it.,,,,,,
ron_test_track_c_00530,P I would do some panic shopping from Lidl Romania ,,,,,,
ron_test_track_c_00531,Under what conditions could the municipality of Alba Iulia enter the RED SCENARY Incidence rate at alarming level,,,,,,
ron_test_track_c_00532,I'm starting to panic. I don't want to anymore.,,,,,,
ron_test_track_c_00533,The best shot of Digg.,,,,,,
ron_test_track_c_00534,"The first was the DAC Diesel Auto Truck 120DE, produced in Braşov in 1985.",,,,,,
ron_test_track_c_00535,"I love you, Romanian, without a doubt.",,,,,,
ron_test_track_c_00536,"""Pray for the end of the famine, O Lord, who has given us food from the womb and has delivered us from the pestilence and severe disease, and has endured to this day, that your love may be with us and your goodness may not leave us.""",,,,,,
ron_test_track_c_00537,R.C.S. and R.D.S. have made a great announcement for all Romanians.,,,,,,
ron_test_track_c_00538,The story of the man who succeeded in everything he did.,,,,,,
ron_test_track_c_00539,Cancer Live is a live-streamed event to support the government.,,,,,,
ron_test_track_c_00540,An unusual earthquake occurred last night in Romania.,,,,,,
ron_test_track_c_00541,"But I think if we're going to continue to insult him, we're going to be consistent.",,,,,,
ron_test_track_c_00542,A picture with you Have a good day,,,,,,
ron_test_track_c_00543,"""Chirag"" is the name of the magistrates' law.",,,,,,
ron_test_track_c_00544,I have a lot of respect for the artist and the man.,,,,,,
ron_test_track_c_00545,You filthy animal,,,,,,
ron_test_track_c_00546,VIDEO Report What the daily journey of commuters on the Bucharest Chiajna Sauna on four wheels looks like,,,,,,
ron_test_track_c_00547,The number of COVID-19 cases has increased at an alarming rate in the last 24 hours.,,,,,,
ron_test_track_c_00548,The media and the media are part of the corrupt world.,,,,,,
ron_test_track_c_00549,Respect and congratulations to you and the Lord bless you,,,,,,
ron_test_track_c_00550,"A billion babies are killed every few years, more than the plague, world wars, terrible diseases, dictatorships, AIDS, and cancer put together.",,,,,,
ron_test_track_c_00551,The European Union has been experimenting with expensive products for the past nine months.,,,,,,
ron_test_track_c_00552,How nice and intelligent everything you've written,,,,,,
ron_test_track_c_00553,"I love you, O good Omen, I thank you for the good you have done for me, from the bottom of my heart, for this blessed Christmas.",,,,,,
ron_test_track_c_00554,What a man and what a destiny.,,,,,,
ron_test_track_c_00555,The COVID-19 Drug Alert: What it's all about,,,,,,
ron_test_track_c_00556,The shocking moment when a peaceful bear is shot in Predeal A witness filmed the scene that revolted the locals,,,,,,
ron_test_track_c_00557,"The book is called ""The History of the Soviet Union"" (1884-1935) and it is about the travels of the USSR.",,,,,,
ron_test_track_c_00558,I didn't expect this podcast to be so profound and interesting.,,,,,,
ron_test_track_c_00559,"The biggest concern these days is caused by the COVID-19 infection caused by the new coronavirus SARS-CoV-2 that appeared in Wuhan, China, last year, given the rapidity of the spread of the virus.",,,,,,
ron_test_track_c_00560,"This is a great podcast, and the guest moderator is a great addition to the podcast.",,,,,,
ron_test_track_c_00561,A seductive personality is a good thing to look at and listen to.,,,,,,
ron_test_track_c_00562,He was arrested by the driver's license office and the Department of Motor Vehicles for possession of more than 100 illegally obtained documents.,,,,,,
ron_test_track_c_00563,"The legendary video is a great one, and you are a true champion.",,,,,,
ron_test_track_c_00564,The doctor who had made his own hospital recorder,,,,,,
ron_test_track_c_00565,The night of the miracle of the miracle of the miracle of the miracle of the miracle of the miracle of the miracle of the miracle of the miracle of the miracle of the miracle of the miracle of the miracle,,,,,,
ron_test_track_c_00566,I honestly have a different opinion about this man now just thanks to you <|PERSON|> Thank you,,,,,,
ron_test_track_c_00567,"The horror film ""Invasion of the Body Snatchers"" is set in Africa, and the state of emergency has been declared.",,,,,,
ron_test_track_c_00568,Congratulations Lai made on Tata <|PERSON<unk> to be extremely open <unk>,,,,,,
ron_test_track_c_00569,"""You're the exception, your invitations are the exception"" is the third podcast I've watched that has brought me to tears.",,,,,,
ron_test_track_c_00570,A dialogue between the man and the playwright.,,,,,,
ron_test_track_c_00571,"It's so simple and yet so complicated, and I'm still working on a podcast that I'll be back to again.",,,,,,
ron_test_track_c_00572,"""Personal"" - ""Nervous exit to the palace"" - your question is of very great gravity",,,,,,
ron_test_track_c_00573,The terror of the 13 year old boy in the hallway of the school where he was studying.,,,,,,
ron_test_track_c_00574,You are a wonderful person and you will inspire many others to make such a decision.,,,,,,
ron_test_track_c_00575,"The phenomenon of low temperatures, possible devastating earthquakes, catastrophic volcanic eruptions, and which I wrote about about about two weeks ago.",,,,,,
ron_test_track_c_00576,"The world is in a state of chaos, and the world is in a state of chaos, because pornography is destroying Romania, the sexual revolution of the Illuminati.",,,,,,
ron_test_track_c_00577,The Romanian Student Federation after the tragedy in <unk>The lives of students are in danger<unk>,,,,,,
ron_test_track_c_00578,"In Hunedoara, 27 new cases of coronavirus are expected, the results of dozens of other tests are expected.",,,,,,
ron_test_track_c_00579,Don't go back to Romania. It doesn't offer you anything. This country will regret it bitterly.,,,,,,
ron_test_track_c_00580,The saddest day of the year for Romanian prisoners,,,,,,
ron_test_track_c_00581,An example of courage and reinvention Congratulations and success to both of you ❤️,,,,,,
ron_test_track_c_00582,You hear that? He doesn't know that. He's a boy.,,,,,,
ron_test_track_c_00583,"I'm glad to see that you're in Germany, because you deserve it. I'm glad to see young people so professional and passionate about what they do.",,,,,,
ron_test_track_c_00584,New restrictions in Denmark due to the fear of COVID-19 strain discovered in the UK,,,,,,
ron_test_track_c_00585,Happy New Year is a summer show that brings you a sense of calm in this hectic world.,,,,,,
ron_test_track_c_00586,"Sincerely, Simply, and Fiercly Thank You",,,,,,
ron_test_track_c_00587,The coronavirus horror stories that have been told by survivors.,,,,,,
ron_test_track_c_00588,"A general state of conflict will be created within Europe so that one state will say to another ""you live behind my back"" one state will accuse another and so it says united Europe will have to suffer the first blow war destruction despair hunger",,,,,,
ron_test_track_c_00589,"I think this is a great podcast, and I'm happy to see the feedback from the people who have been there and the way it's been handled.",,,,,,
ron_test_track_c_00590,"I was so scared I spat in the air, I bowed, and I gave him a little something.",,,,,,
ron_test_track_c_00591,"In the case of the Chinese businessman Salonta Om, he was accused of raping a little girl for nine months.",,,,,,
ron_test_track_c_00592,"""This is the great lady of TVR and the Romanian cultural world, the exceptional and invited FELICITARI.""",,,,,,
ron_test_track_c_00593,"The ""Rocketman"" was nominated for an Oscar for this film, and it's always a surprise.",,,,,,
ron_test_track_c_00594,What's it like to be in a relationship with a psychopath who doesn't care about you and destroys your life?,,,,,,
ron_test_track_c_00595,The scientific paper written using the iPhone's autocorrect system VIDEO,,,,,,
ron_test_track_c_00596,"As a student of journalism, this podcast is an extraordinary resource. I'm eager to hear things from the backstage, not the bibliography. It's also far beyond times and technology.",,,,,,
ron_test_track_c_00597,A 33-year-old HIV-positive paedophile has posted dozens of children on the Internet that have been stolen by prosecutors.,,,,,,
ron_test_track_c_00598,"The anti-corruption ""zealous"" one carried out exclusively by repressive means can create ""pranks of sincerity"" and can erode public trust, which will increase the cost of economic recovery.",,,,,,
ron_test_track_c_00599,"""Sibiu is inciting violence.",,,,,,
ron_test_track_c_00600,The hospital is in a state of emergency. <p> <p> <p> <p> <p> <p> <p> <p> <p> <p> <p> <p> <p> <p> <p> <p> <p> <p> <p> <p> <p> <p> <p> <p> <p> <p> <p> <p> <p> <p> <p> <p> <p> <p> <p> <p> <p> <p> <p> <p> <p> <p> <p> <p> <p> <p> <p> <p> <p> <p> <p> <p> <p> <p> <p> <p> <p> <p> <p> <p> <p> <p> <p> <p> <p> <p> <p> <p> <p> <p> <p> <p> <p> <p> <p> <p> <p> <p> <p> <p> <p> <p> <,,,,,,
ron_test_track_c_00601,I fell in Maramureș to Săliștea de Sus after a torrential rain <unk>It's a disaster Never was there such a thing <unk> Video <unk>URL|>,,,,,,
ron_test_track_c_00602,<unk>PERSON<unk> lost the case definitively intended by <unk>PERSON<unk> following statements in Parliament,,,,,,
ron_test_track_c_00603,What a fragile smartphone with a screen without edges,,,,,,
ron_test_track_c_00604,You've created a category for your own information sources.,,,,,,
ron_test_track_c_00605,I don't know where to sit to be as safe as the vast majority go up with masks under the nose or under the chin and more and cough or sneeze of me come to get off and take it to the leg pr,,,,,,
ron_test_track_c_00606,I'm a 14-year-old sinner and I never thought this would happen after the revolution.,,,,,,
ron_test_track_c_00607,A podcast with a lot of depth.,,,,,,
ron_test_track_c_00608,The alarm bells of hospitals are already overcrowded with people diagnosed with coronavirus and there should be hospitalized and severe cases of flu,,,,,,
ron_test_track_c_00609,"After contesting the election of Viorica Bate, the field league lost its membership through conviction.",,,,,,
