id,text,anger,disgust,fear,joy,sadness,surprise
ron_test_track_c_00201,The Adventures of an Eight-Class Doctor in Italy: How He Got to Be Sentenced to Prison,,,,,,
ron_test_track_c_00202,The baby was injured by doctors at the Pediatrie Cluj who did not know how to put a brush <unk>Miar be ashamed in your place<unk>,,,,,,
ron_test_track_c_00203,"The Nippers believe that the school bathroom is the most haunted place in the world, and that the place is haunted by a strange ghost that haunts the school bathroom while you're in the bathroom.",,,,,,
ron_test_track_c_00204,"The women are so beautiful, thank you for giving us such a wonderful gift.",,,,,,
ron_test_track_c_00205,"I'm afraid that in the end, when it's decided that the pandemic is over, many of us will no longer have the masks to take off, because they will be absorbed, perhaps irreversibly, through the skin, into the blood, into the neurons, and into the heart.",,,,,,
ron_test_track_c_00206,You are the most honest journalist.,,,,,,
ron_test_track_c_00207,This is one of my favorite podcasts.,,,,,,
ron_test_track_c_00208,China is sounding the alarm: The coronavirus pandemic is just the beginning.,,,,,,
ron_test_track_c_00209,"In his 2001 prediction, he predicted that a virus would decimate humanity by the end of the millennium.",,,,,,
ron_test_track_c_00210,Politicians also destroy the biggest literature festival in the country <unk> The FILIT Hyperliteratura Scandal,,,,,,
ron_test_track_c_00211,You're nice and simple besides your invitations Happy,,,,,,
ron_test_track_c_00212,He was beaten by wood thieves and fined by the police.,,,,,,
ron_test_track_c_00213,"Thanks for the interview, I'm sure you'll be able to hear the interviewers' opinions and feel the need to share them, but it's a great way to keep the conversation going.",,,,,,
ron_test_track_c_00214,"The pandemic has hit the German economy hard, the biggest crisis since 2009 to date.",,,,,,
ron_test_track_c_00215,"Welcome back, congratulations to the entire team, thanks to the sponsors and a lot of respect to the guests.",,,,,,
ron_test_track_c_00216,"The Kiev police are in a state of panic, and a threat message has been sent to the public with a picture of a tram.",,,,,,
ron_test_track_c_00217,The Embassy of the United States of America in Jerusalem (USA) has released a selfie of the Facebook page of the 2019 US presidential election.,,,,,,
ron_test_track_c_00218,"""Respect and admiration for this moving montage, the miracle of yesterday will forever remain in the history of the Roman people, good Ramesses, majesty, road to eternity.""",,,,,,
ron_test_track_c_00219,"The ""Personal"" is a ""Varga"" who is blackmailing him with criminal records.",,,,,,
ron_test_track_c_00220,The president's resignation accuses the education minister of destroying the credibility of the Council,,,,,,
ron_test_track_c_00221,"The Vasilis, who was in the SRI's sight for terrorism, had a working behavior.",,,,,,
ron_test_track_c_00222,It's hard to digest for those who need to be cared for.,,,,,,
ron_test_track_c_00223,The 13 most harmful amendments to the Criminal Code by the PSDALDE coalition,,,,,,
ron_test_track_c_00224,The award of the Parliamentary Award for the Rank and Compensation of the Minister of Pensions as a Judge of the CCR Epoch Times Romania,,,,,,
ron_test_track_c_00225,"I really enjoyed today's episode, thank you so much for watching and for the great feedback.",,,,,,
ron_test_track_c_00226,"For all pets, it's a very bad scare.",,,,,,
ron_test_track_c_00227,Article 27 lit. d and Article 14 lit. a of Law No. 51-1995 on the Organization and Exercise of the Republic's Bar,,,,,,
ron_test_track_c_00228,"Insidious Chapter 2 picks up where the last movie left off: The family is haunted by the body of a mysterious black bride and her husband, who doesn't know it, should know it after looking at a ghostly intro photo taken by the person.",,,,,,
ron_test_track_c_00229,This is Maggi Diavol illegal terrorist jihadist criminal of Razboi ISIS was on TV today and said to Misto to stop only bombing in Idlib Syria in which all these Diabolos ii bomb Syrians through Russians Turks and Syrians through <unk> <PERSON> with their Dracula parents,,,,,,
ron_test_track_c_00230,I love how you ended up refusing tomorrow's MULTUMESC,,,,,,
ron_test_track_c_00231,Lord what a miracle a force a wise man He and probably others like him make room for him <unk>PERSON<unk> to sit among us <unk>,,,,,,
ron_test_track_c_00232,Romania rocked by FIVE earthquakes every few hours via,,,,,,
ron_test_track_c_00233,Barna lost 2nd place because of the RISE articles change my mind,,,,,,
ron_test_track_c_00234,"On the 6th day, the Wombat was parked on the sidewalk.",,,,,,
ron_test_track_c_00235,"VIDEO I traveled by the ""ghost train"" from Bucharest between North and East stations",,,,,,
ron_test_track_c_00236,How interesting. Thank you.,,,,,,
ron_test_track_c_00237,The Ruach do Mar is the worst environmental disaster in the last quarter century.,,,,,,
ron_test_track_c_00238,"The book is a wonderful encyclopedia of women, it conveys a great deal of femininity and gentleness, and I know many things.",,,,,,
ron_test_track_c_00239,"I was in the middle of a video when I wrote this comment, and I listened to it until the end, breathlessly, and it was a great podcast interview.",,,,,,
ron_test_track_c_00240,A society based on fear and mistrust is a kind of prison.,,,,,,
ron_test_track_c_00241,The subway system in the city of Dormition has been delayed by 16 ministers for four years.,,,,,,
ron_test_track_c_00242,The person you're referring to is the podcast.,,,,,,
ron_test_track_c_00243,Eastern Europe is experiencing its worst drought in a century.,,,,,,
ron_test_track_c_00244,"The WHO is alarmed by the resurgence of Covid-19 in Europe, and Moldova is among the countries where the health system is close to collapse.",,,,,,
ron_test_track_c_00245,I'm not losing any. Thank you.,,,,,,
ron_test_track_c_00246,It's very rare to find people in Romania with whom you can discuss any subject.,,,,,,
ron_test_track_c_00247,I'm over 65 and I want to go shopping early in the morning when the shops are cleanest and least crowded.,,,,,,
ron_test_track_c_00248,You can drive in Romania with an electric roller permitted to drive in Germany on public roads,,,,,,
ron_test_track_c_00249,"One of the best reviews I've seen since I started the podcast, thanks for the follow up.",,,,,,
ron_test_track_c_00250,If you don't understand Cinema Cringe take your part of what you're taking from him I can't understand,,,,,,
ron_test_track_c_00251,"The nightmare video for ""Person"" - ""She was about to die""",,,,,,
ron_test_track_c_00252,"The Brazilian government has a death rate of 66 per cent of the total infected, while Romania has 66 per cent, and France has 156 per cent.",,,,,,
ron_test_track_c_00253,"Well, you didn't leave the microchip.",,,,,,
ron_test_track_c_00254,Thank you for this podcast full of peace and love of God.,,,,,,
ron_test_track_c_00255,"These doctors are men of character, well-bred, and they have a low regard for you, gentlemen.",,,,,,
ron_test_track_c_00256,A terrible accident occurred this evening at about 1pm on Václav Havel Street near the intersection with Abator Boulevard.,,,,,,
ron_test_track_c_00257,This woman redefines the notion of incredible sight.,,,,,,
ron_test_track_c_00258,The message of the mother of the policeman Gigin What does he reproach him with?,,,,,,
ron_test_track_c_00259,"The 13th US Open title winner is a man, and the only reason he's not a man is because he's not a man, and he's not a man.",,,,,,
ron_test_track_c_00260,Electric Castle's photos from the past.,,,,,,
ron_test_track_c_00261,"It was a very pleasant surprise, the host's voice was very loud.",,,,,,
ron_test_track_c_00262,We Romanians have a sayingIt's the man of PERSONpentu om om who is special and from whom you have much to learn Mr. Professor I wish you a lot of health ,,,,,,
ron_test_track_c_00263,Make a synthesis Let us be useful,,,,,,
ron_test_track_c_00264,The flag of the <>PERSON<unk> exhibited in the Carrefour Băneasa hypermarket,,,,,,
ron_test_track_c_00265,The two priests in the corner are looking at the parliamentarians. Some well-known politicians are missing.,,,,,,
ron_test_track_c_00266,The Brăţara area of death East to the Bucharest Poveşti horror in the world of poverty misery and horror,,,,,,
ron_test_track_c_00267,<p>Thank you very much <p>Always a pleasure ❤,,,,,,
ron_test_track_c_00268,Winter heavy snow high a narrow path through the snow a lady heads home from the opposite direction sees herself heading towards her a namil with her arms outstretched clutching her frightened gathers her strength and when the guy comes close she quickly comes to and gives him a healing kick,,,,,,
ron_test_track_c_00269,"I'm so glad you're here, I'm watching this podcast with great interest and love, and I'm so glad you're here, I'm so glad you're here.",,,,,,
ron_test_track_c_00270,A great initiative to bring these stories to the public.,,,,,,
ron_test_track_c_00271,Congratulations on what you do at Fain si Simplu Thank you to the guest for the life lesson ,,,,,,
ron_test_track_c_00272,"The first country to be hit by the third wave of the deadliest COVID-19 is on the verge of economic collapse, with Iran accusing the United States of ""crimes against humanity.""",,,,,,
ron_test_track_c_00273,I have the utmost respect for the Recorder team and the Lord.,,,,,,
ron_test_track_c_00274,"On November 3, 1971, he walked out of the stadium and announced to the crowd how many goals Dinamo had lost in the match against Feyenoord Rotterdam.",,,,,,
ron_test_track_c_00275,"The WHO warns that the last million infections in just eight days could be the next pandemic, killing millions of people.",,,,,,
ron_test_track_c_00276,"""God, what a beautiful man he was, a very fine man, and he spoke very eloquently, and was proud of what he was doing.",,,,,,
ron_test_track_c_00277,You're awesome. This podcast is awesome.,,,,,,
ron_test_track_c_00278,"In 1829, he admitted sadly that we were 200 years behind Western Europe in the press chapter.",,,,,,
ron_test_track_c_00279,You're the one who's bowing your head to you. That's exactly how I feel from Denmark.,,,,,,
ron_test_track_c_00280,"What's the cheapest way for you to donate? Bank transfer, YouTube payment, credit card payment.",,,,,,
ron_test_track_c_00281,"""I'm a very good speaker, Eugenia, I'm a very good speaker, I'm a very good speaker, I'm a very good speaker, I'm a very good speaker, I'm a very good speaker, I'm a very good speaker, I'm a very good speaker.",,,,,,
ron_test_track_c_00282,"I'm on the 3rd floor, thanks for watching.",,,,,,
ron_test_track_c_00283,Infrastructure projects extremely important for Romanian industry are at an impasse,,,,,,
ron_test_track_c_00284,I listened to the show with great interest. There's a lot to learn from these people.,,,,,,
ron_test_track_c_00285,Find out what's new in the Android M developer preview.,,,,,,
ron_test_track_c_00286,A girl was murdered and thrown into a ditch after her boyfriend was told she was married and had two children.,,,,,,
ron_test_track_c_00287,"I'm a German TV presenter and I'm a fan of the YouTube channel Healthy Life, and I hope you'll be able to keep up with us for many years to come.",,,,,,
ron_test_track_c_00288,The best version of wikigoogle ever is amazing respect ❤️ superpodcast,,,,,,
ron_test_track_c_00289,The Youth Orthodoxy website has a lot of comments about the events in France.,,,,,,
ron_test_track_c_00290,A bridge on the DN1A is a danger to drivers,,,,,,
ron_test_track_c_00291,"I am a true professional, and I have been to 4 of his conferences, so I am grateful for the opportunity to be able to share my experience.",,,,,,
ron_test_track_c_00292,"Conductors, insulators, and electrical current",,,,,,
ron_test_track_c_00293,He's a man who really deserves to be appreciated and supported. Fewer people on social media are exposing your life the way it is.,,,,,,
ron_test_track_c_00294,A toy from Carrefour stores has been withdrawn from the market,,,,,,
ron_test_track_c_00295,EMAIL is the most toxic and dangerous political form on the territory of Romania in the last 20 years Don't leave these monsters without a bit of empathy and respect far-right fascists conservatives to enter the parliament Stop Fascism,,,,,,
ron_test_track_c_00296,She was a practicing student. We all learn. You're the best at commenting.,,,,,,
ron_test_track_c_00297,Superb concept It would be nice in the Valenii de Munte area too😉,,,,,,
ron_test_track_c_00298,I'm still sticking with the Bani-Trist and Sin.,,,,,,
ron_test_track_c_00299,A magnitude 35 earthquake struck Romania on Sunday morning.,,,,,,
ron_test_track_c_00300,It would be a catastrophe to abandon this path of Romania towards Europe and towards modernity,,,,,,
ron_test_track_c_00301,The global horror scenario has been announced for the entire world.,,,,,,
ron_test_track_c_00302,Are you the one who's been giving us trouble?,,,,,,
ron_test_track_c_00303,He was held in the Rahova prison for fear of the PSD.,,,,,,
ron_test_track_c_00304,Thank you to the teacher for the positive example of getting up and overcoming the difficulties in life.,,,,,,
ron_test_track_c_00305,Alarm bell Romania has never experienced a drought like 5060 years ago,,,,,,
ron_test_track_c_00306,VIDEO <|PERSON|> to a person in a chair with <unk>What speed does it catch<unk>,,,,,,
ron_test_track_c_00307,<unk>PERSON<unk> is shaking,,,,,,
ron_test_track_c_00308,You're doing an extraordinary job. Thank you very much.,,,,,,
ron_test_track_c_00309,The owner of a clandestine slaughterhouse in central Bucharest has become aggressive with journalists,,,,,,
ron_test_track_c_00310,The situation in agriculture is serious We are in the Yellow Cod of drought <unk>There is a risk of food,,,,,,
ron_test_track_c_00311,"The new strategy of destruction of Rosia Montana, the Directorate of the Ministry of Culture, is playing the games of RMGC lawyers",,,,,,
ron_test_track_c_00312,Bucharest Jazz Festival 2017 5th and 9th July,,,,,,
ron_test_track_c_00313,The Immortal Multumim,,,,,,
ron_test_track_c_00314,"The weather service has issued a warning for a ""water shortage"" in the province of Portugal.",,,,,,
ron_test_track_c_00315,Two former prefects of Buzău sentenced to life imprisonment in the case of the illegal transfer of 5000 hectares of forest,,,,,,
ron_test_track_c_00316,"A billionaire was sentenced to two years and two months in prison for attempted murder, the court said.",,,,,,
ron_test_track_c_00317,I thank the doctor for the advice he gave me. My daughter has two children. Be healthy.,,,,,,
ron_test_track_c_00318,The most dangerous city on the internet,,,,,,
ron_test_track_c_00319,"White magic, black magic, and intermediate magic with seeds via Utopia Balkans",,,,,,
ron_test_track_c_00320,A woman in Dambovita was arrested for attempted murder after she hit her two-month-old baby.,,,,,,
ron_test_track_c_00321,The long-awaited crisis of the smart guys has come.,,,,,,
ron_test_track_c_00322,A massive earthquake sends a shock wave across the world.,,,,,,
ron_test_track_c_00323,"""Such a wonderful lady, and such a wonderful mission, and congratulations and great respect for all that you are and are doing.",,,,,,
ron_test_track_c_00324,Blessings with much love.,,,,,,
ron_test_track_c_00325,ksowpeow it's okay if you tremble and cry    ,,,,,,
ron_test_track_c_00326,"The United States has crossed the threshold of COVID-19 cases, the most populous country in the world.",,,,,,
ron_test_track_c_00327,who went through Covid19 talk <unk> Mam felt very scared complex ashamed helpless <unk>,,,,,,
ron_test_track_c_00328,The real reason for the delay is that I don't know anything about the Martian or the Invisible Man.,,,,,,
ron_test_track_c_00329,The UN has warned that 2021 will bring a food crisis of biblical proportions.,,,,,,
ron_test_track_c_00330,The dialogue is an enchanting intro to the Romanesque purity of the artistic tone.,,,,,,
ron_test_track_c_00331,Congratulations on your beautiful relationship with your family. I can't agree with your position on divorce.,,,,,,
ron_test_track_c_00332,The alarming number of COVID-19 infections is rising.,,,,,,
ron_test_track_c_00333,UN apocalyptic warning The coronavirus pandemic will cause a famine of biblical proportions,,,,,,
ron_test_track_c_00334,I think you've got big problems in your head. How sincere. I know how you put up with it.,,,,,,
ron_test_track_c_00335,"It's very aggressive, it's very documentary, it's very aggressive, it's very aggressive, it's very aggressive, it's very aggressive, it's very aggressive, it's very aggressive, it's very aggressive, it's very aggressive, it's very aggressive, it's very aggressive, it's very aggressive, it's very aggressive, it's very aggressive, it's very aggressive, it's very aggressive, it's very aggressive, it's very aggressive, it's very aggressive, it's what you're doing is what you're doing is what you're doing is what you're doing is what you're doing is what you're doing",,,,,,
ron_test_track_c_00336,"I'm so excited for the new album, I'm listening to it non-stop. ️",,,,,,
ron_test_track_c_00337,So this guy is brilliant. Bravo.,,,,,,
ron_test_track_c_00338,I love this song and it fills my heart with joy to hear it again and again. <br > <br > <br > <br > <br > <br >,,,,,,
ron_test_track_c_00339,ProTV is a contributor to the COVID-19 panic.,,,,,,
ron_test_track_c_00340,The floods in the Stefano Valley have destroyed hundreds of hectares of crops.,,,,,,
ron_test_track_c_00341,I've read the books and I'm afraid the geese are scaring me.,,,,,,
ron_test_track_c_00342,The advice of a Romanian doctor from Verona Romania not to get into the situation of Italy that it will be a disaster,,,,,,
ron_test_track_c_00343,The bloody war with the Canadian Mafia seems to have no end,,,,,,
ron_test_track_c_00344,"COVID-19 patients are dying in hospitals on ventilators, and they need oxygen therapy.",,,,,,
ron_test_track_c_00345,Crime ORIBILĂ <unk> 18-year-old girl killed in a drinking in an abandoned house in Vișeu de Sus via Mare 24,,,,,,
ron_test_track_c_00346,BNR makes the earthquake announcement for our country All Romanians are targeted will be horrible,,,,,,
ron_test_track_c_00347,It's illegal to bet on unlicensed online casinos.,,,,,,
ron_test_track_c_00348,The FBI is concerned about possible violence before the inauguration.,,,,,,
ron_test_track_c_00349,Coronavirus is a disaster for hundreds of thousands of people.,,,,,,
ron_test_track_c_00350,How many cases of coronavirus have been detected in the world?,,,,,,
ron_test_track_c_00351,"""I'm a person who can be an example to many of us, an exceptional person who has evolved and continues to evolve.""",,,,,,
ron_test_track_c_00352,The 101st and 102nd are more informative.,,,,,,
ron_test_track_c_00353,The number of infected is increasing alarmingly.,,,,,,
ron_test_track_c_00354,I've written enough. Commuldar de buhnici. I don't like the impostor at all.,,,,,,
ron_test_track_c_00355,"The National Weather Service is issuing a new alert for severe weather, with yellow and orange warning signs, thunderstorms, and hail.",,,,,,
ron_test_track_c_00356,"""With all due respect, sir, this is the lady's charm; the guests are all of high quality in every respect, and she assumes this constant questioning.",,,,,,
ron_test_track_c_00357,"Holy shit, he's got no chill.",,,,,,
ron_test_track_c_00358,The new emergency ordinance is partly unconstitutional.,,,,,,
ron_test_track_c_00359,"""What's happening in America, when it was different in America, somebody stop Americanization before it's too late.""",,,,,,
ron_test_track_c_00360,"If you want to translate a text from English to English, you can use Google Translate to read the text.",,,,,,
ron_test_track_c_00361,"It's a great feeling to be back in the UK after a long absence, and I'm so happy to be back in the UK with my newest member, Camila, from Portugal.",,,,,,
ron_test_track_c_00362,The Electric Castle 2017,,,,,,
ron_test_track_c_00363,The war on the border of Europe is declared by Turkey.,,,,,,
ron_test_track_c_00364,The MCV concludes with an extreme harshness for it demands the immediate suspension of the application of the Justice Laws and the revocation of the prosecutors themselves,,,,,,
ron_test_track_c_00365,I love the quality of the people you bring to the podcast and we have so much to learn from.,,,,,,
ron_test_track_c_00366,The recorder is a congratulatory note.,,,,,,
ron_test_track_c_00367,It was so aggressive that I couldn't get close enough to show it was the size of a finger.,,,,,,
ron_test_track_c_00368,The person's embarrassing reaction to the word offender,,,,,,
ron_test_track_c_00369,Hackers attacked the traffic light system in the capital,,,,,,
ron_test_track_c_00370,"The best and the brightest, the best and the brightest, the best and the brightest, the best and the brightest, the brightest, the brightest, the brightest, the brightest, the brightest, the brightest, the brightest, the brightest, the brightest, the brightest, the brightest, the brightest, the brightest.",,,,,,
ron_test_track_c_00371,Where you can find apartments for sale by individuals,,,,,,
ron_test_track_c_00372,The idea that life on two wheels is more dangerous,,,,,,
ron_test_track_c_00373,"I had the honor of teaching the course of Middle History of Romania, a man of high professional ethics, whatever you want.",,,,,,
ron_test_track_c_00374,The Botoşani has given the greatest GENIES ROMANEITRĂIASCĂ MOLDOVA <unk>👍👍👍LUI <>PERSON<unk> CEL MARE and SFÂNT <unk>,,,,,,
ron_test_track_c_00375,"The Pippin family is in danger, and next year you will not see them here again.",,,,,,
ron_test_track_c_00376,"It was 2 a.m. when you tweeted, ""I'm terribly uncomfortable.""",,,,,,
ron_test_track_c_00377,"""I'm a man and I'm a woman"" is a phrase that is often used in the context of the social gathering, and it's a phrase that is often used in the context of the social gathering. - ""Celebrate the good, the good, the good, the good, the good, the good.""",,,,,,
ron_test_track_c_00378,It's a wonder that Mrs. Maia is so romantic and that you have such a heritage.,,,,,,
ron_test_track_c_00379,"""The Father, through each apparition, has much to convey and gives meaning to our lives. I will be grateful to you always to be the protector of life. Christmas blessings to all.",,,,,,
ron_test_track_c_00380,The deportations to Transnistria and life there represent the final version of the Romanian genocide.,,,,,,
ron_test_track_c_00381,The most dangerous roads in Europe,,,,,,
ron_test_track_c_00382,The coronavirus has created panic in the world and the world has reacted harshly.,,,,,,
ron_test_track_c_00383,"The ""Criticism"" of the report is a political one, not a second-rate country.",,,,,,
ron_test_track_c_00384,They must have been pretty scared to send this mess.,,,,,,
ron_test_track_c_00385,These interviews have a therapeutic effect.,,,,,,
ron_test_track_c_00386,Police threatened the government with protests.,,,,,,
ron_test_track_c_00387,The first photo on the Wiki page of Teleorman County is a picture of a cemetery,,,,,,
ron_test_track_c_00388,I can't find a room under 450€ in the same apartment as the best in the area.,,,,,,
ron_test_track_c_00389,An impressive story with a lot of love and respect,,,,,,
ron_test_track_c_00390,The budget deficit for the first nine months is 636 of GDP Romania is going through the biggest crisis in the last 100 years along with the global economy.,,,,,,
ron_test_track_c_00391,"UPDATE: A knife attack in Nice has left three people dead and several injured, but it does not rule out a terrorist attack.",,,,,,
ron_test_track_c_00392,From <unk>PERSON<unk> to Pereci scorojiți play and cruel misery,,,,,,
ron_test_track_c_00393,The gallery with the pomegranates is watching the thermometers the cold wave is endangering the fruit production,,,,,,
ron_test_track_c_00394,The criminal is the one who defends himself from robbery in his house guns are evil and minorities are always victims,,,,,,
ron_test_track_c_00395,"France will experience its worst recession since the end of World War II in 2020, the economy minister said.",,,,,,
ron_test_track_c_00396,What I like about this woman is that she's honest and very well grounded in reality. I want a boss like her.,,,,,,
ron_test_track_c_00397,The Portuguese code has made a disaster in Giurgiu <|URL|>...,,,,,,
ron_test_track_c_00398,I've noticed from how many I've been around the area only about three more hold on to the idea of leading a normal life the rest or locked benevolently they've withstood a lot but eventually they've overcome their fear waiting to be used their fear is slowly coming back as,,,,,,
ron_test_track_c_00399,"Details of the partial solar eclipse on Friday, March 20, 2015",,,,,,
ron_test_track_c_00400,The GRECO report will ask Romania to immediately disband the Section for the Investigation of Anomalies.,,,,,,
ron_test_track_c_00401,"Great talk, thank you, I'll admire all three of you and your colleagues from the shadow.",,,,,,
ron_test_track_c_00402,The inspection of the South Bucharest Square,,,,,,
ron_test_track_c_00403,Romania is at risk of losing the hosting of the European Medicines Agency due to the political crisis caused by the PSD,,,,,,
ron_test_track_c_00404,"The most popular podcast I've listened to in a while is the one about the ""Friends"" podcast.",,,,,,
ron_test_track_c_00405,The TVR is more of a ROG show with this man so beautiful and good It's a treat for our souls Thank you,,,,,,
ron_test_track_c_00406,Diplomacy is the manusa for <unk>PERSON<unk> sir <unk>PERSON<unk> Congratulations,,,,,,
ron_test_track_c_00407,"After watching this, you'll be afraid to sleep.",,,,,,
ron_test_track_c_00408,A strong woman with a strong heart is a strong woman.,,,,,,
