id,text,Anger,Disgust,Fear,Joy,Sadness,Surprise
deu_train_track_a_01893,"I can't understand these people: in times of highly infectious mutants, they endanger others to the highest degree! This can't be justified by anything, I can also lead the dispute in another way! Unfortunately, expression of inconceivable empathy and extremely low education, a dangerous combination",1,1,1,0,1,0
deu_train_track_a_01894,I just feel terrible because I've gained so much weight.,0,1,0,0,1,0
deu_train_track_a_01895,"It's normal for everyone to be afraid, so it's very brave of you to take this step!",0,0,0,1,0,0
deu_train_track_a_01896,I lived the whole pregnancy in Leggings of Snag (and have not squeezed myself in jeans again now 10 months later).,0,0,0,0,0,0
deu_train_track_a_01897,"Thank you for your work with children, no matter what country they come from.",0,0,0,1,0,0
deu_train_track_a_01898,"I've had this for years and I've given up at some point. I still have male friends, but the women usually disappear with the relationship...",0,0,0,0,1,0
deu_train_track_a_01899,"If you pay your garbage fees by weight, that's understandable.",0,0,0,0,0,0
deu_train_track_a_01900,Because you answer to everything that's not on the tree on three.,0,0,0,0,0,0
deu_train_track_a_01901,"A #people's murder army must also lie out of consideration for the remaining humanity (one works concertatly to eliminate it - yes, also YOU) that it also killed armed terrorists (resistance fighters) - besides countless civilians (=#people's murder).",1,1,0,0,0,0
deu_train_track_a_01902,"In 90% of cases, ""POV"" is used wrongly it makes me crazy",1,0,0,0,0,0
deu_train_track_a_01903,Young people look so godless today,0,0,0,1,0,0
deu_train_track_a_01904,"Hi, you hope it doesn't work because it has so many limitations? It sounds like you've been through a really long journey and would be quite exhausted. I wouldn't want to have so many restrictions and potential side effects either... Do you like sharing what your therapy looks like, so what do you do besides the drugs?",0,0,0,0,1,0
deu_train_track_a_01905,I got Nix from the Corona virus. Not even had a cold. Even this winter not yet. I am 3x against Corona vaccinated and complaint free. Hope that this remains the same,0,0,0,1,0,0
deu_train_track_a_01906,The other day I read: Genocide is a process and not a single act. I often think about it.,0,0,0,0,1,0
deu_train_track_a_01907,I feel really hurt today by you I write nothing ass anymore,1,0,0,0,1,0
deu_train_track_a_01908,"I wish you all the best for your further journey. That you have written all this down surely helped you a bit to feel a little better - just let out everything that you've locked away in you for so long. You can keep writing. You don't have to post it all in public. For that, some thoughts are certainly way too intimate. But just write. This can help with the processing. And if you read your texts again in a quieter moment, they can also give you some information. It's really great that you've been looking for help and you've already got an appointment with the psychologist so quickly.",0,0,0,1,0,0
deu_train_track_a_01909,"So first of all I would definitely wish for more because I truly adore this setting. I, as the lovecraft and horror fan who I am, love the fishing village setting so abnormally very much that is incredible and you put it with these two chapters in a brilliance which amazed me deeply. Thanks for allowing me to read such a work and I am honestly very excited about how this story is going on.",0,0,0,1,0,0
deu_train_track_a_01910,"Can we please stop pretending that any of these help is going to help people? Lubricating and bribery money for ""influencing"" politicians, governments, companies and NGOs there Little of it improves anyone's life, on the contrary.",1,1,0,0,0,0
deu_train_track_a_01911,"What will the "" cartels do when the AfD reaches over 50% ?? Then you will be biddering and mulling again just to get to power. Germany will never exist before 2015, society is deeply divided.",1,1,1,0,1,0
deu_train_track_a_01912,I once stopped at a 100 meter sprint so stupid that both Achilles tendons are torn at the same time. Wasn't cool,0,0,0,0,1,0
deu_train_track_a_01913,"February 6 and the #Hamas, despite the court order of January 26th, did not release the #Geiseln. What does #South Africa do as a representative of Hamas? Nothing! This proves that the lawsuit at the IGH was only about #Israel and #Jew hatred. There is no evidence of a #genocide to date. #BringThemAllHome",1,1,0,0,0,0
deu_train_track_a_01914,"If it were super, at least you wouldn't have to see the poison anymore",0,1,0,1,0,0
deu_train_track_a_01915,I celebrated my 90th birthday a few days ago. Today my grandson is visiting and told me about Reddit and this community. If someone is interested in the perspective of an old man: AmA! It typed: The grandson [E],0,0,0,1,0,0
deu_train_track_a_01916,"Would you like to have it as entertaining as I would if we had doping Olympics? Where everyone can take and squirt as much stuff as he/she wants and then just off for it? 100 m run with 40 km/h, wide throw over 2 km and the whole basketball team is 3 meters on average?",0,1,0,1,0,0
deu_train_track_a_01917,"I try to go out every day. To be honest, I like so rainy weather, with pleasant fresh wind. In summer I usually sweat to death and unfortunately I have/have had a problem with it so far because of social phobia. So yes, it definitely has an influence on my mind.",0,0,0,1,1,0
deu_train_track_a_01918,"And then the AfD laughs about creating peace without weapons, you can't figure it out.",1,1,0,0,0,0
deu_train_track_a_01919,Maybe music or audio books radio plays? But I would point out your companion before you have your playlist on his cell phone so he/she can take care of it. And you just have to say music please.,0,0,0,0,0,0
deu_train_track_a_01920,"Incredible! It's not that it wasn't bad before. But since Putin Tucker gave Carlson this interview, Western media and politicians only have more snap-breathing. The editors of state television Putin would like to declare war in person.",0,1,0,0,0,0
deu_train_track_a_01921,"How does the cult manage to indoctrinate the members so strongly? My best friend or his family was a member at that time. He had just started a apprenticeship as a sattler and I got a call on one evening. He wanted to say goodbye because he is now moving to a cult center with his father in Denmark. From now on, too. I thought it was a joke. That's now... 22 years ago... I never heard of him again. I hope he is doing well.",0,0,1,0,1,0
deu_train_track_a_01922,"The 12-year-old came home very sadly earlier. She wanted to become a mistress tomorrow with a girl from her class, but her mother forbids dealing with my daughter because I had her vaccinated against Covid. And I thought there were no such people in real life.",0,1,0,0,1,0
deu_train_track_a_01923,"A small recommendation, which might help you to learn: This is a website where there are news from all over the world in simple language. Recommended also for people who have just started learning German.",0,0,0,0,0,0
deu_train_track_a_01924,"""I will not coal with this AfD, the alleged alternative, and I will not cooperate with it. That is a promise I give you here today. Everything else would be dishonest!"" #hartaberfair",0,1,0,0,0,0
deu_train_track_a_01925,"Of course, it's bad, but I find the wording to be strange when I withdraw.",0,1,0,0,0,0
deu_train_track_a_01926,You miswritten 2032,0,0,0,0,0,0
deu_train_track_a_01927,"I didn't re-orientate myself, but I studied and didn't finish (due to external circumstances). My tip: It certainly doesn't hurt to think about reorienting yourself now, but: Complete your studies in any case. You can use it as an excuse if you can keep your knowledge up-to-date somehow. And even if not -- in Germany, at least it shows conservative people that you are able to finish a difficult and lengthy task successfully.",0,0,0,0,0,0
deu_train_track_a_01928,Where do people get this motivation to make so overly horny breakfast I eat the first thing that comes to me because of hunger,0,0,0,0,0,1
deu_train_track_a_01929,Imagine: Palestinians who have been starving for days try to get food for their children/babies and are shot by IDF,1,1,0,0,1,0
deu_train_track_a_01930,"Before iwelche AfD sympathizers ask again why so much is reported about the demos? Because they are the biggest demos in German history, because they are important and correct and because they are aimed for democracy, openness and tolerance and against the AfD and all enemies of democracy!",1,1,0,1,0,0
deu_train_track_a_01931,The second half was really strong that looked very good today. So it has to go on.,0,0,0,1,0,0
deu_train_track_a_01932,"Your value increases significantly with the participation in a WELTMEISTERSCHAFT. After the player career these experience values are asked. No one in the industry/media etc. will hire a rebel, because unpredictable and no fellow runner. In the next World Cup Qatar is already forgotten. As an athlete a World Cup is the Mount Everest of mountaineering, to this goal you work for decades and have little chance to achieve this goal.",0,0,0,0,0,0
deu_train_track_a_01933,It is only when Israel is finished with the genocide that the hostages are only means to an end.,1,1,0,0,1,0
deu_train_track_a_01934,"moin, first of all thank you for doing the AMA. How big is the Mormon community in Germany? know these only, because I have family in the U.S. and there are many mormons in the region where they live. in Germany(general europe) mormons have not yet come across me",0,0,0,0,0,0
deu_train_track_a_01935,"""Yes, it's good now. We're here to listen to music, and I used to be at concerts.",0,0,0,0,0,0
deu_train_track_a_01936,Bruh I can't read sorry my guilt,0,0,0,0,0,0
deu_train_track_a_01937,"#Putin is a master strategist! He has achieved everything he never wanted. NATO expansion, 2 years 3-day war, Russia's coal is gone, his oligarch gang is soon broke, Russia still has foreign exchange reserves for 1.5 years and he has to kiss the little man from North Korea's feet.",0,1,0,0,0,0
deu_train_track_a_01938,Stop all arms deliveries and money gifts to the thoroughly corrupt regime in Kiev and the war has quickly come to an end.,1,1,0,0,0,0
deu_train_track_a_01939,Greetings back to you,0,0,0,1,0,0
deu_train_track_a_01940,"I have no answer to the question, but I have to say one thing: the choice of the image section is brilliant - the Mülheimer in the foreground is epic! *MadeMyDay*",0,0,0,1,0,0
deu_train_track_a_01941,"Don't understand the first sentence, but agree with the rest!",0,0,0,0,0,0
deu_train_track_a_01942,"Is one automatically, if one is against wind farms, a climate change denier? Or is that the same story as during Corona? I don't want to be a vaccination and then I'm a corona denier immediately?",1,0,0,0,0,0
deu_train_track_a_01943,But - as painful as that sounds! They can!,0,0,0,0,1,0
deu_train_track_a_01944,"The Zionist terror brings contempt and racism to a new, sad level...",1,1,0,0,1,0
deu_train_track_a_01945,The AfD is not compatible with Christian or humanistic values.,0,1,0,0,0,0
deu_train_track_a_01946,I'm very sorry for you! Letting your grief out is the absolutely right way. You can do it. Your mother can be proud to have such a strong child.,0,0,0,1,1,0
deu_train_track_a_01947,The idea is great! I bet you're a role player! Thanks for the great story!,0,0,0,1,0,0
deu_train_track_a_01948,I don't even believe the date.,1,1,0,0,0,0
deu_train_track_a_01949,Solidarity with all workers and environmental activists,0,0,0,0,0,0
deu_train_track_a_01950,It comes as an intermediate layer under butter cream on the bisquit.,0,0,0,0,0,0
deu_train_track_a_01951,The difference between Auschwitz and Gaza: Auschwitz prisoners feared that the world would not believe what was happening there. Gaza prisoners have known for more than 76 years that the West did not believe them. This grew their strength. Israel hates it.,1,1,0,0,1,0
deu_train_track_a_01952,The Greens must be banned,1,1,0,0,0,0
deu_train_track_a_01953,"High quality bras. Well finished, in the right size. Makes a huge difference for convenience and back. Shoes High quality detergent.",0,0,0,0,0,0
deu_train_track_a_01954,"In 20 years, the glacier reserves are almost exhausted.",0,0,1,0,0,0
deu_train_track_a_01955,"Update: Just sit in a lecture and learn about derived secondary forms. Honestly, I hope the person who made up *that* sucks on all eternity demon tails in hell. I think I'm crying to sleep tonight. Soon is exam time.",1,0,1,0,0,0
deu_train_track_a_01956,Not only Ukrainian children are affected. Even children of other nationalities often do not get a place in school in a timely manner. Despite compulsory schooling.,0,0,0,0,1,0
deu_train_track_a_01957,"Most of the people here can inform themselves and know that rape certainly occurred. It was not the purpose and purpose of the Hamas attack. What do you want to do? To relativize a possible genocide in which you, as a member of the government, could be involved?",1,1,0,0,1,0
deu_train_track_a_01958,"I see this similar to the others. I also have a lot of male friends and acquaintances through my hobby ( soccer) and also work colleagues it usually harmonizes more than with work colleagues. I also meet with them privately, alone - but everything in consultation with my partner. As long as that is in order for him nothing stands in the way. Just as he should clarify it with his girlfriend. Especially if you four often do things together.",0,0,0,0,0,0
deu_train_track_a_01959,Have you just woken up? Now that you had to experience it on your own? Now you can feel minimal what Palestinian innocent civilians and reporters there for years only happens that many pay with death,1,1,0,0,0,0
deu_train_track_a_01960,"I don't know how many times I've written this. The Gaza Strip could be the Levant's Riviera, the aid money would all be used for what they're supposed to be. Tourism alone would fill the cash registers.",1,1,0,0,1,0
deu_train_track_a_01961,"Had also an early abortion during the last pregnancy, but did not get prescribed pills. (Now in the 35th week) I would easily see it as a support. Progesterone is especially important until the 12th week and if you can reduce the chance of another miscarriage, it is good. If you are unsure, ask your doctor again or read the package leaflet.",0,0,0,0,1,0
deu_train_track_a_01962,"First of all, I wish you all the best and that the symptoms will subside soon. As far as I know, gynecologists should not issue employment bans. My gynecologist also said that if she could, she would actually send every pregnant woman to BV. Was that why you were already with a company doctor? My company sent to the one for our region to be on the safe side. He sent me directly to BV. Unfortunately, I also noticed that there are more stringent ones and not so strict ones.",0,0,0,0,1,0
deu_train_track_a_01963,Stop & look forward. Maybe leave another number for a therapist so your girlfriend can do better next time,0,1,0,0,1,0
deu_train_track_a_01964,Thanks for the compliment,0,0,0,1,0,0
deu_train_track_a_01965,Do you still have the children's watches with wobbly eyes?,0,0,0,0,0,0
deu_train_track_a_01966,"The narrative of the climate crisis is pure propaganda. It is based on lies, embezzlement and manipulation and the computer models of a corrupt science business. Once again, it is exclusively about profit for a few, the Green Deal.",1,1,0,0,0,0
deu_train_track_a_01967,"Sounds like he has an episode of coercive action/OCD. Get help on how you deal with it, and it would be good if he could be diagnosed.",0,0,1,0,0,0
deu_train_track_a_01968,"I wasn't in my childhood, but when I developed fatal thoughts as a result of an unhealthy relationship with a woman in my 20th year. How did you initiate the clear dreams? Do you have an explained goal (access subconscious e.g.)? Have you ever had a false awakening? How did you deal with it? Thank you for the AMA",0,0,0,0,1,0
deu_train_track_a_01969,"Asks who instrumentalizes....... I find it GREAT that this generation dares and wants to move! Go Greta, go Youngstars go!!!!!!",0,0,0,1,0,0
deu_train_track_a_01970,"What do you work as or have you already worked as, especially at the beginning? And during your working holidays? And was that enough to finance your living while doing so? I find this totally exciting, but most reports you find online are simply from native English speakers who then work as an English teacher...",0,0,0,0,0,0
deu_train_track_a_01971,"You're trying to destroy people who don't fit your worldview, but you're not afraid of a lie!",1,1,0,0,0,0
deu_train_track_a_01972,"The whole country is corrupt, and so are its foreign donors and war drivers!",1,1,0,0,0,0
deu_train_track_a_01973,"If you don't already have it: get a stretcher for the baby, then you can also stick it to yourself while working. Maybe she can pump it off and you feed it by bottle? Talk to her how you can relieve it. Just take a walk or go to the bathroom alone in peace already works wonders.",0,0,0,0,0,0
deu_train_track_a_01974,"My hairdresser said that no child with blue hair has yet been born, just because the mother dyed the hair. Smart, I know. So my doctor had told me that there are no reliable study results on the effects during pregnancy (as with 100,000 other substances and behaviors). She advised me not to dye for the first three months. I kept on that, plus a little longer, and after that I looked so shit (grey) that I was very happy to see my smart-haired hairdresser again.",0,0,0,0,0,0
deu_train_track_a_01975,"I think every wind turbine should have a guard like a lighthouse, I don't know what it would do, but I want the job, I'd love to be quiet.",0,0,0,1,0,0
deu_train_track_a_01976,"Actually, a good sign when so many trolls act against arms supplies. That means Moscow is in fear and panic.",0,0,0,1,0,0
deu_train_track_a_01977,I once entered the topic with Google Scholar for fun: seems to be able to lead to orgasm under special circumstances.,0,0,0,1,0,1
deu_train_track_a_01978,I'll never be able to do anything like that. Really beautiful! :),0,0,0,1,1,0
deu_train_track_a_01979,"Why do we on the Palestinians' side always speak of ""destroyed"" and not of ""murdered""? The Israeli government is responsible for this massacre and they are currently also standing before the International Court of Justice for this!",1,0,0,0,1,0
deu_train_track_a_01980,Thank you for doing this! I would be very interested in how the child (youth/n :) is doing and she/he reacts! Maybe you'll keep us up to date?,0,0,0,1,0,0
deu_train_track_a_01981,"I will, thank you!",0,0,0,1,0,0
deu_train_track_a_01982,"Russia just keeps trolling the whole world, preparing for the next conflict in Europe, and our chancellor is just waiting around.",1,0,1,0,1,0
deu_train_track_a_01983,"I have had to fight with urinary tract infections (before and during pregnancy), but my ET is only in the autumn. I have not played a role in the delivery mode in bladder inflammation. I have only been advised to point out in time in case of a caesarean section, so that the bladder catheter does not stay in it for so long. Otherwise, exercises for the pelvic floor help me.",0,0,0,0,0,0
deu_train_track_a_01984,Fully packed with great things that make life more beautiful...,0,0,0,1,0,0
deu_train_track_a_01985,Ilo calls me and says we haven't talked about you for a long time.,0,0,0,1,0,0
deu_train_track_a_01986,"I also stopped this once, because I got something else and had to get Venlafaxin out before. I slowly sneaked out under medical supervision, so the dose was reduced over a longer period of time. Then that shouldn't give me any big problems. From today to tomorrow just won't take any more go wrong and cause withdrawal symptoms. I didn't have any other problems than that I missed the mood- brightening effect.",0,0,0,0,0,0
deu_train_track_a_01987,Ukraine is still ruining us all,0,0,1,0,0,0
deu_train_track_a_01988,"Have my own dog and I'm also Team Stockwerfer. Apart from the fact that it is currently breeding and setting time, a dog that is not available does not have to run without a leash.",1,0,0,0,0,0
deu_train_track_a_01989,if smoking is not good why looks so cool,0,0,0,0,0,1
deu_train_track_a_01990,"Sauces of all kinds go well, I could still cook well noodles or rice. I also find casserole easy to freeze, basically everything goes. Just be careful with tomato, if you want to breastfeed. Know some, me included, whose babies then became sore. Otherwise you can try some good TK-kost from the supermarket. A friend lived from it and also gave me plenty of gifts. But I was unexpectedly fit in the weekly bed and hardly even handled my frozen supplies. But then I ate them later and some were after seasoned really good and at least according to the content not really bad.",0,0,0,1,0,1
deu_train_track_a_01991,"As long as people don't understand (want!) it will change, but only for the bad! Go vegan",0,1,0,0,1,0
deu_train_track_a_01992,"Do you know what I find even worse? Germans who call the mass murder of Jews in World War II a disgrace, etc., but at the same time think that they have the right to permanently teach the Jews of today morally.",1,1,0,0,0,0
deu_train_track_a_01993,That you use such a cool film cover for such dirt floorless,1,1,0,0,0,0
deu_train_track_a_01994,I know that too well,0,1,0,0,0,0
deu_train_track_a_01995,"I couldn't see the movie yet - but did I still want to -, but I was interested in what was the difference between the production of a TV series and a movie? Did you just have more budget, did you try to tell ""more cinematic"", did you change something about the humor, so that it might work better in the cinema? And then still as a big Pastewka fan, where you (and Chris Geletneky) were also involved: I liked to end the show sometime before it runs dead, but are there any plans for a new (replacement) project (best again with Bastian)?",0,0,0,0,0,0
deu_train_track_a_01996,"No sex, what did it look like in general, did you hardly kiss, hug and cuddle? If not and the fact that she was regularly celebrating, speaks for me rather that she probably found someone else, probably in the middle of an affair. Would be my first thought. One before without communication rarely works well. She doesn't even want to fight for your marriage. Think she found someone else there.",0,1,0,0,1,0
deu_train_track_a_01997,"I once had an online acquaintance that had a similar problem (I think). He said he didn't care and he just couldn't find any hobbies. I don't know if that's the same for you. I think if you were depressed for a long time, you can forget what it feels like to have an interest in something. In that respect, I would also understand you (if that's what you meant).",0,0,0,0,1,0
deu_train_track_a_01998,Wow the pig,0,1,0,0,0,0
deu_train_track_a_01999,No weapons no Selensky no war,0,1,0,0,0,0
deu_train_track_a_02000,I just don't want to get up and read this crap anymore.,1,0,0,0,1,0
deu_train_track_a_02001,Israel's violence against Palestinians is older than Hamas,1,1,0,0,1,0
deu_train_track_a_02002,Strange. Why does she dare to show such a lack of decency in a situation where the Greens are constantly losing their consent? What does the government know?,1,0,0,0,0,0
deu_train_track_a_02003,"Funny that you're always right, just because you don't agree with the current government...",1,1,0,0,0,0
deu_train_track_a_02004,"So Israel is starving people and even the US must intervene, while Germany is firmly at Netanyahu's side.",1,1,0,0,1,0
deu_train_track_a_02005,Taurus-Leaks: The scandal is that German officers with German weapons are planning an attack against Russia to the fullest detail. Isn't that punishable? The German media are distracting and claim that Scholz lied when he put in his Taurus Veto. Completely crazy.,1,1,0,0,0,1
deu_train_track_a_02006,Should give much more news if something didn't get as bad as thought. Good for general honesty and psyche.,0,0,0,1,0,0
deu_train_track_a_02007,What is your plan after your studies? Do you want to stay in the EU or DE or go back to the hopefully soon pacified country or leave it open?,0,0,0,0,0,0
deu_train_track_a_02008,"What do you think about when a German potato like me comes up with the idea of learning Turkish? Not even for some particular reason, but just like that. Where we're at it. Do you know Turkish books (Romans or prose), movies/series and/or music that may not be quite as conservative in their world view? Doesn't have to be super progressive, but I want to have the feeling that I have something more cosmopolitan before me. Gender equity and LGBT+-related/topics would of course be a dream but my hope is low",0,0,0,0,0,0
deu_train_track_a_02009,"It's very difficult to find friends and new acquaintances when you're quite down and down. Unfortunately I know that enough, but head up! It's all going to happen again :) At least try to see it as positive and don't blame yourself for everything - as difficult as it may sound now. If you like, you can write to me. I always have an open ear for such situations & only rarely to fight with such problems. Maybe I can give you some tips on how to better approach people to find new friends.",0,0,0,0,1,0
deu_train_track_a_02010,"She seems unhappy with the way you live together. Whether she's really lesbian now or maybe bi or just looking for something new, she probably doesn't know for herself. I think distance between you two will be the best thing for the whole family so that you can sort your needs out and then you can talk about how you're going to stay. Focus on yourself and ask yourself what you want for your future and how this can be complemented with your role as a father and your children.",0,0,0,0,1,0
