id,text,Anger,Disgust,Fear,Joy,Sadness,Surprise
deu_train_track_a_00001,"No, no, no, no, no, no, no, no, no, no, no, no, no, no, no, no, no, no, no, no, no, no, no, no, no, no, no, no, no, no, no, no, no, no, no, no, no, no, no, no, no, no, no, no, no.",1,0,0,0,0,0
deu_train_track_a_00002,100 years ago you went out on the street because you hoped to get a better life in Germany. Today the people go out on the road to further animate the government! FELIZ ALEMANHA,1,1,0,0,0,0
deu_train_track_a_00003,When Gabby Epstein finally gets married,0,0,0,0,0,0
deu_train_track_a_00004,"Because of the song 1001 night, a phantom gate and because he has just met many times Actually quite well imo",0,0,0,1,0,0
deu_train_track_a_00005,"Then we should try to reach them. On Twitter and Facebook they are relatively active. If enough people talk about it, the chancellor candidates or their parties will already take a look at it.",0,0,0,0,0,0
deu_train_track_a_00006,It's a contradictio ad adjecto from your mouth.,0,1,0,0,0,0
deu_train_track_a_00007,"Would take another shot of cynicism, please - thank you!",1,0,0,0,0,0
deu_train_track_a_00008,My forgotten bank account still contains money?,0,0,0,1,0,1
deu_train_track_a_00009,"If you didn't really master the language, I wouldn't do it. Is that natural or not? We're raising bilingual from the beginning, because my husband comes from Ireland. I speak perfect English, but I didn't even read English until recently. Meanwhile, our daughter knows that she speaks English with Papa and German with Mama. Only now I read English books to her. She's also 2, but she's already very far in terms of language, with sentences of 4-5 words in both languages.",0,0,0,0,0,0
deu_train_track_a_00010,Do you think that something will change in the long term about the desolate overall situation in rail traffic?,1,0,0,0,0,0
deu_train_track_a_00011,"I just went to my gynecologist and told her that I wanted to take the pill. She gave me folic acid tablets and told me to get some. Which one did you take and can recommend them or does it matter which one you buy? What experiences did you have, what should I pay attention to, except no raw food?",0,0,1,0,0,0
deu_train_track_a_00012,"""Tausch Kernöl-Rohöl:must laugh very loudly.",0,0,0,1,0,0
deu_train_track_a_00013,"Unfortunately I know very well. I often have a very good social life especially over the summer and then even establish new contacts but this usually doesn't last long, because I am very bad in contact with you thanks to depression and adhs. In winter, almost everything breaks away when the depression gets worse except my best friend.",0,0,0,0,1,0
deu_train_track_a_00014,we want to travel but who fits the cat on,0,0,0,0,0,0
deu_train_track_a_00015,"Instead of simply trying to stop the war without further armed violence, this should be the discourse, in the commentaries, in the Bundestag, and internationally. Ukraine will not win this out of its own power, nor with Western weapons.",0,0,0,0,0,0
deu_train_track_a_00016,"Have you already considered psychotherapeutic outpatients, also at university clinics? At my university, this outpatient clinic, which can be found via the Uni website itself, is also free for all. And there is the number of therapists so high that the waiting times are acceptable. I really press all the mule that you will find something soon! Or maybe you will use help points like that of Caritas or something like that for the transition? No permanent solution, but a start to have a perspective again. EDIT: First of all you saw that you are studying: Then there is ALWAYS an internal psychological consultation for students.",0,0,0,0,0,0
deu_train_track_a_00017,"As someone who worked at a funeral home, I can tell you that this is one of the most normal things. Death belongs to life. I've seen a lot of parents with their baby at funerals and this didn't bother anyone.",0,0,0,0,0,0
deu_train_track_a_00018,"I was diagnosed with gastric cancer in October 2021. From November to January I had 4 chemotherapy treatments, on January 18 the stomach was completely removed, since mid-February another 2 chemotherapies were given, in mid-March infected with Corona, which led to my immune system being completely down and therefore an abscess on the butt formed. Must be notified. Since the end of April I get the last two chemo treatments. Today is the day when the whole spit has an end. As you can see, life can sometimes be hard to one. Don't give up. No matter what times you have to go through. Everything will be fine again at some point.",0,0,0,1,1,0
deu_train_track_a_00019,cool we want to lie together,0,0,0,1,0,0
deu_train_track_a_00020,"You already realize that you only talk about taxes, forbidden etc.? Beautiful world in which you live.",1,1,0,0,0,0
deu_train_track_a_00021,except against Gladbach,0,0,0,0,1,0
deu_train_track_a_00022,I can show over 220 countries and territories on the world map (yes also all the funny little islands),0,0,0,1,0,0
deu_train_track_a_00023,"Best tweet on the subject. Not as a ""tragedy"" as from the -ähm- laity.",1,0,0,1,0,0
deu_train_track_a_00024,Can only join the tips. Just stay away from forums like Urbia for your own health. This does not do you much good to read there and it is often not helpful either.,0,0,1,0,0,0
deu_train_track_a_00025,"Very good, this is how a true and authentic statesman behaves!",0,0,0,1,0,0
deu_train_track_a_00026,"Tell me Tobi, you're sick all the time or have something? Did I notice that :D good improvement",0,0,0,1,0,0
deu_train_track_a_00027,"Remember, the highest compliment is now a 'not bad'!",0,0,0,0,0,0
deu_train_track_a_00028,"Very nice! :) unfortunately I poured mine in winter stupidly, apparently this prevents the formation of flowers.",0,0,0,1,1,0
deu_train_track_a_00029,"If you manage to count 1+1 together, you check that it is best for Germany, the environment, the climate, ministers come as quickly as possible from A to B, can move as much as possible in as many places in as short a time as possible, and then get back to home as quickly as possible.",0,0,0,0,0,0
deu_train_track_a_00030,Absolutely. And at the same time a bit crazy ;),0,0,0,1,0,0
deu_train_track_a_00031,Boy would be very wild,0,0,0,1,0,0
deu_train_track_a_00032,"If today is the end of the world, we all don't have to go to work tomorrow!",0,0,0,1,0,0
deu_train_track_a_00033,Thoughts that start bubbling like a volcano.,0,0,1,0,0,0
deu_train_track_a_00034,"As stupid and bland as it sounds: it will probably fix time. Probably you're talking about the feelings just because it doesn't work out. There's our psyche a little nasty. Breathe through and don't make it the forbidden fruit. If it's supposed to be, it will be. But maybe the world looks different in a week or two anyway. :)",0,0,0,0,0,0
deu_train_track_a_00035,"Wow. I was just like your girlfriend, a few years ago. Sick jealousy is super toxic, very bad for yourself and, of course, the partner. I'm sorry for both of you and I wish you guys if you love that the relationship doesn't break. But she has to work on it. Try to make her realize somehow that it doesn't go on like this. Maybe she realizes that she needs help, a therapy maybe. Tell her quite honestly how you feel about it and that it destroys you and your love for her. And if nothing changes, then you can only look for the vastness.",0,1,0,0,1,0
deu_train_track_a_00036,"So far, however, this ‘massacre involvement' is (for the first time) only a suspicion based on Israeli information. Btw., what has Israel been doing in the Gaza Strip for three months, other than a genocidal massacre?",1,1,0,0,1,0
deu_train_track_a_00037,"Oddly enough, vaccination damage only affects unvaccinated people.",1,1,0,0,0,0
deu_train_track_a_00038,"If you block the fan in the overhead with a piece of chalk, it overheated and shut down within a very short time, then there was ten minutes of pause until two students organized a new one from the caretaker. And then again from the beginning.",0,0,0,1,0,0
deu_train_track_a_00039,Is it getting scary to them? Do they turn around on the street again and again?,0,0,1,0,0,0
deu_train_track_a_00040,"#Berlin - 19:27 There was just an arrest, according to eyewitnesses it was probably about cannabis. #b0509",0,0,0,0,0,0
deu_train_track_a_00041,"Thanks for your post, OP. Do you want to post it on /r/depression_en/? Maybe you can also tell us a little more about your situation? :)",0,0,0,1,0,0
deu_train_track_a_00042,Thus the church is officially for the AfD left greenwashed,0,1,0,0,0,0
deu_train_track_a_00043,"You have to be quite ""irradiated"" to question people's climate change. Do you really think 195 countries in the world would have ratified the Paris agreement if the #climate change were pure invention?",1,1,0,0,0,0
deu_train_track_a_00044,I wish I'd ever been so good at costumed...,0,0,0,0,1,0
deu_train_track_a_00045,Because he gets more on the hut and can thus unpack more parades?,0,0,0,0,0,0
deu_train_track_a_00046,"I have the impression that a right-wing head of state is proposing unclean solutions!!! The Palestinians need a state of their own, in which they all have rights, as well as the Jews.",1,1,0,0,0,0
deu_train_track_a_00047,No. 4: Full of plants as visual protection and because it is beautiful.,0,0,0,1,0,0
deu_train_track_a_00048,It's always the fenerlis who cheat,1,1,0,0,0,0
deu_train_track_a_00049,"Someday I'll find out how it works with links and lyrics and so on... Anyway, I've stumbled through a friend on this channel and the show and found it interesting. The show, not the girlfriend... I find it interesting, but it's late, I've got... and I'm laughing again. Anyway, such a series and the format is quite pleasant and somehow informal, and so maybe you can make the question a little easier for other people as well.",0,0,0,1,0,0
deu_train_track_a_00050,The way some people talk about minorities is just disgusting.,0,1,0,0,0,0
deu_train_track_a_00051,* Is it really the country of courtesy? Especially with strangers? * The food culture I find fascinating. What is your favorite food? * How expensive is normal life in Japan compared to DE?,0,0,0,0,0,0
deu_train_track_a_00052,Beautiful horny snail,0,0,0,1,0,0
deu_train_track_a_00053,They are starving :(,0,0,0,0,1,0
deu_train_track_a_00054,"You're on trial, a disgrace to the whole of Bavaria.",1,1,0,0,0,0
deu_train_track_a_00055,"Right in front of Corona, I had more of an interest than having 21 bouncing castles made out of real business will, and then stored up, because the Corona measures did not allow anything. Since the setting up of bouncing castles is allowed again, we have steadily increased and are now the largest in the federal state.",0,0,0,1,0,0
deu_train_track_a_00056,"My goodness, they're also about to go mad.",0,1,0,0,1,0
deu_train_track_a_00057,"I'm not sure if I'm going to work for the war equipment clearance service, are they all coming from the Military EOD into the field?",0,0,0,0,0,0
deu_train_track_a_00058,"I came across this subreddit and saw a lot of creative and interesting stories here. But when I was little I always heard three four that I heard again and again, but can remember little of it, except that I (then) got really scared. Do you know any stories that everyone knew in the early 2000s? Also like only keywords so I can google or links to the original ones",0,0,0,0,0,0
deu_train_track_a_00059,"According to Dr. #Drosten, there is no seasonality at all?",0,0,0,0,0,1
deu_train_track_a_00060,Maybe your sleep is not relaxing enough. You can have your sleep phases checked in the sleep lab. Xywav is a quite new sleeping medication that you can take permanently. Some people snore and wake up unconsciously several times during the night due to shortness of breath. Then a CPAP or surgery can help.,0,0,0,0,0,0
deu_train_track_a_00061,"When Russia is bombed and 17 people are ""harmed"" there, the Tagesschau screams out loud. When Israel slaughters 30,000 people in 100 days, it is silently watched. One could start to wonder why it is so.",1,1,0,0,0,0
deu_train_track_a_00062,"Of course, the problem we get from this is the long waiting times with specialists. But still better than being in debt for the rest of our lives.",0,0,0,0,1,0
deu_train_track_a_00063,"I can sit in the sun by the river for hours in the summer and just look stupid in front of me. Most people find it pretty boring, I don't.",0,0,0,1,0,0
deu_train_track_a_00064,I hope the government hears your and the other hundred thousand-fold voices on the streets and finally does something against right. LG LW,0,0,1,0,0,0
deu_train_track_a_00065,is not bad at last you are no longer an old man happy Christmas to you and the Santa Claus!!,0,0,0,1,0,0
deu_train_track_a_00066,Where are all the demos against left-wing extremism or religious extremism? Isn't that true? Or is it just kept quiet every day? Why aren't there any demos against EVERY form of extremism? Should you ask yourself every time?,1,0,0,0,0,1
deu_train_track_a_00067,A teacher walked drunk in his underwear in the hallway at night to complain about the student's noise.,0,0,0,1,0,1
deu_train_track_a_00068,I think you did everything right. I'm proud of you :),0,0,0,1,0,0
deu_train_track_a_00069,Thanks for the AmA. Which people do you belong to? Shiit or Sunnit? What could unite the Afghan tribes and religions and thus become the basis of a stable state in the future?,0,0,0,0,0,0
deu_train_track_a_00070,Do you sometimes spontaneously sit on the train for fun and go somewhere without a fixed destination?,0,0,0,0,0,0
deu_train_track_a_00071,"I knew immediately that you were the same woman who had already asked for her husband's overcrowded friends. You are in a very, very toxic relationship and the whole environment looks away or supports your husband's behavior. I don't know you, but I'm beginning to really worry about you. Nobody is advised to break up on the basis of two reddit posts, but please think about all your options. Based on the two posts, it looks like your husband is shamelessly taking advantage of you and betraying you and you deserve so much more than that!",0,1,1,0,1,0
deu_train_track_a_00072,"Listen to the podcast of The Linguist, who has very helpful tips! I haven't heard the episode here yet, but I've saved it because I'm thinking about something like that. Maybe this will help you! but there are a lot of other interesting episodes.",0,0,0,1,0,0
deu_train_track_a_00073,"The deep problem is your attitude in the head. If your brain immediately decides between 'heritable' or not, although subconsciously, means that you already intend to find and date someone in your head and always have someone new. Were you emotionally dependent on your last relationship? You might be looking for a replacement. You have to work on it yourself.",0,0,0,0,0,0
deu_train_track_a_00074,"As soon as you have symptoms, the HCG is usually so high that you get a positive test. In my opinion, everything else is imaginable. PMS can feel very much after the first signs of pregnancy. Whenever I was sure during the cycle that I was pregnant, it was only PMS in retrospect and in the positive tests I had before I had 0.0 symptoms. :)",0,0,0,0,0,0
deu_train_track_a_00075,"If 20,000 thinkers really believe that we live in fascism or in a dictatorship (as they claim) - there would be no 20,000 thinkers anymore. Greetings from Kim from Pyongyang I really don't understand people anymore....",1,1,0,0,0,1
deu_train_track_a_00076,"Germany loves the #Berlinale: From the high horse we can arrogantly and self-righteously teach the whole world that our fragile German ego is the true victim here, and do not have to arrange ourselves with the annoying fact that we are accomplices at the genocide in #Gaza.",1,1,0,0,1,0
deu_train_track_a_00077,"Yes, I also had a patient who has covid pneumonia. The lungs look ugly. And when asked why he doesn't get vaccinated before. He thinks the future consequences are bad. I'm usually very nice to my patients and just listen, but I had to ask him what the consequences of his scarred lungs should be. Like a joke!",1,1,0,0,1,0
deu_train_track_a_00078,"<3 Thank you for the hope! My grandma wants to learn too. But go slowly. She doesn't even have a computer and doesn't understand the Internet at all, so it would be really nice if she could at least use it with her cell phone. I'm also proud of your grandma!",0,0,0,1,0,0
deu_train_track_a_00079,Is the head already deformed? Unattended (while sleeping...) I would only lay the child on the back and without towels. For day naps you can also put it on the side. An alternative would be to let it sleep during the day in the wearer.,0,0,0,0,0,0
deu_train_track_a_00080,"It doesn't just seem insanely overcrowded, it's insanely overcrowded. Heaven, it was on your closets, and it's on those where you put condoms and vibrators, and it's not even embarrassing! If she'd moaned over dusty radiators and dirty windows now - OK, rude, but whatever. But your personal stuff in closed closets doesn't touch them. Please yell at them as she deserves, take the key away and explain that you don't want to sit under the Christmas tree with such people. That requires a very big apology, and real insight before you can get back to it.",1,1,0,0,0,0
deu_train_track_a_00081,"I know only too well. I'm curious which tips come here. ""Witty"" I also find that because of your profession you have a certain expertise in your department, but the people at the table are more interested in the half-knowledge of the others and then you have trouble to clarify some things. Then you are constantly interrupted.",0,1,0,0,0,0
deu_train_track_a_00082,Boah crave honestly making out with jmd so bad,0,0,0,0,1,0
deu_train_track_a_00083,Do you like your new eye color? I would find it cool ;),0,0,0,1,0,0
deu_train_track_a_00084,I can also anger without money.,1,0,0,0,0,0
deu_train_track_a_00085,"Every day many people die of Corona. But it is a very different feeling if it is from their own ranks. A much colder one. A few days ago in quarantine because of positive results, last night then intensive care unit and shortly afterwards the end. I only experienced it a few hours ago and still don't really understand it. Put on your mask. Thank you. Edit: Thank you for your condolences. It still feels unrealistic to see him no longer at family celebrations - if they should take place sometime -.",0,0,0,0,1,0
deu_train_track_a_00086,It is time for these moerder gangs to take power and impose sanctions on Israel.,1,1,0,0,0,0
deu_train_track_a_00087,thank you on for the note!,0,0,0,1,0,0
deu_train_track_a_00088,Just like in former times under communist rule.,0,0,0,0,0,0
deu_train_track_a_00089,Thank you for your AMA! What do you study? How many languages do you speak?,0,0,0,0,0,0
deu_train_track_a_00090,"I would wait. You always have to be confident and take the best, but in the case of cases, I would hate to have to tell something personal.",0,0,1,0,0,0
deu_train_track_a_00091,"You must urgently seek help for him , quickly by all means , it sounds like an incipient psychosis",0,0,1,0,0,0
deu_train_track_a_00092,Maybe get a legal check to see if it's enough for stalking.,0,0,0,0,0,0
deu_train_track_a_00093,We sint proud of you,0,0,0,1,0,0
deu_train_track_a_00094,I'd report the school management to the school office and take my child from school.,1,1,1,0,0,0
deu_train_track_a_00095,"We (m/f, both at the end of 20) meet regularly with other couples for sex and also like to go to private swinger parties, orgies and in frivolous bars. Ask everything! :)",0,0,0,1,0,0
deu_train_track_a_00096,"But please build right, from local wood, and no tree should be cut down for an insect hotel, otherwise paradoxical.",0,0,0,0,0,0
deu_train_track_a_00097,How sad and true....,0,0,0,0,1,0
deu_train_track_a_00098,"Would you like tiles on the oblique one after the other, child splashing with water...?",0,0,0,0,0,0
deu_train_track_a_00099,I'm proud of my fellow human beings,0,0,0,1,0,0
deu_train_track_a_00100,"You don't want to rent the Stadthalle for a #citizen dialogue to an unpopular party. What do the ""#Democrats"" think about wanting to do with it?",1,1,0,0,0,0
deu_train_track_a_00101,"Thank you! Keep going and hold your own line, even if there are people who think it's wrong!",0,0,0,1,0,0
deu_train_track_a_00102,"Tea is not recommended? I don't know at all. I constantly drink tea (in moderation). Otherwise, I find it great to prepare dinner if it is not allowed to do much. Soup in a glass, hot chocolate or muffins that can be made in a cup (same made or at DM), self-cooked food, snacks. For child and mom: you don't know what they already have, of course, but I think - picture books - puzzles age-appropriate - Tonie for Tonie's box, if available",0,0,0,1,0,1
deu_train_track_a_00103,"Paternity recognition doesn't mean custody, that's an independent explanation, but it's done at the same date. If that's not discussed, maybe call again that this is being prepared with",0,0,0,0,0,0
deu_train_track_a_00104,"My big sister moved out at the age of 17 to start her education in a big city. My mother kept the child's allowance during these 3 years on the grounds: ""You were allowed to stay with us free of charge."" \ Unfortunately, she didn't know anything about a diversion request. I didn't at the time either, was only 11. As far as I was concerned, an example: I was forbidden to shower and we bathed every 2 times a week. One after the other, in the same water.",0,0,0,0,1,0
deu_train_track_a_00105,Krass! I didn't know that [The xx]( took the election. The USA is truly the country of surprises.,0,0,0,0,0,1
deu_train_track_a_00106,I'm so angry right now..,1,0,0,0,0,0
deu_train_track_a_00107,Protecting climate is not difficult - public transport!,0,0,0,1,0,0
deu_train_track_a_00108,You mean the two words in the last sentence?,0,0,0,0,0,0
deu_train_track_a_00109,"Hey, please don't let your head down :) I don't think it's easy for anyone. And when you get into a difficult situation, you quickly feel lost or hopeless. I also felt really bad for the last few weeks. I was relatively fresh after a long relationship, had to move back to my parents (not the best mood at home) and couldn't really distract me because of corona. What helped me was regular sports. And just as regular phone calls with friends schedule and go through, no matter how the day was or the mood is. Structure helps me through this weird time. Maybe you too. And if you need someone to write, let me know.",0,0,0,1,1,0
deu_train_track_a_00110,Where can locals be deported?,1,1,0,0,0,0
deu_train_track_a_00111,Think he was dissatisfied with his salary in front of everyone,0,0,0,0,0,0
deu_train_track_a_00112,"Yeah, maybe it is, maybe it isn't.",0,0,0,0,0,0
deu_train_track_a_00113,"Moin, I'm going to be a father for the first time and I have a question about ultrasound appointments. Did you take a vacation for it every time or how did you do it? How often is it during pregnancy? Thank you for your help.",0,0,0,0,0,0
deu_train_track_a_00114,"Looks familiar to me, I might have been here when I was a kid.",0,0,0,1,0,0
deu_train_track_a_00115,"I find the dialogue interesting, but a slight revision might end up giving the suicide (suicide?) more plausibility. I find a sudden auto-defestration personally nice. Plus point for it. The allusion to Einstein is well, too simple. The deluge, which was supposed to have actually happened at the time, was a continental flood, which was not caused by rainfalls. Overall I grade your text with 3 minus.",0,1,0,0,0,0
deu_train_track_a_00116,There's the wrong one being punished,1,0,0,0,0,0
deu_train_track_a_00117,"I want to run/survive the Berlin Marathon in September (I don't care about time) but I have no idea how to prepare myself. I am then 30 years old, play football (so also relatively much, but just completely ""different"") and generally sporty. What tips for the preparation can you give me? How long should I train before?",0,0,0,0,0,0
deu_train_track_a_00118,"Höcke represents fascist positions, his right to vote is denied. Of course, this does not solve the underlying problem of division in our society, but nothing to do with this symptom is as easy to wait for as with 42 °C fever",1,1,1,0,0,0
deu_train_track_a_00119,I used to work with one of them for a job. His sheep have always been so badly lit hooves that had to be cut on what was unbelievably stunk. Is that normal or was he just a bad shepherd?,0,1,0,0,0,0
deu_train_track_a_00120,That's not bad with because streams let your voice rest for now and I hope you'll be okay soon,0,0,0,0,0,0
deu_train_track_a_00121,I am in the power of the Ro Mr Rein Igers,0,0,1,0,0,0
deu_train_track_a_00122,"These are works that no one really perceives but if the lighting was missing on a resting place, everyone would complain directly. Nice to see that. Next time on the resting place I think of the Brudi of reddit, who changes the pears so beautifully.",0,0,0,1,0,0
deu_train_track_a_00123,What exactly does that mean and how can such a thing be avoided?,0,0,0,0,0,0
deu_train_track_a_00124,"we also had today, so at home, at work was electricity all day there",0,0,0,0,0,0
deu_train_track_a_00125,"VÖLKERMORD by ISRAEL , cheered by purchased left radical German PROPAGANDAUNTERNEHMEN.",1,0,0,0,0,0
deu_train_track_a_00126,"Yes just , the state is only ruined it lives itself invoiced . High the cups as long as the chapel still plays",1,1,1,0,0,0
deu_train_track_a_00127,"Greetings. A couple of weeks ago, a policeman shot three times at a fleeing vehicle in the area. The car had probably accelerated before and was heading straight towards the official. According to my knowledge, the colleague could take a vacation for every bullet a week to write ect. Is that really so bad with the writing stuff at such a thing?",0,0,0,0,0,0
