id,text,Anger,Disgust,Fear,Joy,Sadness,Surprise
deu_train_track_a_01331,"Good step, don't let hate subdue you.",0,0,0,1,0,0
deu_train_track_a_01332,You're not too stupid for anything.,0,1,0,0,1,0
deu_train_track_a_01333,"This is how propagandist weakness goes, which is supposed to maneuver the realities into an ideologically irradiated parallel universe.",1,1,0,0,0,0
deu_train_track_a_01334,"If you choose AFD, you didn't pay attention at school!",1,1,0,0,0,0
deu_train_track_a_01335,Just the same thing happened to my two brothers. Old acquaintances report and want to sell something at once. Classic,0,1,0,0,1,0
deu_train_track_a_01336,My parents gave me a car.,0,0,0,1,0,1
deu_train_track_a_01337,"Extinction Rebellion has regularly tried other protests in front of the climate glues, for example blocking private jets, no one has reported about it. FFF still exists, no one reports about it. I find the climate glue cumbersome, but protest is there to generate attention and if it is not otherwise possible this is a logical action in itself to get attention for these topics, as other forms of protest are no longer perceived.",0,0,0,0,0,0
deu_train_track_a_01338,Moin Du Banger!,0,0,0,1,0,0
deu_train_track_a_01339,"Have a small condominium in Berlin, I also live in it myself. At the beginning of November I hired my apartment via ""Accommodation Ukraine"" and within a few days a contact was arranged. Now they are here for four days and I thought maybe someone is interested, or someone is curious how it works! Ama?",0,0,0,1,0,0
deu_train_track_a_01340,I'm a woman and I'm also looking at women. And men. Just like that. Your girlfriend seems to have big problems with herself. It seems to me that she's looking out for where you're looking. Of course you shouldn't look at women but you don't say you do. Maybe she should ask herself why she's so jealous.,0,1,0,0,0,0
deu_train_track_a_01341,"We also pay the other perpetrators directly, as if everything that is sent to Gaza were not going to Hamas.",1,1,0,0,0,0
deu_train_track_a_01342,"The concern for the unvaccinated was justified. Today we know that the general risk of dying, of getting the risk of Long-Covid and falling for right and Russian lie propaganda was considerably higher for the unvaccinated than for the vaccinated. Bhakdi has fooled you.",1,1,1,0,0,0
deu_train_track_a_01343,Aiwanger himself is covered with a campaign by the Süddeutsche Zeitung and is now falling for the campaign of Correctiv. He thought he was politically clever.,1,0,0,0,1,1
deu_train_track_a_01344,So making money available for the episodes while you're still part of the cause? Okay cool,1,1,0,0,0,0
deu_train_track_a_01345,"ask if you can have in-ear headphones if yes, pick up some plug them in and make loud classical music.",0,0,0,0,0,0
deu_train_track_a_01346,"""Leading Climate Scientist"" was good. So they only refer to the alternative news/satire pages. Funny like all the facts twisters again and again post the same fake BS. If you don't believe facts and scientific articles, then you simply invent your own reality. This makes the said/written/shown but not directly true",1,1,0,0,1,0
deu_train_track_a_01347,Since 9 months no more on jaxxen therefore give free ride sham Cousenq,0,0,0,0,0,0
deu_train_track_a_01348,"Ahoi. I took part in a 12 day expedition cruise to Antarctica as a passenger. Definition: Expedition cruises can be seen cruises with mostly smaller special ships, which allow travel routes away from the usual travel areas. Expedition cruises have many other important characteristics, which are not valued in this view. Often they are seen as a mixed form between cruise and study trip and thereby open up regions, which have not yet been opened up by mass tourism. Maybe it is interested one or the other here, since it is not necessarily an everyday trip. Please look forward to your questions :)",0,0,0,1,0,0
deu_train_track_a_01349,"It doesn't matter if the subreddit can separate sex and love. You know, it's a no-go for you.",0,1,0,0,0,0
deu_train_track_a_01350,"Maybe you would like to volunteer for Christmas somewhere? In the shelter, homeless home, etc.? You wouldn't be alone and would do something good at the same time. Or you could start a call somewhere - maybe there are communities for it - for people who are feeling like you. On Christmas days cafés and restaurants have usually opened up. I keep my fingers crossed that you can find a good solution for yourself!",0,0,0,0,0,0
deu_train_track_a_01351,"Have you ever tried hobbies online, where you simply socialized and not date on convulsions? Just mixed things are nice to talk to others about without having to make more of it.",0,0,0,0,0,0
deu_train_track_a_01352,"Are there any coaching groups for theses or procastination at your university? Mostly the psychological counseling offers something like this. Whether people can help you further is perhaps also worth an attempt. Generally, a bit pay attention to you and consciously plan a few dates outside of the thesis per week to somehow stay on your feet. Even if such a depressed brain usually titulates something ridiculous or as a waste of time. Otherwise only the tip: if it gets scarcely early enough to get a doctor and sickle writing, such a thesis can almost always be ""long"" before one hangs completely in the hole at some point. Keep your fingers crossed for the search!",0,0,0,0,0,0
deu_train_track_a_01353,"Honestly, there are people who are triggered by it when people put on Nike shoes with Adidas socks and generally combined the two.",0,1,0,0,0,1
deu_train_track_a_01354,"I have two cats myself and I could never imagine leaving them somewhere. My cousin left her two cats with an ex-boyfriend at the time, but that was at least all well discussed. I think it would be nicer for the rentze to be with you, of course, than in the shelter but you shouldn't just be forced to do it from a bad conscience. wish you would live well together or maybe you'd find a nice home for her. PS Would also be happy about a picture if you recovered from the shock.",0,0,1,0,1,0
deu_train_track_a_01355,Don't you think your flags in the profile say anything?,0,1,0,0,0,0
deu_train_track_a_01356,Why criticism: Doesn't the idea that she is protesting against genocide prevail here?,1,0,0,0,0,1
deu_train_track_a_01357,Why do historical documents violate Adolf Hitler's right to his own image every day? I find it so reckless as a strict liberal!!!,1,1,0,0,0,0
deu_train_track_a_01358,"German Wikipedia can unfortunately be knocked into the ton due to the moderators/admins and powerusers. The relevance rule is interpreted in about this way, ""if the admin doesn't know it, then it can only be irrelevant"".",1,1,0,0,1,0
deu_train_track_a_01359,"Unfortunately, many people generally lack empathy and empathy for other people, animals but also for themselves. But they have not chosen to live such a life, just as you have not chosen your life voluntarily with all its difficulties and problems.",0,0,0,0,1,0
deu_train_track_a_01360,"I'm with you, the problem is the big bonus from gold to paper gold, something's wrong.",0,0,0,0,0,0
deu_train_track_a_01361,Every voice for the AfD is a farewell to humanity...,1,1,0,0,1,0
deu_train_track_a_01362,"Only the best thing for your future! I hope the conversation runs off reasonably well. If not, you can always pull the rice line and disappear from home again. Like everyone else, I give you the tip: Don't move back home. Your parents still have a lot to learn.",0,0,0,0,0,0
deu_train_track_a_01363,"Energy will never be cheaper again, as the state needs every cent to be able to squander billions around the world",1,1,0,0,0,0
deu_train_track_a_01364,"Napoleon was not small at all. This was popularized by the English propaganda, which Napoleon always presented in its caricatures as extremely small. In fact, Napoleon had reached an average height of about 1.68 m for men of his time. [Napoleon Bonaparte on Wikipedia](",0,0,0,0,0,0
deu_train_track_a_01365,Cats are also the coolest creatures in our spiral arm of the Milky Way.,0,0,0,1,0,0
deu_train_track_a_01366,"I have a hard question, you don't have to answer. How do you perceive the quality of your daughter's life? Would you give/mutually give her this life again if you had the choice?",0,0,0,0,1,0
deu_train_track_a_01367,That's nice for you!,0,0,0,1,0,0
deu_train_track_a_01368,This is only a cover-up to disarm the appeals of war and Is.rael is allowed to continue the genocide. I lack the words,1,1,0,0,1,0
deu_train_track_a_01369,"That after death something still comes that you can realize is bullshit that has been invented by people over the years to either have something tangible so that you don't get mad or make others docile. It will be like before your birth, everything else doesn't make any sense.",1,1,0,0,0,0
deu_train_track_a_01370,"What kind of documentaries were they? I think this can certainly be a means, but not every person who cries uses it with this motivation for his own benefit.",0,0,0,0,0,0
deu_train_track_a_01371,"When you graduate from high school, you're not worth anything, everything you do here has no value. If you don't get along with the stuff here, you don't have to think about family and car at all.",0,0,0,0,1,0
deu_train_track_a_01372,"Go in, count, go out, go in, go back in, go back in, go back in, go back in, go back to the police and report yourself, because you weren't allowed to go to the store.",1,0,0,0,0,0
deu_train_track_a_01373,"Pffftt... My husband says the same thing. I have a small list (no serious!) with nice names and wanted to look at it with him. No, it's too early. Two weeks later, still too early. Hmpf. I don't want to agree on a name now, I just want to discuss a bit in which direction. Classical? Modern? A family name? I have no idea what names he thinks ""beautiful"" and will like to know. But no. I'm not mad... You're sour... Hormones...",1,0,0,0,0,0
deu_train_track_a_01374,"In recent weeks, Israel's hatred of Gaza has only increased. Instead of bringing all the moderate forces among the Gaza Strip's inhabitants into the boat after the Hamas massacre and finding a solution to Hamas together, Israel has only made new future Hamas fighters with this war.",1,1,0,0,1,0
deu_train_track_a_01375,The people responsible for interfering in the Ukraine war must step back immediately!!!!!You damned learned nothing from the last two world wars,1,1,1,0,0,0
deu_train_track_a_01376,"I would like to work in German cannabis medicine. I study biology, and this is my second semester with German learning. I love plant biology! My university degree is almost finished.",0,0,0,1,0,0
deu_train_track_a_01377,"After two hospital stays and intensive outpatient therapy, I would like to know again how life feels without medication. I am currently set to 225mg of venlafaxine plus 50mg of trazodone to sleep. You can hear so many horror stories about stopping venlafaxine, what are your experiences?",0,0,1,0,0,0
deu_train_track_a_01378,"Hi you loved ones I've been suffering from depression for a year now and in the last few weeks I have always had the problem that I'm hungry, but I don't want to prepare food or ideas. I'm looking at many recipes and just think that it's too much work for me. In addition, it's about 30 degrees for us at the moment. Maybe you have ideas/recipes for me, not only cold, but also cooked things. I'd be happy about your answers. Lg Lara",0,0,0,0,1,0
deu_train_track_a_01379,"I have certainly done the anesthesia 100 times already. Is a short procedure (about 10 minutes) and usually always under general anesthesia, i.e. you get nothing with it.",0,0,0,0,0,0
deu_train_track_a_01380,Don't worry about the Third World War. How about peace?,0,0,1,0,0,0
deu_train_track_a_01381,"Do you intend to do what your family does later? If so, do you really enjoy it?",0,0,0,0,0,0
deu_train_track_a_01382,"In the case of the Hanni, I have to wrestle very much in the case of the inner hussy......",0,0,0,0,0,0
deu_train_track_a_01383,"If Ukraine loses, the Russian is in front of Poland, then NATO must intervene, D is at war, too. It is that simple.",0,0,1,0,0,0
deu_train_track_a_01384,"I think it's funny that from your mother's point of view, you can't decide how much you're talking to your father.",1,0,0,0,0,1
deu_train_track_a_01385,It is only the bombs that make Israel flatten the strip and now do it on Samaritans. The double morale of the USA is boundless,1,1,0,0,0,0
deu_train_track_a_01386,"Does no one have any doubts about what happens when the relationship fails? After all, you are still connected via your parents and they can hardly stand on the side of their own child without getting problems with the relationship themselves. Are you worried that your own parent is also on the side of the other?",0,0,1,0,0,0
deu_train_track_a_01387,"And they have a bubble. Sometimes it's full of fresh air, sometimes full of nasty viruses.",0,1,0,0,0,0
deu_train_track_a_01388,"When democrats take to the streets, it becomes uncomfortable for the right - and that's a good thing!",0,0,0,1,0,0
deu_train_track_a_01389,"Hamas would only have to admit its defeat, put down its weapons and surrender completely, and already the suffering of the civilian population could be actively alleviated internationally. But as long as Hamas continues its hopeless war and hides behind children and the sick, it is solely to blame for the situation in Gaza.",1,1,0,0,1,0
deu_train_track_a_01390,Unfortunately too often. Fast metabolism partly drives 3 to 4x on the tach :D,0,0,0,0,1,0
deu_train_track_a_01391,"If the political views of the person are more important than our relationship based on love, respect and respect - no.",0,0,0,0,0,0
deu_train_track_a_01392,"Honestly meant tip: accept it simply. Your child is 7 weeks old - that needs the proximity and safety easy. Babies are tragedies. My daughter (between 9 months) could only rarely be laid off - it was exhausting and I would have liked to have a bit of ""free space"", but I always knew: I have to get through. This little creature came almost straight out of the warm belly - did not know feelings and sensations like hunger and cold. Besides, they have to process so many impressions. Therefore, I find that acceptance is simply the best. There are also other times and they come super fast.",0,0,0,0,0,0
deu_train_track_a_01393,"As long as the manufacturer's guarantee for compensation in case of vaccination damage is rejected, NO vaccination!",1,1,0,0,0,0
deu_train_track_a_01394,"Why is there so little talk about the fact that the #UNRWA's work is very dangerous, so dangerous that more than 150 employees have already been killed trying to organize humanitarian aid for the desperate population in #Gaza?",1,1,0,0,1,0
deu_train_track_a_01395,"On the one hand, good that one supports these countries on the other hand, one should prefer instead of the symptoms of climate change to work on the cause to lay off so #stopfossilfuels unfortunately, however, the chairman of the summit of one of the largest oil companies in the world has hardly believed that they have a high interest in attacking their own business model",1,1,0,0,1,0
deu_train_track_a_01396,I'm currently in the 31st SSW with the 2nd boy and we haven't found a name yet,0,0,0,0,0,0
deu_train_track_a_01397,"Imagine that problem must have bothered him so many times that he eventually thought, ""Now I'm going to print out a note"": Maybe only someone normal Physically who doesn't have a peek on Gabis who always has to park him.",0,1,0,0,0,0
deu_train_track_a_01398,Cool idea! - what was the mood like? - could you just chat normally or did most interactions have a sexual/erotic touch? - prices for drinks appropriate? - was the party in a larger city? - what did you like good/bad? Would you go back? - how did you notice the party?,0,0,0,0,0,0
deu_train_track_a_01399,Again and again funny as is distracted by the core problem of our incapacitated traffic light and suddenly our biggest problem in Germany is the fight against the AfD and the media poke this whole madness even daily.,1,1,0,0,0,0
deu_train_track_a_01400,Look at my latest tweets I've clarified among one other tweet me a cell with melly,0,0,0,1,0,0
deu_train_track_a_01401,Germany will suffer for a long time from the drastic consequences of long traffic lights.,0,1,1,0,1,0
deu_train_track_a_01402,"""The earth burns down"" If the stupid chatter stops then I shall be right ....",1,1,0,0,0,0
deu_train_track_a_01403,with me all the lures are curling :/,0,0,0,0,1,0
deu_train_track_a_01404,"First of all, my deepest condolences. No one deserves that and it's incredibly disgusting to be used like that, I know the feeling. As someone else has said here, there are men who have almost no virgin kink. They behave like the greatest men in the world and tell you everything you want to hear until they reach their goal. After that they are looking for a new one. Whether this is the case can't be said. However, in my opinion, probably with the behavior.",1,1,0,0,1,0
deu_train_track_a_01405,Every normal thinker already knows that the #propaganda against the @<username> is only a struggle against the loss of power before his own people. #nurnochafd,1,1,0,0,0,0
deu_train_track_a_01406,"How much easier is muscle building with it? I know that this is probably very difficult to quantify and always depends on the individual/training plan, but maybe you can give some assessment here?",0,0,0,0,0,0
deu_train_track_a_01407,"I also find it kind of strange that you go after the total number and don't take the percentage change, i.e. the relationship between total tests and the resulting new infections. Maybe someone can also tell me why that would be a stupid idea.",0,0,0,0,0,1
deu_train_track_a_01408,You may simply choose the wrong woman for a relationship. Make your point of view clear from the beginning and that you are not ready to give up your life for them. You should look for a similarly active woman who also needs a lot of time for hobbies.,0,0,0,0,0,0
deu_train_track_a_01409,"Joa, is already in the headline. I had a real heart attack as a woman at the age of 28. Since many people are interested in this topic with regard to their own symptoms, I thought I would offer myself!",0,0,0,0,0,0
deu_train_track_a_01410,Our policy has managed to be more afraid of exclusion than of the disease itself.,0,1,0,0,0,0
deu_train_track_a_01411,Sorry but the special treatment for Ukrainians is over,0,1,0,1,0,0
deu_train_track_a_01412,"Since 2013 I have always felt lethargic and limp, no matter how much I sleep. The doctors don't find anything - blood values in order, no sleep apnea, hormones in order. The last guess always: ""Do you have stress? Are you perhaps depressed?"" No, I'm not really depressed anymore, but from 2011 to 2012 I had such a phase. Can such a thing affect you sustainably? Do you still feel years later that you have changed?",0,0,0,0,1,0
deu_train_track_a_01413,"President Zelensky is speaking to ex-US President Bush this week at an event in Texas, and I thought Zelensky was not talking to war criminals who attacked other countries. Bush is responsible for the deaths of millions of Iraqis.",1,1,0,0,0,0
deu_train_track_a_01414,"I think it's easy to do the trick. In the beginning, you have to overcome yourself a lot, maybe not last that long. But after a few days, you get used to it slowly and you can concentrate on it better. So anyway, my experience with this.",0,0,0,0,0,0
deu_train_track_a_01415,Yes exactly! First nice and warm in the hand. A handschmeichler ..... But very quickly cold ..... Politics just,0,1,0,1,0,0
deu_train_track_a_01416,It's really crazy how many young & middle-aged people are affected by #belt rose. And no one seems to want to recognize the causality between their outbreak & permanent covid infections. How long do we want to play this game anymore? #CovidIsTheReason,1,0,0,0,0,1
deu_train_track_a_01417,"Can you tell me how that happened with the ketamine therapy? Was that outpatient or inpatient and took over the health insurance? I feel like you, tried thousands of medications, but nothing really helps. I'm going to do my first electro spasm therapy in two weeks, maybe that would be something for you?",0,0,0,0,0,0
deu_train_track_a_01418,My gynaecologist always gave me an appointment within 2-3 days after a positive test. But every doctor does it differently,0,0,0,0,0,0
deu_train_track_a_01419,"That's NOT okay and you're NOT wrong!! Please don't listen to your disturbed friends. I find it very worrying that your friend doesn't take your illness seriously. That he even tells you that openly! If your relationship should still have a chance, you'll definitely have to talk to him. That's going to eat you up from the inside. Maybe an apology from him helps you. If he doesn't see what he's done to you anyways everything is lost. Then you could also think about an ad, yes. I think it's terrible. I'm very sorry!!!",1,1,1,0,1,0
deu_train_track_a_01420,"At the beginning of the 90s, on a pedaling thing like this, as a little boy in kindergarten, I knocked out a milk tooth... The sight makes me shudder",0,0,1,0,0,0
deu_train_track_a_01421,"These governments do not want ""the best"" for the German citizens! Only contempt and mockery and of course our money!",1,1,0,0,0,0
deu_train_track_a_01422,It's all about business interests. People don't matter.,0,1,0,0,1,0
deu_train_track_a_01423,Putin just has to stop the war.,1,0,1,0,0,0
deu_train_track_a_01424,"A colleague and I were about 14 years old when we both decided to go to the town hall, because there was such a cool elevator that is permanently in operation and does not stop. We jumped in and wanted to go up to the top. Relatively high up we noticed that no further floor is waiting for us, but darkness. At that moment we both looked at each other at the same time, with the same thought that we might be squeezed up somehow. It turned out, however, that the elevator wandered from right to left in the arch and so went down again. We laughed at one of them first.",0,0,0,1,0,0
deu_train_track_a_01425,"Mostly on the phone, but also inquiries via chat, mail, letter, fax, WhatsApp, Facebook, Twitter - actually about almost every conceivable medium. My main topics were network technology, mobile phone Internet and mobile phone defects. Do you want to know anything about this?",0,0,0,0,0,0
deu_train_track_a_01426,">And she doesn't want to be the tool to meet my needs. Well, you're also her tool to meet her needs... You go into relationships because you have a need for it... only there are different needs and she doesn't seem to have a big need for sex... I'd find it funny if you said next time she wants something ""No, I don't want to be the tool to meet your needs"" :D Sorry, but that's just such a nonsense...",0,1,0,0,0,0
deu_train_track_a_01427,"One of the stops was a collection point for dead wild animals (i.e. when animals are run over and collected from the road) and they had a... tank?! Or something where all the dead animals were collected inside and molded in front of them. That was so endlessly stunk and everywhere on the site was a brownish stinking broth on the ground which was basically a mixture of decaying animal, feces and blood.",0,1,0,0,0,0
deu_train_track_a_01428,The children in Gaza are absolutely starved and most of them will not make it to the few hospitals. Shame on you! #GazaGenocide #Gaza,1,1,0,0,1,0
deu_train_track_a_01429,"I don't think you've gotten used to being single, but you're just the kind of person who enjoys being alone! It's totally okay and no one should force themselves to live with someone else. Accordingly, it almost sounds like you and your friend are only partially compatible. Talk to him honestly about your fears of moving in together, otherwise this only endangers the relationship more.",0,0,0,0,0,0
deu_train_track_a_01430,Get support from people who know something like that: how bad your wife's life is. It's no reason to drag yourself down like that and the points you call yourself really things you don't do to a person. Especially the person you're with,0,0,0,0,1,0
deu_train_track_a_01431,Looking forward to it when the Olympic games begin soon. Hopefully Germany will do well.,0,0,0,1,0,0
deu_train_track_a_01432,"The most brutal crimes of world history are being committed in Gaza, and the American government bears the greatest responsibility for the Katharsis of the Palestinians. Mr. Joe Biden should be prosecuted for these crimes ...",1,1,0,0,1,0
deu_train_track_a_01433,"keep the last sentence as a thought in mind for the coming time. you are good as you are. and you will not be lonely because you always have yourself with you. unfortunately there is no medium, except time.. wish you all the best <3",0,0,0,1,0,0
deu_train_track_a_01434,"I've been working as a specialist in an acute psychiatry for a few years now, I'm just wondering what you're interested in :)",0,0,0,0,0,0
deu_train_track_a_01435,"Hi, what is the level of students from other countries (especially outside the EU) like USA, India, China etc? Often you hear that the students (because they have to pay for their studies) get their degree after and the German universities/schools are much more difficult and therefore our high school graduates or Bachelor/Master students are much better than comparable foreign students.",0,0,0,0,0,0
deu_train_track_a_01436,You're so fucking hot,0,0,0,1,0,0
deu_train_track_a_01437,There are thinkers and followers. That's always been the case. Corona only showed who we really are.,0,1,0,0,0,0
deu_train_track_a_01438,Well there are people with empathy in the country ! that is indeed a word which is completely foreign to you ! And these people with this empathy do not want the GAs of this mass murderer !,1,1,0,0,0,0
