id,text,Anger,Disgust,Fear,Joy,Sadness,Surprise
deu_train_track_a_00670,"How can one call the left-fascist GDR and even the present, inhumane and German hostile – racist system of the traffic lights only ""best and most stable democracy""? Completely brain-cracked!",1,1,0,0,0,0
deu_train_track_a_00671,I'm curious: What would you consider your saddest hobby? Be it because it's so rare and extraordinary and you have to indulge in leisure alone. Or because it's just pitiful.,0,0,0,0,1,0
deu_train_track_a_00672,Incredibly useless of shit,1,1,0,0,0,0
deu_train_track_a_00673,Healthy without vaccinating The where to vaccinate are themselves guilty of burning the brain,0,1,0,1,0,0
deu_train_track_a_00674,"Then rather 100 billion for the Bundeswehr wa, seems to be more important",1,0,0,0,0,0
deu_train_track_a_00675,Let the Russian troops out of Ukraine. There they have lost nothing!,1,1,0,0,0,0
deu_train_track_a_00676,"I agree with everything that /u/ConstsAndVars has written. But would also suggest you to take offers such as the [telephone pastoral care](. There are also other [help offers]( Just don't forget the most important thing: your feelings are valid and you never have to be ashamed of them! I think it's great that you want to talk about them and seek help. Even if you are not diagnosed with depression, it's right and important to take help. Because it's quite natural that you're going through phases of grief that overwhelm you. Small tip: don't try to ponder things. That's just always getting you into your grief. It helps me with meditation or mindfulness exercises.",0,0,0,1,1,0
deu_train_track_a_00677,"I cry regularly, even if I don't get it at excel ne formula lol Some people are just so that they react to stress or to generally certain stimuli with crying. Tears reduce stress hormones. I often feel better after that. So yes, I think it's normal. I could now create a best-of-tea list. Especially if you still have to fight with PMS as a woman.",0,0,0,1,1,0
deu_train_track_a_00678,"How can I imagine the rooms in such a home - each child owns a room? Group rooms? Group baths? In what group sizes does life run out? What is the typical routine of the day? Is the course ""once pure, until 18 stay in it"" typical or is there often more change in/out of it? For what did you envy ""house children"" (or what is it called?) where were they perhaps envious of you?",0,0,0,0,0,0
deu_train_track_a_00679,"""What was once thought cannot be thought back""~Faith, ""The Physicists"" by Dürrenmatt",0,0,0,0,0,0
deu_train_track_a_00680,Fashion decisions rarely have anything to do with rationality.,0,1,0,0,0,0
deu_train_track_a_00681,It is completely incomprehensible to me why the approval of the #AfD should decrease. What has changed in the fatal situation in Germany? What have the others put in order? Right: nothing. #That's whyAfD,0,1,0,0,0,0
deu_train_track_a_00682,The whole war is insane,1,1,1,0,1,0
deu_train_track_a_00683,"Just as Putin verbally shoots against the West, I wish it the other way around, only a sharper point! The West must finally set Putin - realistically enforceable - limits. Only that understands the dwarf!",1,1,0,0,0,0
deu_train_track_a_00684,My impression is that here in Germany there is a strange conception of anti-Semitism. Criticism of Israel and its politics is not anti-Semitism. Israel also has no Blancocheck for boundless violence.,1,1,0,0,0,1
deu_train_track_a_00685,"Find this legitimate in this case, that is something completely different than if you had had absolutely no reason to trust her. Here there was a very concrete reason or suspicion. (Instead of any vague fears)",0,0,0,0,0,0
deu_train_track_a_00686,"Sounds like your inner world just can't stand it anymore and runs out like a full touch on some corners and edges. Take your time and look/listen to your inside. What does it tell you? What thoughts, feelings, emotions do you have? What is your concern, stress, etc. at the moment? Most people take the mental world lightly, because they are afraid to seem weak. At the same time, the mental world is 1000 times stronger than the pysian world. Therefore, it is very important to take care of themselves and listen exactly to what it wants instead of running away from it.",0,0,1,0,1,0
deu_train_track_a_00687,"Now all adult supporters, especially the parents, are allowed to clap their hands enthusiastically: Hurrah! The CO2 tax comes.",1,0,0,1,0,0
deu_train_track_a_00688,"We can win with the #Ukraine or lose together with it. We are not on the way to victory. This is also because #Scholz goes a special way with Russia, he does not want to deliver #Taurus or the NATO membership of Ukraine @<username>",1,0,1,0,0,0
deu_train_track_a_00689,"May I suggest you all a Scotland or Ireland holiday? I moved 20 years ago and our summers are also drier and warmer than before but still very pleasant and relaxing, we rarely have more than 26 °. Beaches are very beautiful, on the west coast the water is preheated from the Gulf Stream. Hiking can also be fine, our mountains are not sooo high but nevertheless quite neat.",0,0,0,1,0,0
deu_train_track_a_00690,"This was a big turning point for me, but now my life looks completely different than it was a year ago. I'm studying at university and now I'm trying to get my life back on track UPD: thank you so much for the comments and support! I expected 2-3 comments 2. UPD: thank you all very much, you answered so many questions for which I couldn't find an answer yet!",0,0,0,1,0,0
deu_train_track_a_00691,What do you think you can do in schools to teach people media literacy so that they don't fall for the obvious fakes?,0,0,0,0,0,0
deu_train_track_a_00692,I think he's gonna check this out when you write that you thought it was nice and send your number.,0,0,0,0,0,0
deu_train_track_a_00693,Fermented out of the hut and done civic duty.Back to bed!,0,0,0,1,0,0
deu_train_track_a_00694,Irrenhaus Germany,1,1,0,0,0,0
deu_train_track_a_00695,"At a club closing party a friend got into a fight, in the end the whole group flew out with her all the house ban.... I had to laugh so much while we were escorted out.... To the question why this is funny.... Well closing party. That was the last night where this club was open ... so last.... Vll a few hours.",0,0,0,1,0,1
deu_train_track_a_00696,"I can do this eternal talk that the support of the Palestinians and the UNWRA for Hamas must be understood in the ""context"" and a ""narrative."" No, these are terrorists, fascists who want to wipe out Israel, kill Jews. The UN must organize help differently.",1,1,0,0,0,0
deu_train_track_a_00697,"I often remember that I had to go home because the family wanted to eat...? I come from Russia (I've been here since 2008 and no I think absolutely nothing of Putin and the catastrophic development of Russia), and then there was simply no such thing with us, when food is ready and there is a visit, be it friends of the child or not, they were even explicitly invited to eat. I found it rather rude at least.",0,1,0,0,0,0
deu_train_track_a_00698,"Yes, as the title suggests, I have been living on the street since May 1st, which severely restricts the life of me, my family and my relationship. I am happy to answer your questions! To answer the standard question ""Why?"" in advance, very briefly here without details: (you can ask after them :p) I lived in a home for 8 years and after some professional problems and 2 months of unemployment I was thrown out. I would like to mention that I am NOT lazy sitting around and not listening!!!!! I do not pack people who immediately think I would just lazy and get money pushed into my ass. I take care almost every day to improve my situation!!!!",1,0,0,0,1,0
deu_train_track_a_00699,"Typical problem in Germany, that you always misjudge with regard to the shift...",0,0,0,1,0,0
deu_train_track_a_00700,"Those who still believe in fairy tales are good at it A climate warming has happened before I don't need a nail polish from Loctide We are talking about intermediate ice age for those who have been missing in history and some glaciers are only 500 years old In the past you were happy about these mild winters, because heating was not so expensive",1,1,0,0,0,0
deu_train_track_a_00701,"Oh, my God, violence - no matter who it comes from - is a no go and a reason for separation. In your place, I would end the subject. BUT: your girlfriend seems to be one of the somewhat disturbed sorts, i.e. she may not accept the separation and become re-manageable, tell lies or verbally attack you and make you miserable with others. Since she is otherwise so nice and sweet nobody will believe you. Sorry for this prejudice, but your text lets it stick to her in this category. Look for witnesses, make screenshots of bad news that she may have sent.",0,1,1,0,0,0
deu_train_track_a_00702,"KREML-PUTIN destroys everything that is in his way, after that the USA rescues Ukraine and someone in Ruskieland has pity on Vladi, after that I have finished, a new Ukraine is built up and we weep like honoring all injured like fallen in the Kremlin Russia Ukraine war. Including Alexey Navalny.",1,0,0,0,1,0
deu_train_track_a_00703,"Is a party too much to try to get rid of, of course, quite democratically...",1,1,0,0,0,0
deu_train_track_a_00704,Israel has also committed crimes against UN conventions for many decades and is not punished for them!,1,0,0,0,0,0
deu_train_track_a_00705,once made me Asbach Cola but SO VIEL Asbach and n shot Cola,0,0,0,1,0,0
deu_train_track_a_00706,"Hedgehog like this: ""Yes, I eat your food. What are you going to do now, babe?""",0,0,0,1,0,0
deu_train_track_a_00707,"I had so strong heartburn that I sometimes really thought that I had a heart attack :D I liked Gaviscon, all from the drugstore hardly worked for me. However, it tastes relatively strong for peppermint, if that's not yours. Milk also sometimes worked quite well, but other home remedies unfortunately didn't work so well.",0,0,0,1,0,0
deu_train_track_a_00708,"[Sexual partners about smells is by the way such a body thing, because all people have their own smell and the more closely related people are together, the similar is this smell. This is a body-own incest protection.]( unfortunately have no direct source for this, but this protection serves the variety of immune system to create somewhere offspring with people who have a different immune system. However, I may be twisted somewhere. zl;ng: if it interests you: your stone-age brain tells you that Sarah is good for children. But only from the body, not how she behaves.",0,0,0,0,0,0
deu_train_track_a_00709,"in Münster there is a strict one-child policy...with the secondborn the Münsterans go out on the ice every year...In the country some things happen unexpectedly, for you townspeople",0,0,0,0,0,0
deu_train_track_a_00710,"Thank you for your contribution. On the subject of other people and relationships, I ask myself if they realize that you are not completely clean with yourself. That seems to me at least. Maybe there's something about the sentence that you must be able to love yourself before you can love another person.",0,0,0,0,0,0
deu_train_track_a_00711,The thought of a serious illness won't let me sleep at night.,0,0,1,0,0,0
deu_train_track_a_00712,"Too little, even in prison",1,0,0,0,0,0
deu_train_track_a_00713,He apologized that other people made mistakes and he didn't check it out. #nonpology,0,1,0,0,0,0
deu_train_track_a_00714,Years of oppression of the Palestinian people in their own country is the decisive point. Also reports about the dead toddlers in Gaza #double morale,1,1,0,0,0,0
deu_train_track_a_00715,Which makes the sanctions farce)... questions about questions and politics has no answers.,1,0,0,0,1,0
deu_train_track_a_00716,"These are terrorists! I buy myself a Pritt pen directly for self-protection. Do you need a police certificate in Bavaria? Is this possible with the small craft license? I would like to buy a second glue directly, but I have children in the house.",1,1,0,0,0,0
deu_train_track_a_00717,I just don't understand that suddenly such a Taurus horniness arises or has already arisen. Nobody thinks about what the use of these weapons can have for consequences.,0,1,1,0,0,1
deu_train_track_a_00718,"Don't let other dating apps talk so bad about you. Just download it, write a little bit with people and take those apps seriously, don't take them seriously. If you consider them what they are, it's funny: apps where you write with strangers. And as ""fies"" as it sounds at first, you don't have any obligations and you just can't write with people when you don't want (more) to write to the person. I've had the experience that when you take a relaxed approach to such apps, you also quickly meet people with whom you sympathize. I found my girlfriend as well.",0,0,0,1,0,0
deu_train_track_a_00719,"So first of all you have the most awesome hobby in the world. If there are videos somewhere, let me know :D Your friend is also an idiot. He probably can't accept your hobby. That he reacts to it with such immense anger doesn't make him look very good. Maybe one last time you can talk to him and tell him that this is part of the figure skating. But if he doesn't understand it and submits such things to you, I would separate myself in your place. You shouldn't let that happen to you!",1,1,0,1,0,0
deu_train_track_a_00720,Already customers had the unpleasant little clothes on when they opened the door?,0,1,0,0,0,0
deu_train_track_a_00721,"Climate bonus for asylum seekers is good feeding for refugees behind borders of Austria, which is dirty policy by politicians.",1,1,0,0,0,0
deu_train_track_a_00722,Why did you give 100 subs just for a fucking minecraft house? That's crazy for me!,1,0,0,0,0,1
deu_train_track_a_00723,"It is important that you keep one thing in mind, that you are not responsible for the happiness of others. Separations are never easy and it shows that you are thinking about it by looking for advice. But if you have made your decision, neither she nor you will be helped if you continue to maintain the relationship. If you still like them, offer her to be there if she needs help. This will give her some control over the situation. You will not take the pain away from her, but you will show her a welcome and respect.",0,0,0,0,0,0
deu_train_track_a_00724,"If that's what the security guy said, you might be able to figure out if you don't report it to the club. They should be responding to it. Ev. at least something changes in the club. But of course it's stress again...",0,1,0,0,0,0
deu_train_track_a_00725,Stop thinking that the person who broke your heart could heal it again.,0,0,0,0,1,0
deu_train_track_a_00726,"He doesn't have to mention it in connection with the contract. 7 weeks before starting parental leave by application is actually enough, that would be so rough in August. I would discuss it earlier, simply so that it can be planned well, but in any case only after signing the contract.",0,0,0,0,0,0
deu_train_track_a_00727,"Thank you for this AMA, just don't think about all the Heinis who want attention here. -Would you call yourself an addict? -What gives you Second Life that you don't have in real life? -Do you have the restrictions of the game world after some time on the valley or do you get along with it? -How many hours do you put weekly/daily into the game? -Do you have more social contacts in the game than outside of it? -Do you often meet other players irl?",0,0,0,0,0,0
deu_train_track_a_00728,"Brave, and you don't need to be afraid of it.",0,0,0,1,0,0
deu_train_track_a_00729,"2. No. I think that if we constantly try to feel complete through a partner, it will always trigger unhealthy dynamics and co-dependencies. And if the partner then no longer meets these expectations, then suddenly something is missing without us being able to name this something exactly. And zack booms, the relationship ends and we continue to search for the completeness of ourselves, but again in others.",0,0,1,0,1,0
deu_train_track_a_00730,"I have to add something. My friend knows about it, but thinks that I just have to get through it by tomorrow. I have often told him that I feel bad about how everyone is with me. He just thinks I should ignore it. He won't take me to his family anymore. Anyway, I didn't do anything from me. They don't like my friend inviting me often. I don't know. I always hear that they have talked about me. (I don't have much money, my friend and their family already really good money.)",0,0,0,0,1,0
deu_train_track_a_00731,"Strictly speaking, I also ran away before (at 12) - the youth office did but until I was 16, until they finally put me in a home. My parents were strict.. and strictly Muslim. I am an atheist and did not want my parents to marry me to XY, besides, I wanted to study and also to get out after 6 pm. To this day I run when I see them. Ask if there is anything interesting to ask :).",0,1,1,0,1,0
deu_train_track_a_00732,"To be honest, I wonder why the whole thing comes so suddenly for you. She seems to have told you again and again in the 3 years, what bothers her, but you seem to have ignored it and kept trying to bend it in a direction that she doesn't want to. Now you don't have to try to save anything anymore, you missed all the chances. She doesn't want to anymore, so the relationship is 100% over, whether you want it or not. So you can only learn from it and make it better next time.",0,0,0,0,0,0
deu_train_track_a_00733,Editor of tasteatlas to his staff (all unpaid interns): One of you googles into the fast 100 breads and randomly sorts out a leaderboard.,0,1,0,0,0,0
deu_train_track_a_00734,Does anyone have Bock On Unranked Casual?,0,0,0,0,0,0
deu_train_track_a_00735,Right-wing religious 简 highly interesting 的 just says right-wing extremes that would be rather the right word.,1,1,0,0,0,0
deu_train_track_a_00736,Boah .. was in the head full of missed .. I thought Leo finally made his promise and had a lawyer there,0,1,0,0,0,0
deu_train_track_a_00737,"Just make a quick anne wants to turn on, then you're just so irrationally angry that you forgot about the full moon again",1,0,0,0,0,0
deu_train_track_a_00738,"The Palestinians have lost well over 30,000 relatives, including over 13,000 children - under unimaginably cruel conditions ! It is YOUR own country in which they have been occupied, murdered, expelled since 1947/48 - to this day !!",1,1,0,0,1,0
deu_train_track_a_00739,Let him say that to the victims' family members right in the face.,1,1,0,0,1,0
deu_train_track_a_00740,"When I wanted to help you the other day, you insulted me at the end. Since then, you've opened 2 threads here again. Since I'm suffering from depression, it's not so nice to be treated like this. I'm just saying this because you're still complaining, but obviously don't want to take any help. I'm saying the same thing as last time: You're certainly not that ugly, and *if* is, that's no reason to have no friendships.",0,0,0,0,1,0
deu_train_track_a_00741,"After a few entries in your blog, I have to say that this is really hard. Would you use euthanasia if legal and easily possible? A personal question: do you know what you're going to die from? Sure, cancer, but what happens in your body that will trigger death? Just like a person who burns, doesn't die from fire, but from burned skin, flue gas poisoning or something like that.",0,0,0,0,1,0
deu_train_track_a_00742,"Disposable e-cigarettes. Absolute environmental sin (plastics, batteries, non-recyclable) and only intended for children. Each adult either has a ""real"" e-shisha or smokes cigarettes. Sooner or later they are also collected, but banning the disposable e-cigarettes would be an important step.",1,1,0,0,0,0
deu_train_track_a_00743,"Every time I'm depressed, I'm very close to the fact that life is objectively meaningless. Above all, I can't imagine that I myself will ever find a subjective sense for myself. If I'm feeling better, it doesn't itch me any more and I don't think about it anymore. In a hypothetical phase, it's like being wiped away. I always wonder if this senselessness in my life favors depression. How do you see it?",0,0,0,0,1,0
deu_train_track_a_00744,"Thank you for your openness and, above all, good luck and joy in your life. I would like to ask the following questions: 1. Do your age have different preferences, for example, when eating. Does one broccoli and the other not? 2. Do the age have different fears, as one has fear of heights the other has fear of spiders. 3. If you fall asleep as one of the ages, do you dream differently? 4. Please answer this question only if it is really ok.",0,0,0,0,0,0
deu_train_track_a_00745,"""Because you don't know what you're doing, there are no simple solutions as the Afd promises. Everyone in the AfD chooses, knows what they choose. Right-wing extremes who despise the democratic state, despise human rights...",1,1,0,0,0,0
deu_train_track_a_00746,thanks for lending me your bit bro,0,0,0,1,0,0
deu_train_track_a_00747,"uff. I can't understand at all. I mean, it's probably hard to visit now in Corona times, but why don't they ask you directly how you feel, if you need something etc.? very strange and very bad. hope they find out the causes and you're getting better soon. would like to give you a glass of sugared strawberries on the sick bed on behalf of my grandmother, that's just what my grandparents had done :/",0,0,0,0,1,0
deu_train_track_a_00748,The energy transition is becoming expensive. The expansion and conversion of the electricity grids could increase electricity prices by 20 cents by 2030. It is expected here by 2030 with costs of 500 billion euros. The entire conversion will devour between 1 and 2 trillion euros. There is nothing with a bullet ice!!.,1,0,1,0,0,0
deu_train_track_a_00749,Then the two poor women are not allowed to participate in the CIA study for cloaks?,1,0,0,0,1,0
deu_train_track_a_00750,It is absolutely impressive and shocking to run through it. I can't understand how we Germans can still choose AfD today.,0,1,0,0,1,0
deu_train_track_a_00751,">Both parents are very conservative (no sex before marriage) and want us to complete our respective Master's degrees before we get married. Nice for them, how much is this your problem? Why don't you move to your own apartment or at least a WG room? I don't know your financial situation, but if you think about hotel, mMn can also afford a WG room.",0,0,0,0,0,0
deu_train_track_a_00752,I'm already watching but no more official watch party from the team #SaveBreakingEven sounds good,0,0,0,1,0,0
deu_train_track_a_00753,"This would be such a typical case of ""What did the artist think of it?"".",0,0,0,0,0,1
deu_train_track_a_00754,All the professional artists I know hate it but okay,0,1,0,0,0,0
deu_train_track_a_00755,Instead of climate panic now war hysteria,1,1,0,0,0,0
deu_train_track_a_00756,"My goodness, the left is full of pants, and I'm buying Pampers shares now.",1,1,0,0,0,0
deu_train_track_a_00757,"Again and again I hear the accusation that I am a #Germany hater, just because I engage politically left-green. The opposite is the case: I love my country and want to do it even better. My commitment to social justice, environmental protection and solidarity is an expression of this love. Right is not a modern, sustainable future. Not here and nowhere! #LAUTagainstRechts",1,0,0,1,0,0
deu_train_track_a_00758,And politics in this country supports such a genocide and expulsion with weapons and money!!!,1,0,0,0,0,0
deu_train_track_a_00759,> Also the question comes up again if my complete contact termination was too hard. No. Was the only right one.,0,0,0,0,0,0
deu_train_track_a_00760,"No, not at all. I commute between faint anger in the day and great fear at night.",1,0,1,0,0,0
deu_train_track_a_00761,The first post in this sub where I don't feel bad to forgive an upvote. Very well described. I wish you a great future together.,0,0,0,1,0,0
deu_train_track_a_00762,"""It's incredibly expensive to be poor!"" via",0,0,0,0,1,0
deu_train_track_a_00763,"The hardest thing to do on the way home is not to be distracted... by food or tax or food... I don't care about women, but I don't care about food.",0,0,0,1,0,0
deu_train_track_a_00764,"Unfortunately, Friedrich Merz cannot be heard in the background as he cynically shouts ""Quicker!"".",1,1,0,0,0,0
deu_train_track_a_00765,"Was positively surprised, also by the potato/""wurst"" salads. I also find the cheese imitations funny. I will definitely get some ""wurst"" salad next time.",0,0,0,1,0,1
deu_train_track_a_00766,"If a beard accident was just avoided... ...you say there, ""This has gone well again""?",0,0,0,1,0,0
deu_train_track_a_00767,"Either you decide to be a Nazi, or you're decent, respectful, and intelligent.",1,1,0,0,0,0
deu_train_track_a_00768,"I have bought some extra breastfeeding parts and find them to breastfeed ultimately more annoying than my normal clothes. You have to shovel the openings with baby in your arm somehow! Instead, I prefer to wear normal, wide T-shirts, where I can either pull out my chest right up (if cut out far enough) or hold up the shirt below. Meanwhile, I don't care if anyone sees my chest with it. Otherwise: Vinted(app)!",0,1,0,0,0,0
deu_train_track_a_00769,"Pastry was also the first cake I baked without a baking mix, nice 1 kg of sugar, 1 kg of quark and 1/2 kg of butter, or something like that. And a little cocoa powder, of course.",0,0,0,1,0,0
deu_train_track_a_00770,GM .... your photos are always amazing,0,0,0,1,0,0
deu_train_track_a_00771,"This is dictatorship !!! Not in Germany, how many thinkers and the brown gang say it. We live here in a democracy",1,1,0,0,1,0
